status_id,status_message,link_name,status_type,status_link,status_published,num_reactions,num_comments,num_shares,num_likes,num_loves,num_wows,num_hahas,num_sads,num_angrys
209101162445115_1389260064429213,"""Under my leadership, UKIP will not be going soft. I will not get bogged down in any soggy centre. I am the radical leader of a radical party, and with the huge mandate the membership gave me, that is how it will stay."" - UKIP Leader Paul Nuttall MEP",Ukip won't be going soft on my watch. We will stay a truly radical party,link,http://www.telegraph.co.uk/news/2017/03/04/ukip-wont-going-soft-watch-will-stay-truly-radical-party/,2017-03-05 04:52:35,914,210,69,862,34,1,16,0,1
209101162445115_1388570334498186,London Assembly Member and UKIP Deputy Leader Peter Whittle & UKIP Leader Paul Nuttall address the UKIP regional conference at Weymouth Pavilion.,,video,https://www.facebook.com/UKIP/videos/1388570334498186/,2017-03-04 09:29:36,725,670,177,601,90,7,5,4,18
209101162445115_1388549024500317,From 2.30pm this afternoon we will be livestreaming our Party Leader Paul Nuttall MEP's speech preceded by Deputy Leader Peter Whittle's at the South West regional conference - we'll post the link when the video is live,,status,,2017-03-04 08:56:12,107,30,3,103,2,0,1,0,1
209101162445115_1387503924604827,"""UKIP have been saying for years that all students who are foreign nationals, including those from the EU, should pay their own University fees up front if they are studying in Britain. This is simple common sense.

""This is money which should all have been recovered, and could have paid for 15 brand new secondary schools. There is no excuse for this waste to continue: British money should be spent first on British people and services in this country, particularly in skills training for young people which has been neglected for far too long.""

Like if you agree with UKIP Education Spokesman David Kurten AM",One in four European Union citizens who study in England go home without paying a PENNY of their student loans,link,https://www.thesun.co.uk/news/2987186/one-in-four-european-union-citizens-who-study-in-england-go-home-without-paying-a-penny-of-their-student-loans/,2017-03-03 05:31:06,3554,403,1407,2916,26,47,23,9,533
209101162445115_1386814388007114,,Paul Nuttall MEP,photo,https://www.facebook.com/PaulNuttallMep/photos/a.365492593501771.126651.363704527013911/1413105582073795/?type=3,2017-03-02 09:43:52,343,49,0,334,7,1,1,0,0
209101162445115_1386042598084293,We believe St David's Day should be a Bank Holiday! Share if you agree!,Timeline Photos,photo,https://www.facebook.com/UKIP/photos/a.283591398329424.67830.209101162445115/1386042598084293/?type=3,2017-03-01 10:05:00,462,80,117,446,13,2,0,0,1
209101162445115_1386041131417773,"UKIP's very own Jonathan Arnott MEP will be stepping into the boxing ring at the York Hall in London - otherwise known as the home of boxing - to raise money for charity.

He's seeking to raise money for the Ally Cadence Trust for Spinal Muscular Atrophy (ACT for SMA), after a friend and colleague lost their baby daughter to the condition in October. As a relatively small charity, the Ally Cadence Trust don't have the same resources that some of the 'household name' charities have. It also means that that every penny will end up going to a worthwhile cause.

You can find out more about the event on his website at: http://www.jonathanarnott.co.uk/2017/03/jonathan-arnott-steps-into-the-ring-for-charity/ and if you would like to donate you can at www.justgiving.com/arnott",Jonathan Arnott MEP,link,https://www.justgiving.com/fundraising/arnott,2017-03-01 10:03:04,103,18,1,100,3,0,0,0,0
209101162445115_1381349658553587,,Paul Nuttall MEP,link,https://www.facebook.com/PaulNuttallMep/posts/1406866659364354,2017-02-24 06:08:29,1234,489,0,1121,24,0,13,71,5
209101162445115_1380076962014190,Polls close in just one hour. There's still time to vote for Paul Nuttall in Stoke Central and Fiona Mills in Copeland.,Timeline Photos,photo,https://www.facebook.com/UKIP/photos/a.283591398329424.67830.209101162445115/1380076962014190/?type=3,2017-02-23 16:59:00,273,93,8,253,10,0,8,1,1
209101162445115_1380075362014350,Polls close in only three hours! If you live in Copeland or Stoke-on-Trent  your vote will really make a difference so do go out and vote UKIP today.,Timeline Photos,photo,https://www.facebook.com/UKIP/photos/a.283591398329424.67830.209101162445115/1380075362014350/?type=3,2017-02-23 13:59:11,620,117,72,581,33,0,4,0,2
209101162445115_1380075002014386,Vote for Paul Nuttall today in Stoke Central and make Stoke-on-Trent the capital of change!,Timeline Photos,photo,https://www.facebook.com/UKIP/photos/a.283591398329424.67830.209101162445115/1380075002014386/?type=3,2017-02-23 08:18:00,942,120,96,888,43,1,8,0,2
209101162445115_1380574581964428,As UKIP Leader Paul Nuttall says let's trade the clapped out Labour banger on bricks for a UKIP tank. Vote for change. Vote UKIP today.,Paul Nuttall MEP,link,https://www.theguardian.com/politics/2017/feb/22/labour-is-clapped-out-banger-on-bricks-according-to-stoke-focus-group?CMP=oth_b-aplnews_d-2,2017-02-23 08:15:09,728,72,0,664,34,0,30,0,0
209101162445115_1380488085306411,Labour finally admit they have FAILED on social housing in Stoke-on-Trent. Only Paul Nuttall will ensure a new golden age of social housing.,Labour finally admit they have FAILED on social housing,video,https://www.facebook.com/UKIP/videos/1380488085306411/,2017-02-23 05:46:39,838,109,171,766,25,4,33,1,9
209101162445115_1380074445347775,Polls are now open in Copeland and Stoke Central. If you live in those areas your vote will really make a difference - so go out and vote UKIP today!,Timeline Photos,photo,https://www.facebook.com/UKIP/photos/a.283591398329424.67830.209101162445115/1380074445347775/?type=3,2017-02-23 02:02:01,1133,350,253,1062,59,0,9,0,3
209101162445115_1379832485371971,"The Brexit referendum victory has put Britain on a new trajectory – an exciting new path that will allow our country much more freedom to tackle its problems and to seek out new opportunities in the wider world. We are a great country, but one with many problems and frustrations.

Our new policy document, 'New Path for Britain' has begun to determine our direction of travel in several key policy areas – identifying what the challenges are and some key changes we need to see.

The purpose of it is to set out that broad direction of travel so that the British people can see that under Paul Nuttall's leadership UKIP is going to be the patriotic party that advances common-sense solutions to many of the problems that are holding them back in their lives.

Download it here: http://www.ukip.org/new_path_guide_to_ukip_policy",Paul Nuttall announces a New Path for Britain: our direction of travel in key areas,link,http://www.ukip.org/new_path_guide_to_ukip_policy,2017-02-22 15:24:00,605,77,91,577,25,2,1,0,0
209101162445115_1379985115356708,"UKIP's Staffordshire MEP Jill Seymour: ""Our message to the Stoke Central electorate is clear – we will not take the people for granted, as the Labour party has done now for too many years.

""Uncontrolled immigration has put huge pressure on the city's housing, waiting times at hospitals are too long, and many parents are struggling to get the right school places for their children.

""These are the kind of issues which are important to the working class people of Stoke on Trent – not party political grandstanding in Westminster. And Paul Nuttall is a man who appreciates and understands them.""",Jill Seymour MEP: Paul Nuttall understands and appreciates the working class people of Stoke-on-Trent,link,https://www.politicshome.com/news/uk/political-parties/uk-independence-party/opinion/european-parliament/83565/jill-seymour-mep,2017-02-22 13:31:50,1190,93,162,1149,40,0,1,0,0
209101162445115_1379770488711504,"UKIP Defence Spokesman Bill Etheridge, ""These repeated compensation payments are funding terrorism.

""With the recent cases opened about former servicemen and their actions in theatres of war, to the tank-chasing lawyers and now compensation paid to former detainees, we have seen too much money wasted. These are funds that should have gone towards defending our citizens.

""The United States would not have gone through all the time, trouble and international criticism if they had not suspected the detainees were capable of committing atrocities.

""It is time to stop the thinking that there is good in everyone and realise that there are people out there that wish to do us harm.""","Bill Etheridge slams do-gooders for ""funding terrorism""",link,http://www.ukip.org/_bill_etheridge_slams_do_gooders_for_funding_terrorism,2017-02-22 11:59:04,1454,138,276,1350,9,10,1,2,82
209101162445115_1379834752038411,Make sure you vote UKIP on Thursday 23rd February,Timeline Photos,photo,https://www.facebook.com/UKIP/photos/a.283591398329424.67830.209101162445115/1379834752038411/?type=3,2017-02-22 09:16:10,1765,141,434,1670,75,0,8,0,12
209101162445115_1379742692047617,Stoke Central needs a national voice that can take their concerns to Westminster and be heard. The people of Stoke-on-Trent can vote in a new era tomorrow.,Paul Nuttall MEP,video,https://www.facebook.com/PaulNuttallMep/videos/1404679556249731/,2017-02-22 06:54:36,878,118,0,825,49,2,0,1,1
209101162445115_1378857392136147,"The establishment are fighting to save themselves. The return of EU fanatics Mandelson and Blair spells danger. They want to ignore the vote, they want to keep us in the European Union. We need a strong voice on Brexit. Put an✖️in the box, vote UKIP on February 23rd.

Read Paul Nuttall's rallying cry for Brexit in today's Daily Express.","The stench of a stitch-up if Lords try to delay Brexit, says Paul Nuttall",link,http://www.express.co.uk/comment/expresscomment/769905/brexit-lords-delay-stoke-on-trent-by-election,2017-02-21 07:08:00,1541,206,314,1326,38,1,2,0,174
209101162445115_1378821272139759,"It is a national disgrace that an estimated 7,000 military veterans are being cast aside by local authorities across the country and forced to sleep rough on Britain's streets.

Like and share if you agree with UKIP Leader Paul Nuttall",Paul Nuttall's Ukip DEMANDS Theresa May ends 'disgraceful' treatment of military veterans,link,http://www.express.co.uk/news/uk/769872/Paul-Nuttall-Ukip-military-veterans-war-Armed-Forces-Covenant-Homes-for-Heroes-campaign,2017-02-21 02:59:34,2447,131,853,2259,34,1,0,4,149
209101162445115_1378051532216733,"Britain will be dragged into its most serious constitutional crisis for over a century if the House of Lords tinkers with Brexit says UKIP Leader Paul Nuttall.

""What we have here is the least democratic forum in British politics potentially interfering with the most democratic one - the result of a referendum. The British people have made their choice. For the Lords - which is stuffed with pro-EU timeservers and from which UKIP has been systematically excluded - to mess around with it would be both outrageous and dangerous.

""The arrogance of Labour peers such as Lord Mandelson and Lord Hain is breath-taking. Unelected figures who set themselves against the will of the people are being grossly irresponsible.""",,status,,2017-02-20 04:23:36,1164,248,220,950,17,4,3,1,189
209101162445115_1376317495723470,"The Labour Party like to say OUR NHS, what they mean is they think they own the NHS.

It's the Party of: 
Mass Private Financing (PFI)✔️
The Mid Staffs Hospital Scandal ✔️
The Hospital Superbug (MRSA)✔️

Put an ✖️in the box Vote UKIP on February 23rd",Timeline Photos,photo,https://www.facebook.com/UKIP/photos/a.283591398329424.67830.209101162445115/1376317495723470/?type=3,2017-02-19 09:52:00,3171,326,825,3005,138,4,18,0,6
209101162445115_1377194955635724,"In Stoke-on-Trent and elsewhere UKIP is seeking to represent communities forgotten by a political elite.

READ: UKIP Leader and Stoke Central candidate Paul Nuttall in The Telegraph today:",Timeline Photos,photo,https://www.facebook.com/UKIP/photos/a.283591398329424.67830.209101162445115/1377194955635724/?type=3,2017-02-19 05:30:34,518,84,52,481,28,2,6,1,0
209101162445115_1376321839056369,"UKIP Scotland MEP David Coburn has slammed the SNP's plot to keep Scotland in the EU and labelled Nicola Sturgeon's plans as ""tosh"". 

""It can't happen. I had a meeting with President Schulz and he said quite clearly, and he'd just had a meeting with her, and he did not agree to anything.

""Britain came in as one country and it has to leave as such. He doesn't want the Balkanisation of the UK.

""What she is saying is tosh, she's misleading the Scottish people. It's just not possible.""","Nicola Sturgeon told by Brussels bigwigs Scotland CANNOT stay in the EU, Ukip claims",link,http://www.express.co.uk/news/uk/768923/Nicola-Sturgeon-Brussels-Martin-Schulz-European-Union-Brexit-Ukip-Bolt-David-Coburn,2017-02-18 12:59:00,1455,301,273,1064,33,3,345,1,9
209101162445115_1376477529040800,"Labour have taken the people of the UK, in places like Stoke-on-Trent and Copeland, for granted. Labour's mass immigration policies have put untold pressure on housing, parents struggle to get the right school place for their children and A&E waiting times are too long.

All Labour do is trash our country, sneer at our flag and Jeremy Corbyn refuses to sing the national anthem. They would rather give back the Falklands than build one more Council house; they would prosecute British servicemen rather than condemn the IRA and keep Britain in the EU while ignoring the wishes of the British people.",,status,,2017-02-18 12:24:18,1537,162,311,1375,27,1,6,3,125
209101162445115_1376293459059207,"Vote Paul Nuttall for Stoke Central on February 23rd. 

Make sure you like and share this to help make history next week!",Timeline Photos,photo,https://www.facebook.com/UKIP/photos/a.283591398329424.67830.209101162445115/1376293459059207/?type=3,2017-02-18 08:08:17,4066,239,958,3887,151,2,24,0,2
209101162445115_1375225012499385,UKIP Party Chairman Paul Oakden and UKIP Leader Paul Nuttall address Spring Conference 2017,,video,https://www.facebook.com/UKIP/videos/1375225012499385/,2017-02-17 06:43:21,1220,688,235,1023,167,5,18,1,6
209101162445115_1375157759172777,"UKIP Deputy Leader Peter Whittle exclusively interviewed by Westmonster ahead of today's Spring Conference: ""I don't want to live in a country where a highly successful young Olympian messes around and finds himself on trial by media with his career threatened simply because he was mocking a religion. We cannot be in a position in this country where you cannot mock a series of ideas or belief systems. It's part of our culture.""",UKIP's Deputy Leader Peter Whittle: We will fight for British culture,link,http://www.westmonster.com/ukips-deputy-leader-peter-whittle-we-will-fight-for-british-culture/,2017-02-17 05:11:53,1640,128,166,1547,85,3,5,0,0
209101162445115_1374260529262500,"UKIP Defence Spokesman Bill Etheridge: ""With the twin threats of Islamic fundamentalism and a resurgent Russia, it is imperative that all NATO nations meet or exceed the agreed 2%.

""We have a crisis in Armed Forces recruitment despite government protestations there is no problem. We have a severe lack of heavy artillery, of operational submarines, carriers without aircraft and insufficient infantry fighting vehicles.

""The UK should not be in a position where an uplift in GDP means we miss our 2% target. We should be spending much more than that because we have a ground to make up after years of deficiencies. Unfortunately after years of Blairite internationalism where we send our troops to everyone else's conflicts and the mistaken belief that spending billions on foreign aid is better than defence spending, we have insufficient numbers of armed forces who are not properly equipped, and a Defence procurement system which is not fit for purpose.""",UKIP Defence Spokesman calls for European countries to increase defence spending,link,http://www.ukip.org/ukip_defence_spokesman_calls_for_european_countries_to_increase_defence_spending,2017-02-16 12:34:01,657,141,80,619,15,0,1,0,22
209101162445115_1374271335928086,"UKIP Leader Paul Nuttall MEP: ""We can replace Labour as the patriotic voice of working people, and we will do so. It will take time but we can make that first step on February the 23rd – and I genuinely believe that we will.

""If people go out and vote for Labour again and get a Labour MP, nothing will change. It will be the same, time and time again. It will be a voice in the wilderness. It will be lobby fodder.

""I guarantee, and I say this to the residents, If you go out and vote for me – things will change and things will change quickly.""

Will you be coming to Stoke to help get Paul elected to Parliament?",Nuttall promises to smash Labour in Stoke and send shockwaves through the establishment,link,http://www.express.co.uk/news/politics/768206/Paul-Nuttall-Ukip-Labour-Stoke-on-Trent,2017-02-16 09:39:27,1565,196,151,1483,64,1,15,0,2
209101162445115_1374124575942762,"Memos leaked to a British newspaper state that ""MEPs have drafted seven provisions to be included in Britain's ""exit agreement"", including the stipulation that there will be ""no increase to the UK's share of fishing opportunities for jointly fished stocks*.""

Speaking of the leaked memos, UKIP Fisheries Spokesman Mike Hookem said, ""This is nothing more than the EU wanting to have their cake and eat it. Time and again we are told the UK will not get any 'special deals' post-Brexit. Well, in that case, it should work both ways, and UK waters must return to UK control regardless of what the EU want!""

""Anything less than getting back full control of our waters post-Brexit will be another utter betrayal of the fishing industry. Fishermen knew in 1972 that their industry had been stolen from them by politicians desperate to get into the EEC 'club' and Brexit is our opportunity to retake control our waters.""",,status,,2017-02-16 08:22:00,1419,260,298,1162,20,3,3,2,229
209101162445115_1374093142612572,"WATCH: Paul Nuttall MEP at an impromptu public meeting in Eaton Park in Stoke-on-Trent. 

As Paul says when Labour and their allies are beginning to play the man not the ball you know they must be worried!",Jill Seymour MEP,video,https://www.facebook.com/JillSeymourUKIP/videos/1153491148092737/,2017-02-16 05:36:16,790,139,0,740,37,1,10,0,2
209101162445115_1371584486196771,"Only Paul Nuttall and UKIP will:

- Control immigration
- Give local people priority for local housing
- Cut foreign aid and invest in the NHS",Timeline Photos,photo,https://www.facebook.com/UKIP/photos/a.283591398329424.67830.209101162445115/1371584486196771/?type=3,2017-02-15 12:36:01,2662,339,571,2534,94,0,23,0,11
209101162445115_1372200766135143,"UKIP Leader and Stoke Central Candidate Paul Nuttall MEP: ""Brexit will be great for Stoke-on-Trent. There will be a huge boost to this industry, from us being able to sign free trade deals with the United States and with the countries of the Far East.

""But at the same time another boost will come from us being able to protect ourselves from Chinese dumping, by setting our own tariffs.""",UKIP says Brexit will give huge boost to ceramics industry,link,http://www.stokesentinel.co.uk/ukip-says-brexit-will-give-huge-boost-to-ceramics-industry/story-30132968-detail/story.html#ZX2Jg7fLmh2mIuW1.99,2017-02-14 05:40:14,728,211,65,698,24,1,5,0,0
209101162445115_1371737252848161,"The Sentinel and Staffs TV Stoke Central by-election debate featuring Paul Nuttall MEP is about to start...

Watch here:",The Big By-Election Debate,video,https://www.youtube.com/watch?v=qKlnY4EQtDI,2017-02-13 13:42:48,152,55,12,142,8,1,0,0,1
209101162445115_1371454259543127,"UKIP Brexit Spokesman Gerard Batten MEP: ""Labour stopped representing the working class a long time ago. Stoke Central needs Paul as their MP so that he can speak up for their interests and for the regeneration of Stoke-on-Trent.

""Brexit is in danger of being betrayed, and who better to demand a speedy exit from the EU in the House of Commons than than UKIP's Leader.

""The 70% of Stoke's voters who voted to leave the EU will endanger that decision if they elect another Labour MP.""",Watch Gerard Batten and Paul Nuttall today in Stoke.,video,https://www.facebook.com/UKIP/videos/1371454259543127/,2017-02-13 06:01:10,1782,855,397,1555,182,5,9,4,27
209101162445115_1370949292926957,WATCH: Paul Nuttall explain why the people of Stoke Central should vote for him next week,,video,https://www.facebook.com/UKIP/videos/1370949292926957/,2017-02-13 04:59:27,844,96,87,804,36,0,2,1,1
209101162445115_1369118333110053,"""It is a matter of priorities and what I find at the moment morally reprehensible, is that we are facing this situation in this wonderful institution of the NHS, at the same time that we are sending abroad twelve to sixteen billion a year in foreign aid.

""We would bring foreign aid spending down to about 0.2 per cent, which would mean part of it would go into the National Health Service and part of it into social care.""

Do you agree with UKIP's Deputy Leader Peter Whittle? Should we prioritise OUR NHS over foreign aid to countries like India and China who have their own space programmes?",Morally reprehensible! UKIP deputy leader condems foreign aid spending during NHS crisis,link,http://www.express.co.uk/news/uk/765567/UK,2017-02-11 10:16:01,3905,568,1072,3648,128,5,3,4,117
209101162445115_1369812269707326,"Veterans are finishing top of housing waiting lists and still not getting a roof over their heads because the Armed Forces Covenant is simply not working. The Covenant, signed by every local authority, is supposed to give military heroes priority housing and health care – but not only are veterans being forced to sleep rough, they are waiting years for treatment for mental problems caused by their stint in the forces.

There is £30m worth of funding made available by Government, but many councils are not even applying for it, despite desperate, traumatised veterans begging for help.

Sign the Homes for Heroes petition to force the Government to look after our brave veterans: https://petition.parliament.uk/petitions/182429",Britain's SHAME: Veterans 'fobbed off' by council sleep rough and attempt suicide,link,http://www.express.co.uk/news/uk/765859/Armed-forces-military-veterans-Homes-for-Heroes-petition-mental-Bolton-homeless-suicide,2017-02-11 04:23:39,1760,233,939,1170,6,3,2,100,479
209101162445115_1369093343112552,"UKIP MP Douglas Carswell: ""Leaving the EU should mean leaving the jurisdiction of the European courts, but if this proposal is allowed to pass, and we sign up to the Unified Patent Court Agreement, then we will still find ourselves subject to judges at the European Court of Justice in Luxembourg when it comes to intellectual property.

""We would be required to accept the supremacy of EU law in its entirety with regard to any disputes within the jurisdiction of the UPC, including competition law, fundamental rights arising under the Charter, as well as any specific patent rules contained within EU Directives.
 
""How countries protect intellectual property is also often a key issue when negotiating trade deals, so allowing the EU to decide these matters for us will make it much harder for the UK to negotiate the free trade deals we need with big dynamic economies outside Europe.

""No wonder the Europhiles wanted to pass this into law under the radar, without proper debate. It has the potential to drive a huge stake into the heart of Brexit.""",EXPOSED: Secret plan to tie Britain to EU after Brexit is being kept 'under the radar',link,http://www.express.co.uk/news/politics/765411/brexit-plan-european-treaty-britain-trade-deals-negotiations-douglas-carswell,2017-02-10 10:24:00,1748,417,1118,873,1,74,4,11,785
209101162445115_1369060419782511,"UKIP Defence Spokesman Bill Etheridge MEP: ""This story underlines two vital points that I have been making over the last few weeks. Firstly, that under-investment in our military capacity has left the cupboard bare - the slightest problem exposes the lack of back-up. Secondly, our defence procurement, headed by Tony Douglas, on a salary and bonus package in excess of £500k a year is definitely sub-standard.

""We now have ships that break down in warm water, aircraft carriers with no aircraft and not a single serviceable submarine.

""Quite honestly the man should do the honourable thing and resign. He has failed the troops, failed the tax-payer and failed the country!""",All of our submarines are missing,link,http://www.ukip.org/all_of_our_submarines_are_missing,2017-02-10 06:08:18,988,176,265,712,3,51,6,5,211
209101162445115_1368434686511751,"The full agenda for next week's Spring Conference in Bolton has now been finalised - http://www.ukip.org/conference_agenda - and we are pleased to say that it is packed with the Party's talent. Within a single day on Friday 17th February we will have our Leader, Paul Nuttall MEP, our former leader, Nigel Farage as well as a raft of policy spokesmen. 

The next day we journey to Stoke to help Paul Nuttall's bid to win that crucial by-election on February 23.

So please, make sure you book your tickets now and encourage others to do likewise as we head towards this momentous couple of days. We are really in place to make history, and we'd love you to be part of it. We'll see you next week!",Timeline Photos,photo,https://www.facebook.com/UKIP/photos/a.283591398329424.67830.209101162445115/1368434686511751/?type=3,2017-02-10 03:03:01,526,43,59,505,20,1,0,0,0
