status_id,status_message,link_name,status_type,status_link,status_published,num_reactions,num_comments,num_shares,num_likes,num_loves,num_wows,num_hahas,num_sads,num_angrys
209101162445115_1368295666525653,"On BBC Question Time tonight on BBC 1 at 10:45pm will be UKIP Deputy Leader Peter Whittle AM.

Make sure you tune in!",Timeline Photos,photo,https://www.facebook.com/UKIP/photos/a.283591398329424.67830.209101162445115/1368295666525653/?type=3,2017-02-09 14:57:01,358,64,31,342,15,1,0,0,0
209101162445115_1368583549830198,Nigel Farage talking immigration and refugees on LBC.,LBC,video,https://www.facebook.com/LBC/videos/10154745735256558/,2017-02-09 14:32:12,996,168,0,933,54,1,2,0,6
209101162445115_1368201636535056,"PLEASE READ, SUPPORT & SHARE

Veterans must get the help and support they were promised under the armed forces covenant.

As part of Mike Hookem's campaign with the Daily Express, a petition has been launched to force a change in the law and get veterans the priority they deserve. 

Sign it at: https://petition.parliament.uk/petitions/182429",Petition: Give military veterans priority housing and mental health care,link,https://petition.parliament.uk/petitions/182429,2017-02-09 10:12:01,1919,96,1158,1828,50,1,1,27,12
209101162445115_1368353903186496,"Accident and emergency patients in England experienced the worst month of delays this winter in the 13 years since the four-hour target was introduced, a leaked document suggests. The figures, compiled by regulator NHS Improvement, also reportedly suggest a record high for people waiting more than 12 hours for a bed after being seen in A&E.

The target, introduced in 2004, states that 95% of patients must be seen and either admitted or discharged in under four hours. But the document suggests that of 1.4 million visits in January, only 82% were dealt with within the time frame - while more than 60,000 people waited for up to 12 hours for a bed after being told they must be admitted.

UKIP's NHS Champion Suzanne Evans responds...",Timeline Photos,photo,https://www.facebook.com/UKIP/photos/a.283591398329424.67830.209101162445115/1368353903186496/?type=3,2017-02-09 09:07:58,311,137,91,236,1,2,0,19,53
209101162445115_1368204973201389,If you agree with UKIP Leader Paul Nuttall MEP then sign this petition to get better housing and mental health care for veterans: https://petition.parliament.uk/petitions/182429,Paul Nuttall MEP,link,http://www.express.co.uk/news/uk/762456/British-military-veterans-armed-forces-covenant-army-navy-RAF-Homes-for-Heroes-campaign,2017-02-09 05:04:31,1562,140,0,1326,14,3,0,63,156
209101162445115_1367477119940841,Watch Nigel Farage and UKIP Leader Paul Nuttall MEP speak in Stoke-on-Trent.,Nigel Farage,video,https://www.facebook.com/nigelfarageofficial/videos/1252519571462310/,2017-02-08 07:24:01,1282,96,0,1194,64,2,12,0,10
209101162445115_1365754180113135,Paul Nuttall MEP & Nigel Farage - Live from Stoke.,,video,https://www.facebook.com/UKIP/videos/1365754180113135/,2017-02-06 14:34:40,3060,4830,497,2259,522,21,71,13,174
209101162445115_1365508676804352,"Margot Parker MEP has backed the worldwide day of zero tolerance on FGM. The UKIP MEP and the party's spokesman for Women and Equalities supported the United Nations call for more action to end the ""barbaric practice."" The day of action follows reports by Plan International UK that between April 2015 and March last year, doctors assessed 8,656 cases and recorded thousands of new historic cases.

""FGM has been illegal in the UK for more than 30 years - including if girls are sent 'home' to be mutilated in the name of culture. Despite robust legislation existing to stop this abuse from occurring, there has not been a single conviction in all that time.

""The practice is barbaric and is something we should, as a society, make clear is not acceptable under any circumstances and politically correct cultural sensitivities be damned.

""I support the United Nations call and the campaigns to end this practice and end it quickly.""",Margot Parker backs worldwide day of zero tolerance on FGM,link,http://www.ukip.org/margot_parker_backs_worldwide_day_of_zero_tolerance_on_fgm,2017-02-06 09:17:48,916,183,198,856,24,0,2,2,32
209101162445115_1363794936975726,WATCH: Nigel Farage and Paul Nuttall MEP campaign in Stoke-on-Trent.,Nigel Farage,video,https://www.facebook.com/nigelfarageofficial/videos/1248513388529595/,2017-02-04 09:08:33,2709,206,0,2545,152,6,3,0,3
209101162445115_1361263493895537,Watch Nigel Farage give the EU a piece of his mind.,Nigel Farage,video,https://www.facebook.com/nigelfarageofficial/videos/1246137162100551/,2017-02-01 13:13:28,4057,664,0,3608,324,20,100,0,5
209101162445115_1360088947346325,"UKIP Leader Paul Nuttall MEP: ""Labour may well have founded the NHS in 1948, but today they have come to resemble an abusive parent.

""I refuse to be hectored by a party that oversaw the Mid Staffs scandal. A scandal for which no one in senior management was sacked! I refuse to be lectured to by a party that allowed MRSA to become commonplace on our wards. I refuse to be accused of wanting to privatise the NHS by a party that actually did privatise 5% of our health service when they were in power.

""I also refuse to take criticism from a party whose two most prominent members of the House of Lords – Winston and Warner – have called for people to be charged to see their GP. And finally, I refuse to take lessons from a party that has saddled the NHS with a debt of nearly 80 billion pounds through the signing of crazy PFI contracts.

""I now want to make something crystal clear: UKIP has never and will never – under my leadership – enter any election calling for the privatisation of the NHS. Full stop. I want to repeat this: UKIP will never – under my leadership – enter any election calling for the privatisation of the NHS. Period.""",,status,,2017-01-31 07:40:14,1316,170,296,1245,58,3,2,0,8
209101162445115_1359465920741961,"Defence Spokesman Bill Etheridge: ""For too many years, the job of defending our country has been Cinderella with the ugly sisters of foreign aid and throwing money at unreformed projects soaking up billions of taxpayers money. Report after report has shown the Ministry of Defence is not fit for purpose yet Mr Cameron rewarded the Secretary of State for Defence with a knighthood, probably for backing 'remain' in the referendum.

""It is clear to me that our Armed Forces are woefully underfunded with rock bottom morale and a crisis in recruitment. We could not defend ourselves against an attack from a country like Russia and we have spent the last few years running down our defences at the expense of tying ourselves into arrangements with other countries, predominantly France, and yet still acting as global policeman following the disastrous Blair doctrine of interfering internationalism.""

""It is time defence of the realm was the government's number one priority and that means proper equipment, stopping the harassment of our troops by IHAT and a massive uplift in defence spending.""",UKIP: 'MoD Not Fit For Purpose' | Forces TV,link,http://www.forces.tv/26607302,2017-01-30 11:59:57,1319,150,261,1198,41,5,2,5,68
209101162445115_1359219114099975,"WATCH: UKIP Leader Paul Nuttall MEP and Suzanne Evans set out our stall on the NHS.

UKIP has never and will never – under Paul Nuttall's leadership – enter any election calling for the privatisation of the NHS. Full stop.",,video,https://www.facebook.com/UKIP/videos/1359219114099975/,2017-01-30 05:59:22,2099,929,507,1852,193,3,11,3,37
209101162445115_1357690997586120,Labour cannot be trusted to protect the health service says UKIP Leader Paul Nuttall,,status,,2017-01-28 08:01:20,654,192,104,620,20,0,10,1,3
209101162445115_1357668064255080,"Our Leader Paul Nuttall MEP who is standing as our candidate in Stoke-on-Trent has today opened the by-election Campaign Shop.

Going forward, the Shop (at 1 Piccadilly, Hanley, Stoke on Trent ST1 1DB) will be open daily – Sundays included – from 8am till late. If you can come on a weekday then please do. There is something for everyone to do, canvassing, leafleting, market stalls, a tour of pubs and talking to the public.

This is the best opportunity for UKIP to win a seat in Westminster.
We can win here but only with your HELP – Paul needs you!

Let's continue to make history for our Party and our country.",Photos from UK Independence Party (UKIP)'s post,photo,https://www.facebook.com/UKIP/photos/a.283591398329424.67830.209101162445115/1357667540921799/?type=3,2017-01-28 07:06:39,1502,177,144,1441,57,0,2,0,2
209101162445115_1357195330969020,"Britain should not be doing what the EU tells us anymore. 

Share Nigel Farage's video.",Nigel Farage,video,https://www.facebook.com/nigelfarageofficial/videos/1241184245929176/,2017-01-27 16:16:47,3667,284,0,3358,196,3,105,0,5
209101162445115_1355669787788241,"UKIP Defence Spokesman Bill Etheridge: ""Figures I have seen show that the British Army is struggling to reach its recruitment needs, with the average across the infantry line reaching only 45 per cent in November of last year. 

""This means that jobs are not done or soldiers have double jobs. Yet we see that instead of addressing the shortfall in recruits, the government has targets for women and BAME recruitment where a military career holds less appeal rather than on getting the vacancies filled by people who can pass the course and want to serve their country.""",British Army IN CRISIS: Major concerns as recruitment numbers plummet by 31 PER CENT,link,http://www.express.co.uk/news/uk/758672/British-Army-Crisis-as-recruiting-drops-31-per-cent-in-8-months,2017-01-26 11:01:33,582,452,207,373,3,28,13,22,143
209101162445115_1355515951136958,,Peter Whittle AM,link,http://www.express.co.uk/news/uk/758849/Peter-Whittle-Ukip-calls-out-Remainers-blocking-Brexit,2017-01-26 07:28:32,1054,171,0,903,20,2,7,4,118
209101162445115_1355459964475890,"""The NHS needs a short, sharp cash injection and we're the only party that'll say where it'll come from. It'll come from the foreign aid budget, which is now costing the British people £30 million a day. I bet you if you polled people up and down the country — particularly in this constituency — and asked them 'do you want a foreign aid budget that's going to cost £15 billion by the end of this parliament given to countries which in some cases are richer than ourselves? or do you want it to be spent on the NHS? I'm telling you: 100% would rather it spent on the NHS and that's UKIP's policy.""  - Paul Nuttall MEP",Paul Nuttall interview: UKIP will take Stoke from 'lobby-fodder' Labour,link,http://uk.businessinsider.com/ukip-leader-paul-nuttall-interview-stoke-by-election-brexit-labour-2017-1,2017-01-26 05:49:06,3144,348,641,2994,130,2,11,0,7
209101162445115_1354595447895675,"Watch UKIP Deputy Leader Peter Whittle AM interview on RT International - We have had a democratic vote, it almost beggars belief that the establishment would try and stop Brexit!",,video,https://www.facebook.com/UKIP/videos/1354595447895675/,2017-01-25 08:55:59,597,112,103,520,7,3,2,1,64
209101162445115_1354441521244401,"The politicians are meant to serve us, we don't serve them.

Do you agree with Nigel Farage?",LBC,video,https://www.facebook.com/LBC/videos/10154694812406558/,2017-01-25 05:41:03,1554,160,0,1479,53,1,2,2,17
209101162445115_1353837984638088,"It seems Mark Reckless rattled the First Minister of Wales, do you agree?",Mark Reckless,video,https://www.facebook.com/markreckless/videos/10154747349686068/,2017-01-24 15:44:13,911,224,0,785,34,2,87,1,2
209101162445115_1353719277983292,"UKIP Leader Paul Nuttall MEP has said the Supreme Court's decision to deny the Government's appeal and insist that Parliament vote on the triggering of Article 50 would not jeopardise Brexit.

""This decision is hardly a surprise but in the end it will make no real difference. The will of the people will be heard, and woe betide those politicians or parties that attempt to block, delay, or in any other way subvert that will. 

""Other than making clear that this is a decision of the whole United Kingdom, rather than its constituent parts, what we can clearly see is that it will embolden those who rail against the decision of the people. It may give heart to those in the EU, used as they are to ignoring their own people, to attempt to play hard ball in the negotiations. 

""But in the end I am convinced that though this skirmish has been lost in the courts, the war will be won.""",,status,,2017-01-24 13:08:18,1050,148,99,995,36,3,5,0,11
209101162445115_1352683094753577,WATCH: We're handing over money in foreign aid to countries that are richer than ourselves. That money could be spent on our schools and hospitals says Paul Nuttall MEP,Paul Nuttall MEP,video,https://www.facebook.com/PaulNuttallMep/videos/1375945435789810/,2017-01-23 16:14:38,4261,382,0,3683,78,15,1,8,476
209101162445115_1352382621450291,"Quite simply, Labour, especially the Labour of Corbyn and Abbott and Thornberry, has betrayed the English working class says UKIP Leader Paul Nuttall MEP  

Labour's leadership hate the idea of English national identity and their continued support for open door immigration and crude multiculturalism has undermined social solidarity.",Paul Nuttall claims Labour has 'betrayed the English working class',video,http://www.dailymail.co.uk/news/article-4145858/Paul-Nuttall-claims-Labour-betrayed-working-class.html,2017-01-23 10:17:21,2605,258,372,2496,76,3,17,3,10
209101162445115_1351484968206723,"In the Stoke Central by-election UKIP will be campaigning for jobs and housing for local people, for strong law and order, and against mass uncontrolled immigration.",Paul Nuttall MEP,video,https://www.facebook.com/PaulNuttallMep/videos/1374488232602197/,2017-01-22 14:11:24,1428,134,0,1357,55,2,13,0,1
209101162445115_1351254158229804,"Having forced the British establishment to give the people the right to decide on taking back political control from an emerging United States of Europe, UKIP can now make the traditional virtues of civic and national pride powerful forces for good in our society once more. 

We will be making the argument in the weeks ahead for reducing the foreign aid budget by billions and ploughing that money into helping our NHS and solving the crisis in social care for the elderly. I am convinced that the best way to assist developing countries is not to keep them on a drip feed of aid that often props up corrupt regimes, but instead to open up our markets to their produce by signing free trade deals with them --- Paul Nuttall MEP

Share this if you agree with Paul and UKIP's common sense proposals.",,status,,2017-01-22 08:17:45,1950,146,564,1870,69,5,2,1,3
209101162445115_1350635404958346,"""I am asking the people of Stoke-on-Trent Central to lend me their support so we finish the job on Brexit, bring our money home and secure our borders. Things have really got to change.

""With one of the largest Leave votes in last year's Referendum, Stoke is already the capital city of Brexit, we can together make it the capital of change.

""Love Stoke, vote UKIP."" - Paul Nuttall MEP","Nuttall: Stoke is capital city of Brexit, can become capital of change",link,http://www.westmonster.com/nuttall-this-by-election-is-all-about-making-the-voice-of-the-people-in-stoke-heard/,2017-01-21 15:26:22,1467,128,168,1398,58,0,6,0,5
209101162445115_1350395358315684,,,video,https://www.facebook.com/UKIP/videos/1350395358315684/,2017-01-21 10:04:49,1303,99,158,1232,61,3,6,0,1
209101162445115_1350220571666496,"Love Stoke, Vote UKIP. Vote Paul Nuttall MEP for Stoke-on-Trent Central",Timeline Photos,photo,https://www.facebook.com/UKIP/photos/a.283591398329424.67830.209101162445115/1350220571666496/?type=3,2017-01-21 10:02:50,1574,113,156,1505,56,2,7,0,4
209101162445115_1350216621666891,Paul Nuttall announced as UKIP's candidate for Stoke-on-Trent Central,,video,https://www.facebook.com/UKIP/videos/1350216621666891/,2017-01-21 06:01:59,2251,770,258,2029,183,4,14,1,20
209101162445115_1350200715001815,We'll be live streaming our candidate announcement for the Stoke-on-Trent by-election from 11am. Watch this space...,Timeline Photos,photo,https://www.facebook.com/UKIP/photos/a.283591398329424.67830.209101162445115/1350200715001815/?type=3,2017-01-21 05:42:11,233,27,19,220,13,0,0,0,0
209101162445115_1349500091738544,"Fiona Mills has been selected as UKIP's candidate in the forthcoming Copeland by-election.

""Copeland voted 62% to leave the EU and what better way to send a message to the government that we want a full Brexit as soon as possible than to return a UKIP MP!"" - Fiona Mills",Timeline Photos,photo,https://www.facebook.com/UKIP/photos/a.283591398329424.67830.209101162445115/1349500091738544/?type=3,2017-01-20 09:12:42,2296,211,298,2185,101,4,6,0,0
209101162445115_1347830468572173,"""Britain is not bluffing, Britain will not be bullied. Britain is not some sort of small nation on the peripheries of Europe. We are the United Kingdom. The fifth largest economy on the planet. We have links all over the globe: to the Anglosphere, the Commonwealth, the emerging markets of the Far East.

""It is clear that Britain is going global as a result of that momentous vote on June 23rd. I believe that we have a great future ahead of us.""

Like and share if you agree with UKIP Leader Paul Nuttall!",,video,https://www.facebook.com/UKIP/videos/1347830468572173/,2017-01-18 11:46:49,5975,354,2154,5683,252,17,11,5,7
209101162445115_1347648118590408,UKIP Leader Paul Nuttall MEP: If the House of Lords try to play around or block Brexit then they are signing their own 'death warrant',Paul Nuttall issues stark Brexit WARNING to House of Lords over EU exit,link,http://www.express.co.uk/news/uk/755316/Ukip-Paul-Nuttall-House-of-Lords-Brexit,2017-01-18 07:02:17,1759,196,213,1663,72,4,17,0,3
209101162445115_1346965518658668,Nigel Farage is LIVE on LBC. Watch below!,LBC,video,https://www.facebook.com/LBC/videos/10154670939846558/,2017-01-17 13:08:06,823,88,0,738,76,2,6,0,1
209101162445115_1346848075337079,"UKIP Leader Paul Nuttall MEP gives his reaction to the Prime Minister's speech today: Some of it did sound like a UKIP conference speech and the Prime Minister is now applying some of the things that we've been talking about for many, many years, so I would give her seven out of ten for this effort.

""As Home Secretary, Theresa May always talked tough but failed to deliver. I challenge her to change the habit of a political lifetime and actually deliver this time. And I mean on time and in full.""",Timeline Photos,photo,https://www.facebook.com/UKIP/photos/a.283591398329424.67830.209101162445115/1346848075337079/?type=3,2017-01-17 10:11:20,656,103,83,633,16,1,2,0,4
209101162445115_1346202885401598,"If Donald Trump and the USA want to do a trade deal with Britain now, why are we still letting Brussels tell us what to do?",Nigel Farage Calls For Trade Deal To Be Done With USA Now - LBC,link,http://www.lbc.co.uk/radio/presenters/nigel-farage/nigel-farage-trade-deal-trump-usa-eu/?utm_source=t.co&utm_medium=referral,2017-01-16 15:04:15,2083,166,246,1953,80,3,5,1,41
209101162445115_1345091595512727,"As Nigel Farage says, many countries want to start trade talks with Britain. The sooner the better. What is the Prime Minister waiting for?",,video,https://www.facebook.com/UKIP/videos/1345091595512727/,2017-01-15 09:36:22,1727,138,279,1627,66,5,3,1,25
209101162445115_1343146462373907,"Statement from Paul Oakden, UKIP Chairman: ""The resignation of Tristram Hunt MP highlights the brighter future that many in the Labour Party feel they have away from Jeremy Corbyn and his brand of politics. 

""We have no doubt that the example set by Mr Hunt will be one that many voters in Stoke-on-Trent will consider following in the upcoming by-election, where UKIP will be fighting hard to offer local people the committed representation they both need and deserve.

""UKIP will confirm the selection of it's candidate on Saturday 21st January.""",,status,,2017-01-13 06:14:29,616,139,49,576,25,1,12,0,2
209101162445115_1343070849048135,"UKIP's fisheries spokesman Mike Hookem: ""This research proves what a bright future the fishing industry can have if we return British waters to British fisherman!

""We have known for years what a poor deal British fishermen got from the EU and these figures prove beyond doubt how the traditional parties have betrayed fishermen and coastal communities alike.""",'The EU is robbing £6.3bn from Britain' Brexit flotilla group blasts fishing quotas,link,http://www.express.co.uk/news/uk/753599/European-Union-Brexit-fish-quotas-Mike-Hookem-Ukip-politics-EU,2017-01-13 04:30:46,1829,166,741,1494,27,5,0,6,297
209101162445115_1342441675777719,"LISTEN: UKIP Leader Paul Nuttall MEP - ""The future for the UK outside the EU is very bright. Theresa May needs to ensure we get full Brexit.""",Paul Nuttall MEP,video,https://www.facebook.com/PaulNuttallMep/videos/1364544320263255/,2017-01-12 14:44:00,1145,82,1,1101,42,2,0,0,0
209101162445115_1342177169137503,"UKIP Immigration Spokesman John Bickley: ""One of Labour's senior MPs, David Lammy tells us that politicians are ""detached"" from mass swathes of the public, yet his own actions confirm that he is one of those 'detached' politicians. He wants the referendum to be rerun and he voted against the triggering of Article 50, so both the words hypocrite and sore loser come to mind.

""And if Labour's deluded thinking wasn't bad enough, we have the Tory Party's Immigration Minister proposing to slap a £1,000 'fine' on any company recruiting workers from outside the EU, with the possibility of extending the punishment to EU workers after Brexit. 

""Instead of the Tory Party thrashing about because of their incompetence in bringing immigration down to the 'tens of thousands' why don't they just get on with controlling non EU immigration in a fair and equitable fashion by using an Australian type points based system. If they're incapable of doing so then can they call a general election and let UKIP deliver the will of the people on Brexit and begin the overdue process of getting our out of control immigration system under control"".",Tories and Labour thrash around to find a coherent Immigration policy,link,http://www.ukip.org/tories_and_labour_thrash_around_to_find_a_coherent_immigration_policy,2017-01-12 10:12:00,580,100,77,487,2,2,23,0,66
209101162445115_1342168565805030,"UKIP London Assembly Member David Kurten: ""The Jockey Club, the local council and the government all need to think again. If we keep on concreting over our green belt and national treasures, there will soon be none left.""",Jockey Club's planned sale of Kempton Park racecourse is another nail in the coffin of the green belt,link,http://www.davidkurten.co.uk/press-releases/jockey-clubs-planned-sale-of-kempton-park-racecourse-is-another-nail-in-the-coffin-of-the-green-belt,2017-01-12 04:44:21,425,69,60,312,0,2,0,21,90
209101162445115_1342128079142412,"LISTEN: UKIP Leader Paul Nuttall MEP - ""Jeremy Corbyn says immigration isn't too high. I would ask him go north of the Watford gap where almost everyone tells a different story""",Paul Nuttall MEP,video,https://www.facebook.com/PaulNuttallMep/videos/1363880306996323/,2017-01-12 04:05:42,1109,208,0,1032,13,2,16,1,45
209101162445115_1341630219192198,WATCH: Nigel Farage says we should stop poking the Russian bear with a stick.,"The EU Is More Dangerous Than Russia, Says Farage - LBC",link,http://www.lbc.co.uk/radio/presenters/nigel-farage/the-eu-are-more-dangerous-than-russia-says-farage/,2017-01-11 15:59:21,1185,88,108,1126,42,2,15,0,0
209101162445115_1341424832546070,"UKIP's Home Affairs Spokeswoman, Jane Collins MEP: ""Only in the wake of yet another terror attack have some members of Angela Merkel's coalition government woken up to the threat posed by a minority of the migrants who rushed to Germany after the Chancellor threw the doors wide open.""

""But while I welcome German efforts to tighten rules on migrants already in the country, these moves are next to useless in combating further attacks while the Schengen Agreement remains in place.

""Any policy which allows undocumented people to travel coast to coast in Europe unchecked poses a direct risk to the UK's security and must be revoked. This is simply ridiculous and the EU must act to revoke this ridiculous policy, especially in the current security climate.""",German efforts to clamp down on migrants wasted while Schengen remains,link,http://www.ukip.org/german_efforts_to_clamp_down_on_migrants_wasted_while_schengen_remains,2017-01-11 12:05:54,786,85,109,751,7,1,19,2,6
209101162445115_1340669295954957,"""Labour has betrayed millions of British families on immigration. 

""Jeremy Corbyn's plan to ban British jobs being advertised abroad will have no significant impact. We need an Australian style points system.""

Do you agree with UKIP Leader Paul Nuttall MEP?","""Labour has betrayed millions of British families on immigration""",video,https://www.facebook.com/UKIP/videos/1340669295954957/,2017-01-10 11:47:18,3157,291,607,3022,73,2,6,0,54
