ommentmessage,1,1,1.0
My partner is Polish and has lived in the UK for 12 years Always worked since day 1 Always paid tax and NI In fact she was in the 40 tax bracket for 6 years We run our own business now Pay in the 40 bracket each Plus business tax VAT etc Etc If our business for some reason goes pear shaped next week and we need can I claim benefits I think you will say yes after all I served in the military for 12 years and now im a firefighter What about my partner Does she need to go back to Poland because she wasnt born here Despite paying more tax than most in this country Im all for Bexit but to tar every european with a same lazy dole sponging brush is a not right and bracist,140,9,0.06428571428571428
No definitely not I am referring to the hoards of young people from all over the EU who have been encouraged to go to the UK to work Most of these are employed in low paid jobs as shop workers bar personal waiters etc Most will be on minimum wage or just above  due to our stupid benefits system will be eligible for benefits I dont blame them for coming after all who would stay in Romania on 92p per hour min wage when you can turn up in Britain earn much more  still be able to claim Recently went to the Savoy in London for lunch  didnt set eyes on any British worker they were all either Spanish or from Eastern Europe Sorry to generalise but this issue really gets on my nerves,134,5,0.03731343283582089
Your wife steve is one ofthe many good EU living here as my wife toowho is germanwho also has own bussinessbut there is a lot here for 9 months go home for 3 months over the christmas time till aprilthen come back and claim back the tax for the year beforthis way they pay no taxjust the 1 year when they dont come backthis is never openly spoke about,69,11,0.15942028985507245
On top of that Roy a friend of mine had a delivery business in Yorkshire for 25 years but had to close down two years ago as they couldnt compete with people from EU undercutting them They come over in vans for a couple of weeks then go back pay no road tax or anything else,56,1,0.017857142857142856
Steve Dineley agreed with all you said until you played the race card,13,1,0.07692307692307693
Most Europeans are the same race as us just different nationality Learn the difference,14,0,0.0
thats why labour will never ever be elected againto goverment,10,3,0.3
Why bother leave it two years then wave goodbyeif remoaners wish to live in LA LA land Hop on ferry and go,22,2,0.09090909090909091
We need Nigel running this country NOW,7,0,0.0
Are you on drugs he abandoned UK and buggered off to America oh and is still getting paid by the EU,21,0,0.0
Lee Maiden he was at the eu parliament today  speaking up for this country maybe you are on drugs,19,1,0.05263157894736842
Only one thing to do out out out,8,0,0.0
The Lib Dem MEP didnt help she was a disgrace talking of revoking Article 50 and hopefully one day re joining the EU and telling them how great they are that can only weaken our bargaining power,37,3,0.08108108108108109
They are determined to punish us despite their lies to the contrary We will not get a good deal and TM must hold good her promise to walk away 174 million of us expect no less,36,0,0.0
Kennedy Sinclair Nigel has told them the truth they took an amount out of thin air  They know if we leave others will follow they want to bankrupt us like they have with Greece and Italy how dare we turn our backs on MERKEL and Junker these people that have ruined Europe Take a look at Sweden  Germany and the streets of Paris  They fled from hell holes and making Europe the same ,73,1,0.0136986301369863
Do we have ANYONE except Nigel speaking up for the uk in the euI have never heard anyonedespite us paying themmeps I mean,23,4,0.17391304347826086
73 of them I believe,5,0,0.0
Dont say much do certainly never heard them speaking out in our cause,13,1,0.07692307692307693
EU in danger of cutting off their nose to spite their face,12,0,0.0
Labour only one word crap,5,0,0.0
They did say they would be confrontational now this is it We need to get UKIP in power as it is now obvious the conservatives are going against the will of the majority vote Labour are totally finished,38,1,0.02631578947368421
Steve ring your right EU doesnt what to do a deal with us it strange though most of the countries in EU 70 years ago ran to UK for help because Germany was butchering them again remember 1st war Germany gasing soldiers in trenches now all those countries what side with Germany GERMANY IS THE EU,56,3,0.05357142857142857
Your lack of historical accuracy is matched only by your appalling spelling punctuation and grammar,15,0,0.0
Sorry didnt realize l was in English or history class thought teachers had enough work on without correcting people on fb,21,2,0.09523809523809523
Thanks Labour you made yourselves some enemies and many voted Labour for years,13,0,0.0
Because they are all traitors Nigel and dont want to lose there big fat salaries,15,1,0.06666666666666667
We need officialy to leave the eu to start making deals that serves Great Britains intrest we dont need the eu also labour are always infighting that party is finished liberals are turn coats only one i see is ukip,40,8,0.2
Dont waste any more time HARD BREXIT,7,2,0.2857142857142857
Would never vote for Labour again UKIP for me now every time,12,1,0.08333333333333333
I agree withsteven Steven Ring,5,1,0.2
Because their snouts are firmly in the troughs ,8,0,0.0
Vote UKIP,2,1,0.5
Its now up to UKip to make themselves an electable party with Nigel as leader more will follow ,18,1,0.05555555555555555
Just shows why we should never have given the eu controls in the beginning,14,1,0.07142857142857142
Just go back to WTO rules stop all payments and repel the European Communities Act Job done,17,1,0.058823529411764705
What do we expect of Corbin  his comi crowd,9,2,0.2222222222222222
Please come back Nigel they are uturning on all their promises we need someone like you in opposition,18,1,0.05555555555555555
Lets face it the labour lot just vote as they do to piss people off because that is all they know They have no intelligence to use to see how they should support the country,35,0,0.0
Looks like its going to be a hard Brexit after all brought about through the intransigence and delusions of the EU supporting MEPs,23,2,0.08695652173913043
Time the government just walked away eu are no good I would Not be surprised if torys are in with these idiots,22,2,0.09090909090909091
Why dont you start playing for GB,7,1,0.14285714285714285
Well with all those anti Brits traitors voting against us it says exactly what there agenda and loyalty is and who withUKIP all the way it is the only real peoples way forward,33,1,0.030303030303030304
Yes thats right and thats for labour they can get lost for good I would never vote labour because he likes to much free movement dont care about British people ether so to me he is definitely not worth the grounds he stands on for what he is doing to this country we are British country and proud of it because labour dont care about everything just punishment to the people of great Britain because of Eu Brussels with shackles and chains we are the prisoners of war of Eu,90,6,0.06666666666666667
Well done UKIP MEPs down with the traitorous labour parasites ,10,2,0.2
all traitors the left wing and liberals traitors all of them,11,0,0.0
U K should walk away  its impossible to bargain with thugs ,11,0,0.0
May as well because they will be out of a job soon Just remind the voters when they try to get elected here they stabbed us in the back,29,0,0.0
They will pay later and they will regret their actionswe have long memorys,13,2,0.15384615384615385
The EU are corrupt,4,0,0.0
I think Labour has all the Muslims for supporters thats why hes to cocky,14,2,0.14285714285714285
Lets start negotiations for trade deals outside the EU now I dont see why we have to wait for 2 years I will be very surprised if they give us a reasonable deal because they will put politics before economic common sense They have already started their predictable stupidity with Gibraltar,51,1,0.0196078431372549
Because we cant till we leave No one would negotiate with usany deal wouldnt be worth the paper its written on ,21,2,0.09523809523809523
The discussions will be ongoing there just cannot be any deals until we leave Day after we leave should be very busy if the work is being done properly now,30,0,0.0
You cannot Negotiate with people who do not want to Negotiate didnt Campbell try that and was shot down I say I am with Nigel on that score Mafia is a good description,33,1,0.030303030303030304
Loser farage and nuttall  Shows ranting raving and Insulting people does not work The EU won in the end Next time go to trump tower instead Farage You are ignored in Brussels and everywhere else,35,3,0.08571428571428572
Fgs bore off you TWAT Loony lefty are u Nigel told the treth and if they did not like it then tough I could go on but i cant be bothered to waste my time with a fool like you,40,5,0.125
They laughed jeered and booed and he lost the votes The guy is a loony Wake up,17,0,0.0
Hes not ignored by me obviously ranting and raving did work we have brexit  if the eu felt they had won they wouldnt have thrown their dollies out  never mind Tony if you dont like it in the uk the world is your oyster urine off,46,6,0.13043478260869565
Haha Im sure you are better than him Cameron gave you the vote We dont have Brexit We are still in,21,4,0.19047619047619047
You prize idiot Just watched and saw a master MEP at work,12,1,0.08333333333333333
Im glad you saw Guy Veorstadht He is an excellent MEP Farage has the worst attendance record and when he goes he is ranting raving and insulting,27,4,0.14814814814814814
From EU to this garbage,5,0,0.0
httpswwwtheguardiancomcommentisfree2017apr05globalbritainbrexitfinancierarmsmerchantbrutaldictatorsCMPsharebtnfb,1,1,1.0
Well piss off if you dont like it ,8,1,0.125
Ranting and raving and insulting like Nigel Carol Lloyd Our only friends now are murderers like Saudis and Duerte of Phillipines,21,2,0.09523809523809523
Tony luis David Camerons speech on Wednesday We looked at the European Parliament and we didnt really like the European Parliament Weve got our own parliament which we are very proud of I led the campaign to stay in  and I didnt like the European flag and the European Parliament We were always uncertain about that political union element,59,5,0.0847457627118644
Tony Luis funny guy you if you have friends that are murderers thats a matter for you so whats with our that would suggest we agree with you and we dont so grow up,34,3,0.08823529411764706
So Cameron Lied like farage bojo and the others,9,2,0.2222222222222222
Tony Luis If the LEAVE voters had their way  we would have had Brexit by 30th June 2016 No negotiations no money no open borders no foreign fishing boats in British waters,32,2,0.0625
And Cameron did a runner in disgrace All the other EU leaders are still there,15,0,0.0
So why didnt you Anne Eager  Thought you won but obviously powerless  such a hollow victory 9 months to issue a one page letter and still clueless on shat happens next,31,2,0.06451612903225806
Mr Luis are you actually English,6,0,0.0
British like you Are you actually The Bob Hope ,9,0,0.0
You are right Nigel has no affect on Brussels politics They screwed the EU up on their own They dont listen so we are leaving,25,1,0.04
Farahge has his faults but hes so far above any politician at the moment can anybody remember the last time he got something wrong maybe thats why hes hated by so many politicians Old moggie would be a good second in command if they ever decided to take the rains from t may  Come 0n Nigel form your own party the old insurance guy will fund you,67,5,0.07462686567164178
Hollow victory Sounds like someone is bitter and twisted to me I for one of the 175 MILLION glad we are heading away from that corrupt dictatorship It will be a challenge but at least we will be self governing and not herded like sheep with our powers and national identity being taken from us bit by bit Keep it going Nigel ,62,0,0.0
httpwwwtelegraphcouknews20170405migrantscouldallowedenterbritain2022theresamaysuggests,1,1,1.0
You can not trust the Labour Party in any shape or form these traitors have stabbed this country in the back yet again its now time to chill Europe to stuff off and start trading with the world and tell Europe to get lost they ow us not the other way around,52,0,0.0
Because they are bloody useless and are a waste of space,11,0,0.0
httpwwwindependentcouknewsukpoliticsbrexiteuropeanparliamentmepsguyverhofstadtvotea7667761html,1,1,1.0
i read this earlier i think this is what Mr Fallon said What the EU is trying to enforce in relation to Gibraltar is against international law and it wont even get over the starting blocks,36,3,0.08333333333333333
Folks these next couple of years are going to feel like 100we havent the spirit to back maythe tories are NOT the peoples partywe need Ukip to get strong again and give us all some hope for OUR countrythe Strasbourg talks show the feeling of the Eu towards usUkip spoke well and we must fight to get full Brexit,59,10,0.1694915254237288
Labour are all for the EU they are traitors to England,11,0,0.0
He is telling the truth but how many MPShave jobs within the European Union,14,1,0.07142857142857142
This is so obvious they dont want to do a so called deal with Britain  stop playing by their rules and leave now if the Tory Government doesnt stand up to the EU and walk away they have already lost the next election this is becoming as pathetic as triggering article fifty  as for the Labour Party who would expect them to support Britain they are just the Socialist and Communist Party now,73,2,0.0273972602739726
As one heard they do not want to be tarred with the same brush as the Mafia but they are acting like them,23,0,0.0
Treacherous Labour MEPswhy am I not surprised,7,1,0.14285714285714285
We will walk away with WTO rules and no deal with borders up between NI and Ireland including passport controls and end of the CTA Anyone who thinks a deal will be struck is living in cloud nine,38,2,0.05263157894736842
And Is that a bad thing,6,0,0.0
Not necessarily no A few years of pain bit highlighting no deal will be struck The EU have made their intentions very clear that they will punish us,28,0,0.0
It was to be expected wasnt it,7,1,0.14285714285714285
lets walk now and turn the tap off,8,0,0.0
Labour started being traitors to our country years ago and have become progressively worse They will not get in again for years until they start to listen to the people of Britain instead of supporting mass immigration etc,38,1,0.02631578947368421
Blair scrapped our border controls in the hope that thousands of grateful immigrants would vote Labour and keep them in office for decades,23,0,0.0
and they did and still do in certain parts of the country Jim,13,0,0.0
Because there all twats,4,1,0.25
The Labour party is the traitor party,7,0,0.0
Thats why there will not be a labour government for a long time,13,1,0.07692307692307693
Ask the yanks if we can borrow their Mediterranean fleet drop anchor at Gibraltar and send whatever they want into Spanish waters I wonder if they would act more reasonable,30,0,0.0
Do you seriously think that is a possibly,8,0,0.0
With our mate Trump in charge yes  certainly not if Obama was still in office,15,1,0.06666666666666667
You seriously think America will lend you a fleet of warships The delusion is incredible,15,0,0.0
I was joking numbnuts,4,1,0.25
Right Mrs May what are you waiting for Start walking and keep right on walking Im bloody sick of this nonsense Show them how its done for crying out loud,30,1,0.03333333333333333
Nigel did you expect any different outlook from Labour I really dont know how this Country will cope if TM has 5 more years of Feemovement of people,28,2,0.07142857142857142
Why cant we take back our England our PM and A lot of of our MP are against the people we the people of England need you You Majesty Queen Elizabeth to lead and give the people and army permission to take England back help help help what more do you want the people of England to say we run by traitors how commit Treeson against us every day,69,2,0.028985507246376812
No surprise there then Wait until Holland France and Italy leave  wonder wholl be left to vote in favour of this money plundering Group The lesser contributors I would imagine  NOT,31,1,0.03225806451612903
There are non so deaf as will not listen dont waste anymore time walk out now and have done with comic Opera,22,2,0.09090909090909091
To be expected,3,0,0.0
They keep trying to score points against Farage its a personal crusade now,13,1,0.07692307692307693
Traitors every one of them,5,0,0.0
WANKERS,1,1,1.0
Ukip in,2,1,0.5
So Now we know that UKIPs bargaining position is Give us everything we want or we will walk away with nothing,21,1,0.047619047619047616
Because they are traitors and garbage,6,0,0.0
So the EU are showing their true colours now we no which one now not to buy goods off lets make them see what its like when nobody wants to buy your goods there the rest of the world we can traded with let them wait till we are ready,50,0,0.0
You think that you are still in 19th century and UK can trade with they want UK will have several troubles for making new trades agreement For the moment India are not very interested Canada have just sing a free trade with EU and China hates UK since Opium Wars Latin Am and Nord Africa have several trade deals with EU You will be offside and arrive later httpswwwtheguardiancomcommentisfree2017apr04indiabritaintradecharmoffensivebusinessneighboursCMPfbgu,69,3,0.043478260869565216
Well Spain and Italy are all most bankrupt Greece is waiting for more money Turkey is now thinking of letting all the refugees in to the EU countries so I think trade deals between UK and the EU is the least of the UK Problems,45,0,0.0
Well said Annette I agree with all what you have said  ,11,0,0.0
He he doing the real work whilst others may betray us the EU is finished,15,0,0.0
The only person that can put are Country back together is Nigel Farage He is the only on with back bone,21,1,0.047619047619047616
Obviously nothing has changed since Cameron came away empty handed Chances are nothing will Time for a quick exit,19,0,0.0
give them the heave ho come election time remember this day,11,0,0.0
This is just telling France that when le pen wins she triggers article 50 straight away and leave Then and only then negotiate trade deals,25,0,0.0
Gibraltar was seceded to the British Queen Anne if I remember correctly in 1713 under the Treaty of Utrecht following the War of Spanish Succession legally the Spanish and the EU have no legal right to try to claim it or take it away from the British If anything it is the Spanish and the EU that are threatening the UK The MEPs that still support the EU should be impeached immediately,72,1,0.013888888888888888
Of course is the EU who have talking about war Don lie,12,0,0.0
I know there are people living on or near the border of GibraltarSpain who have actually said theyd rather be governed by the English than by the corrupt Spanish government Arruga I am talking about the government and there have been government officials from Spain talking about Gibraltar within the EU siding with the EU Thats what I meant about aggression,61,4,0.06557377049180328
Are you madthey would lose there massive salaries and extortionate fringe benefits,12,1,0.08333333333333333
They have the right to opinate and try to get they want in the EU Spain is a member of the EU UK not anymore Gibraltar is considered a colony by the UN and the spanish goverment totally corrupt wants Gibraltar Gibraltar is going to have several problems when brexit occurs such what will happen with its smuggling and financial services based on tax haven money laundering and a lot of companies which only function is avoid taxes Spain has certainly said that the only possible solution for what Gibraltar can continue with their economical activities is they take spanish sovereignty This is a good option for llanitos Maybe their patriotism will be weaker than their avarice Some spanish would preffer to see how the Rock economy run down and dissapear The true problem is about parasite economy instead nationalism,140,10,0.07142857142857142
Spain was Germanys money launderer  from 1936 to 1950 Thats why theyre baying for invading GiB ES has always been GDRs loyal hunting dog It didnt fight in WW2 for that very reason,33,7,0.21212121212121213
So mainly traitor politicians putting their own personal needs before the country The majority are in the Labour Party and are an embarrassment to us all  At least Brexit has shown them to us in their true colours,38,1,0.02631578947368421
Colin youre right about the majority being in the Labour party but theyre not the only traitors we have The Tories are not all behind Brexit and Britain getting properly out of the EU with a decent deal We should not be trying to make deals with them anyway The EU is totally intransigent and as others have said here they are not interested in cooperating in any way,69,3,0.043478260869565216
Labour are totally washed up as the second party in UK politics UKIP have a golden opportunity and must take it or lose all,24,1,0.041666666666666664
what do you espect from labour meps they want to keep there jobs bunch of tosser just like there leader,20,2,0.1
Why are we still letting them bully us walk away do not negotiate with them let them see we can do it on our own,25,0,0.0
Mrs May should pull the plug on all of this and walk awy from the EU what are we gaining by staying and putting up with all this crap we have nothing to gain by staying and nothing to lose if we Leave She is starting to try my patience big time ,52,1,0.019230769230769232
Yes I agree,3,0,0.0
The EU dont want serious negotiations they just want to screw with us for two years so that we keep paying into their bottomless money pit WE should be telling them what we do and dont want and when they refuse to compromise we will just walk away and leave them to placate their many manufacturers,56,2,0.03571428571428571
RIGHT ON ,2,0,0.0
 STICKER,1,0,0.0
spot on,2,0,0.0
Reality bites With Job Seekers Allowance at a week that is approximately a day that some people have to live on Since the referendum the value of the GBP has fallen by over 17 or approximately one full days income has been lost for those on the smallest incomes I guess that means that they can eat for just 6 days a week then and go hungry for 52 days per year With retailers and supermarkets either increasing prices or shrinking product size right now as a result of the increased cost of Brexit electricity and gas bills set to increase by 7 from this month and inflation expected to top 3 by the end of the year interest rate hikes cannot be far behind  when interest rates go up so do mortgages and when mortgages go up landlords put up rents to their tenants So adding all this up by my back of an envelope calculation your average job seeker is going to lose the equivalent buying power of another 23 days income by the end of the year each week That is a loss to him of over 100 days a year of the basic JSA benefit payment What are people supposed to do for that third of a year Does anyone in their right mind actually think that the Government is going to cover these losses for the poorest people in our country Gee nice one Brexit and all the fools that voted for it without understanding that there ARE consequences to voting blindly on a pack of lies,262,4,0.015267175572519083
BREXIT is controlling our borders and that covers immigrants and anyone else coming in These MEP are European not British When they are chucked out of the EU we should remember their names and stop them from getting a job in British politics,43,2,0.046511627906976744
Thats labour for you would never trust them again ,9,1,0.1111111111111111
I know it might make a few people unhappy but if all the British stopped going to Spain for their hols Spain would soon start renegotiating they would be skint within a year,33,2,0.06060606060606061
Why does Farage even bother to show his smug mug in Brussels anymore Hes got what he wants he should shut up and go away ,25,3,0.12
When he is there he is showing our Government what a back sliding out of touch waste of space they are Someone has to do this because they will cruise along doing nothing as they have done for 40yrs over the EU  Sad our own MPs have no back bone just a need to line their own pockets from the EU ,61,1,0.01639344262295082
So typical of Labour to side with the EU They dont care about the UK Never have,17,1,0.058823529411764705
Because labour are anti English and anti workers Their mp and meps are a hateful bunch of self interest bullies,20,2,0.1
No deal now we want an election and we want her out,12,0,0.0
Time to walk away no cash payments to be made get back what is owed to us in the EU and start spending on the NHS Schools etc in this Country for a change do not pay for any of their projects we have paid enough,46,1,0.021739130434782608
Self righteous left wing tossers,5,0,0.0
Walk away,2,0,0.0
money for money off the backs of the workers they dont care about the common man they have squirreled enough tax payers cash into secret accounts around the globe to live comfortable till they die labour isnt a working class party tories are worse than hitler on jews,48,6,0.125
We can expect the EU to try to abuse its power but Labour as well So much for solidarity We as whole must stand together,25,0,0.0
Why dont we just walk away now Itll save all this pissing about,13,2,0.15384615384615385
