ommentmessage,1,1,1.0
President Trump has set a clear and definite message and this is more than Obama ever did Criticising him is armchair politics at this stage The Geneva Convention is very clear on the rules of any engagement We cant be seen turning a blind eye to chemical attacks Public opinion will also swing massively against Assad so on this one youre behind the curve,64,2,0.03125
Well said Darryl Mark,4,1,0.25
The BBC that says all Trump does is bad Because that argument is logical then,15,0,0.0
rubbish Obumer used over 12000 bombs in Syria in 2016 alone ,11,1,0.09090909090909091
Are u fking brain dead serious question,7,2,0.2857142857142857
What proof do you have that Assad used chemical weapons He and Russia have denied it and have no reason tactically or diplomatically to use such a brutal and unnecessary weapon in a war theyre already winning Dont believe everything you read in the news,45,2,0.044444444444444446
Knee jerk reaction to MSM hysteria I am surprised that this President in particular should allow himself to be influenced by them,22,1,0.045454545454545456
Darryl Mark we attacked a country that was not at war with us President Trump criticized Bush for the Iraq war Remember that Intel told us they had wmds None where found and that was the reason remember,38,2,0.05263157894736842
Darryl Mark it was the ukip leader that was criticizing not bbc,12,3,0.25
Assad didnt do it the UN has said so its the rebels who had chemical weapons,16,1,0.0625
Who do you think benefits from this chemical attack Not Assad as he is already gaining ground all over Syria This has only served to stir up the get Assad out at all costs faction who have no credible alternative to offer,42,0,0.0
Yep the media and UN have far better intelligence services than the USA UK and France and Assad is a saint Seriously,22,1,0.045454545454545456
What are you on about Obuma was responsible for the Syrian conflict,12,1,0.08333333333333333
Public opinion isnt for Trump or Assad on this  ofcourse no one likes whats happening to the children there  but  you cant fix it by bombs  thats been proven everywhere  the UN isnt fit for purpose true  and there is no fix  The British people i think are sick of wasting money time and men out there  public opinion is swayed by the media  and lied to in the same way  No Retaliation  2 wrongs dont make a right ,79,7,0.08860759493670886
So to gain support in a civil war that he is winning Assad decides to bomb a hospital and civilians using chemical weapons Do you honestly think that is logical Or does that give a perfect excuse for the people who have tried for years to get him out to now get directly involved as the indirect approach didnt work,60,1,0.016666666666666666
Youre deluded,2,1,0.5
I note Nuttall doesnt say what he would have done instead,11,2,0.18181818181818182
Iris February exactly right,4,0,0.0
Wrong again  all this strife in the North Africa  middle east was caused by OUR removal  murder of Ghaddafi He kept the lid on  his removal led to the Arab spring which has become a disaster for all of us Cameron is to blame for that just as Blair is to blame for Iraq  the deaths of millions can be directly linked to these two tragic political events,68,1,0.014705882352941176
Harley Dalton I have been a fan of Trump up to now but do not agree with the action taken As you rightly said their is no proof that Assad committed the attack whereas the Americans have carried out some dirty tricks Until proved otherwise I will not believe that Assad is guilty,53,0,0.0
There is absolutely No Proof yet you morons believe the media including Trump he should have stuck to Real Estate ,20,0,0.0
Is UKIP now supporting Donald Trump Vladimir Putin Assad Paul Nuttall or Nigel Farage You have got yourselves into a mess,21,4,0.19047619047619047
Richard Day UKIP are in the mess as Nuttall doesnt understand geo political decisions and that power entails making decisions either way He should not have condemned Trump,28,4,0.14285714285714285
There is something called the Geneva Convention Forget the personality contests we either police the convention or rip it up Im for the former,24,1,0.041666666666666664
lets get a bit of perspective httpswwwyoutubecomwatchvKU5taO5vRDo,7,1,0.14285714285714285
Idiot,1,0,0.0
Precisely what the rebels would like,6,0,0.0
So please explain how bombing a Syrian airfield will achieve anything Trump is merely trying to act the big man in font of his countrymen and divert attention away from his disastrous domestic policy You are very naive if you think Assad is going to think again because of TRumps pathetic attempt to appear strong It cant even be agreed who used chemical warfare,64,1,0.015625
David Hollas he killed allot less people than Bush and Blaire,11,2,0.18181818181818182
Show us the proof that Assad did this It has already been proved that the media is bought and offer nothing but fake news so why go along with their crap as well as that terrorist organisation White Helmets There was a previous chemical attack a couple of years back which Assad was accused of It turned out to be the rebels which did it Wake up to who the real enemy is Corrupt western establishments,76,0,0.0
 demonstrably false,2,0,0.0
David wild that is blatantly untrue You will find that more deaths were caused by Shia warlords supported by Iran on both Iraqi Shia and Sunni peoples alike And certainly Assad has killed more of his own people than were killed in the opening phase of the 03 war I know people are desperate to find some conspiracy in all of this but the facts dont stack,67,3,0.04477611940298507
Blind eyes need to be open to the truth before the body takes action Trump should of waited for the UN to investigsts,23,1,0.043478260869565216
David Hollas The fact is the west along with Saudi Arabia and others have gone from country to country in the middle east destroying and killing hundreds of thousands arming and training terrorists the fact is the middle east has nothing to do with us unless you believe in globalisation,50,1,0.02
httpwwwhaaretzcommiddleeastnewssyria1781915v9300BC0B4043D9F2946AE07B4BD73DE2,1,1,1.0
David Hollas Theres no reason to look for a conspiracy Its entirely possible that this started when something happened with some of the rebels chemical weapons  either as a consequence of a weapons dump being hit by a Government airstrike or as one report from Syria alleges an accident while trying to fit chemical warheads to rockets  and that the rest is just people jumping to conclusions or seizing upon a convenient excuse to push an agenda Bad luck folly opportunism  these are a sufficient explanation,86,3,0.03488372093023256
Why would Assad use CW when he is winning the war with conventional weapons and he knows it would create an international furore It doesnt make sense I think the chances of a false flag operation by the actual rebels is extremely high Trump has gone ahead and used it as an excuse without even waiting for an investigation,59,1,0.01694915254237288
Yet another moron going on about false flags Boring now,10,0,0.0
And you know for sure Assad attacked with the gas ,10,0,0.0
Bill Dent  Just ask yourself who benefits from this chemical attack Cerainly not Assad,14,1,0.07142857142857142
Exactly Iris Only a moron would believe Assad would do something so counterproductive to his own interests So the libdem allegation Trump is a moron might be sadly true TBH I suspect the US knows it is a false flag but are using it as an excuse to flex some muscle on the international stage What they would probably really like to do is attack the Russian air and naval bases in Syria but do not yet have sufficient excuse,80,3,0.0375
He did though,3,0,0.0
Ariel Cohen Ukip are a done force now I support Trump and Theresa May,14,1,0.07142857142857142
UKIP have been outflanked  this is student politics,8,1,0.125
The Tories have mopped up the Ukip vote Trump is showing Putin who the real boss is,17,2,0.11764705882352941
Exactly its about geo politics and very clever,8,1,0.125
Obama showed Assad weakness by drawing lines in the sand too many ,12,1,0.08333333333333333
So many lines it was nouts and crosses,8,1,0.125
There is a difference between being the leader and being a leader Paul Nuttall is definitely not the latter,19,1,0.05263157894736842
Trump said leave Syria alone he has gone against his pledge already and alot of the people who voted for him are against this action go and look on Trumps facebook page,32,2,0.0625
When chemical weapons are used it is not hypocrisy for Trump to act,13,0,0.0
Steve Turnbull the question is who used them There is a lot more to this than what we are being fed in the mainstream media,25,1,0.04
Steve Turnbull what if someone attacks us because they dont like what we have done Is that ok,18,3,0.16666666666666666
They can not be beaten the more u kill the more join thier ranks in the end the only way is to talk not another war people dyeing for nothing,30,2,0.06666666666666667
Talk achieves nothing at all,5,0,0.0
Neither does war,3,0,0.0
Think you are very wrong there  someone has to stand up to bullies there has been too much international condemnation which has been totally ignored,25,0,0.0
How is Assad a bully Its his country,8,0,0.0
Errr he runs it tell that to those who died this week,12,1,0.08333333333333333
Terry Akers Syria belonged to the people who were gassed as well,12,1,0.08333333333333333
The biggest bully is America,5,0,0.0
Who said Asaad did this where is your evidence There was none in 2013 and there is none now,19,1,0.05263157894736842
Rod Lomas America may have dropped those bombs last night but it is the UN and the Globalists that are calling the shots here,24,1,0.041666666666666664
There is a good option Support former London eye surgeon Bashar al Assad the only Syrian govt recognised by the UN and the Christians of Syria who unanimously support the legitimate government,32,2,0.0625
Sorry Paul but you sound weak now If it turns out to be the other side that unleashed this chemical attack then they should receive the same as assad as well,31,1,0.03225806451612903
Martin a little late for those who died,8,0,0.0
I am with you on this one Martin,8,0,0.0
According to news on fb yesterday syria released the cemical weapons on its own people so what are we yo believe,21,3,0.14285714285714285
Yes late for those ones but we need to stop anyone else from being killed in that way,18,0,0.0
Removing Assad would be a start Not sure if bombing is the solution,13,0,0.0
If Assad is allowed to get away with crossing red lines then they become meaningless and he will continue with impunity Cruise strikes send a clear message,27,0,0.0
David Hollas sir a distinguished voice of reason ,8,1,0.125
Not sure about that we missed opportunity after opportunity to prevent mass civilian casualties in this debacle because politicians were frozen by the reaction to the Iraq war  not that in itself there wasnt a case to continue serious restraint on saddams regime which itself used chemical weapons on its own people,52,3,0.057692307692307696
David Hollas agree and Nuttalls response is student politics of opposition that will now show a lack of seriousness for power ala Corbyn,23,4,0.17391304347826086
I think he crossed that line well beforebut that is another story,12,1,0.08333333333333333
Question isnt whether or not Paul is correct with what he has said the question is did Assad do it  There is as much evidence to say he didnt You cannot bomb unless you have that definitive proof surely,39,2,0.05128205128205128
I would suggest that the CIA and Other western security services have a good handle on what is happening in Syria And he has form,25,0,0.0
httpwwwveteranstodaycom20170406swedishmedicalassociationssayswhitehelmetsmurderedkidsforfakegasattackvideos,1,1,1.0
So the Turk post mortems are part of this white helmet conspiracy The deaths had none of the morbidity caused by a nerve agent And of course as Sarin has such a poor shelf life and requires a chemical reaction on delivery then the white helmets must have established a clandestine biological agent manufacturing plant,55,1,0.01818181818181818
So paul nuttall what is tobe done against syria No point in talking to them or sanctions been done so come on what shall we do Only language them animals understand is violence at least trump is trying todo somthing i say a no fly zone by the un lets see them do somthing,54,9,0.16666666666666666
The uk should do more to prevent atrocities across the world The USA as sent a clear message to Syria that chemical weapons should not be used The UN is not fit for purpose because Russia for one will always back the Syrian government  turn a blind eye Talking while people are being killed can only go on for so long ,61,1,0.01639344262295082
A no fly zone over syria run by the un,10,2,0.2
Dont believe everything you hear on the tele Just ask yourself why on earth would Assad launch chemical weapons when he was clearly winning Now ask yourself who really benefits from this,32,2,0.0625
David Paul Goldstraw will not happen,6,1,0.16666666666666666
ISIS USA UK,3,0,0.0
David Paul Goldstraw what if some country wanted a no fly zone over the UK Would you set still for that,21,1,0.047619047619047616
Marc R R Hooper  This is just so obvious I cant see why so few people see it Action against Assad based on hearsay accusations and suspicions is the same as what got us into the Iraq conflict,38,0,0.0
ISIS have no compunction of playing dirty It is known they have a vast arsenal of weapons chemical is likely to be among them They are desperate  losing ground it is not unreasonable to assume that they have likely engineered this attack to draw forces against their enemywho are driving them backworking on the assumption that Assad or Russia will get the blame Its not rocket science no pun intended its logical They will be gleeful with the consequences  tragedy of these people such is their horrific mindset,88,2,0.022727272727272728
Man you are one gullible idiot,6,0,0.0
The uk should do less we are not the worlds policemen Hundreds of our military have allready died in 2 conflicts wich had nothing to do with us,28,3,0.10714285714285714
Like stop selling weapons to Saudi Arabia,7,0,0.0
Anyone who believes this blatant Neo Con Propaganda is as stupid and ignorant as those behind it are corrupt and evil,21,1,0.047619047619047616
Spot on Phillip It was an obvious false flag by the CIAs fave moderate jihadis Really only an utter moron would have believed it A few here fit the bill Funny that the CIA love their moderate terrorists and use 59 missiles in 30 mins against the only secular army actually fighting terrorists the US created in the first place Trump has been compromised he is part of the swamp Clinton and McCain occupt History reveals the truth for those whos heads are not in the sand httpwwwtelegraphcouknewsworldnewsmiddleeastsyria10039672UNaccusesSyrianrebelsofchemicalweaponsusehtml  And look here what Trump tweeted back then in 2013 httpswwwrtcomusa383834trumpsyriastrikeoldtweets irony,100,10,0.1
Iris February Because too many are brainwashed or just plain thick dumb sheep,13,0,0.0
Scotland stop whining and build me another battleship Youd better be looking after those nuclear weapons to dont want them parked in England and accidentally going off in a real country,31,2,0.06451612903225806
Weve a couple of aircraft carriers but no planes,9,1,0.1111111111111111
Ok well take them although you can pay for them,10,1,0.1
Stuart Burton That was because we had a labour criminal as a PM,13,0,0.0
El Cid Asaei You it seems choose o ignore the raging nutjob that is Assads brother who commands his military He is a warmonger  a thug and a bully who reminds us of Saddams sons and is the primary reason for the uprising in the first place Assad himself is the nice guy  the international face of that nasty family that run Syria,63,6,0.09523809523809523
Dumbest answer Ive heard in a long time ffs,9,2,0.2222222222222222
Adam Scotland Not true Adam httpswwwlincolnshiregovukheritageandtourismbattleofbritainmemorialflight,6,1,0.16666666666666666
The sort of comment someone makes yo try and sound cleverer and wiser than what they are but all the time revealing how dumb they really are Open your eyes Nuttall when innocent people face this brutality they cannot help themselves empty threats do not work as actions speak louder than words,52,1,0.019230769230769232
What a load of crap,5,0,0.0
The US response without proof proved that any excuse would do,11,0,0.0
Paul come on use your head this stinks It was an obvious false flag by the CIAs fave moderate jihadis Where have you been for the last 20 years Was Iraq not a lesson learned Really only an utter moron would have believed Dr Assad would commit such a stupid act when the Syrian army is winning against the jihadis A few here fit the bill Its funny that the CIA love their moderate terrorists and use 59 missiles in 30 mins against the only secular army actually fighting terrorists the US created in the first place Trump has been compromised he is part of the swamp Clinton and McCain occupy History reveals the truth for those whos heads are not in the sand httpwwwtelegraphcouknewsworldnewsmiddleeastsyria10039672UNaccusesSyrianrebelsofchemicalweaponsusehtml  And look here what Trump tweeted back then in 2013 httpswwwrtcomusa383834trumpsyriastrikeoldtweets irony,137,9,0.06569343065693431
And you think after all the screaams and cries that the previous american governments caused you think they would still be playing that card,24,2,0.08333333333333333
Paul Rasta House  You should remember before you post that It is better to keep your mouth closed and let people think you are a fool than to open it and remove all doubt,34,1,0.029411764705882353
I quite agree Maurice Burns try and remember that next time before you make the same mistake though eh,19,0,0.0
Ah you have just proved my point I was referring to your comment The sort of comment someone makes yo try and sound cleverer and wiser than what they are but all the time revealing how dumb they really are,40,0,0.0
Oh dear i guess Maurice Burns is unfamiliar with clever retorts this is why illiterate people should steer clear of the internet,22,1,0.045454545454545456
You can only Fight Fire with Fire,7,0,0.0
Nuttall is an idiot and a poor choice of leader,10,1,0.1
Says a lot for the people that put him there ,10,0,0.0
If he speaks for u kip thats me finished with them,11,2,0.18181818181818182
I disagree completely I appreciate your thoughts and understand totally where you are coming from but who was going to stand in the way of Assad and his treachery against his own people The world speaks while Assad continues to harvest his own people If it wasnt for the political elite tiptoeing around Putin this would have already happened along time ago You need to refocus your beliefs and agendas on what is truly important,75,2,0.02666666666666667
Sad to say you are wrong Paul  Assad needs to know that there will be repercussions to his outrages and the Russians also need to know that noone believes thier lies  they aide and abetted Arsead in this  either directly or inderectly  they knew he had them ,47,4,0.0851063829787234
There needs a no fly zone over syria run by the un,12,2,0.16666666666666666
Be very careful what you believe to be the truth NO PROOF of this being an attack by Syrian Forces let alone that is was sarin gas I think Trump has just been trumped by his own military advisers Next will be impeachment for such a wrong move Hope you will all be apologising when the rebels retake the area and those poor souls are back at their mercy,69,1,0.014492753623188406
Hook line and sinker  Why just as he is getting back control and some acceptance by the world would he do something that stupid,24,0,0.0
Why would Asaad chemical bomb is own people on the eve of peace talks ISIS were almost gone the rebuilding of Aleppo had begun and talks were of Asaad staying in power Trump until yesterday didnt want conflict in Syria he wanted to let the SYRIANS decide at the ballot box This is ALL down to the UN There is no evidence that Asaad dropped those chemical weapons and there was no evidence that he dropped them in 2013 The USA UN Ambassador and the MSM used the same trick that has worked every single time to get the response the UN and the Globalist want and that is to show pictures and video footage of children They do with every single conflict and they do it with refugees This attack is wrong and as been convoluted to get the result they all want,144,5,0.034722222222222224
Carol Haley The rebels dont need to take back the area  theyre in it  thats why Arsad dropped poison gas on them  He must be stopped  the Russians are complicit in this outrage  they have given him a free hand,40,4,0.1
David Paul Goldstraw If it were not for the UN Syria wouldnt be in this mess n the first place They have turned a civil war in to a perilous situation for the whole globe,35,2,0.05714285714285714
Martin Griffiths the rebels have a lot to gain by causing civilians casualties with chemical weapons Assad does not httpwwwveteranstodaycom20170406swedishmedicalassociationssayswhitehelmetsmurderedkidsforfakegasattackvideos and its not the first time httptheindictercomanalysisofevidencecontradictsallegationsonsyriangasattacks,27,3,0.1111111111111111
David Paul Goldstraw Russia has already set a no fly zone for the US,14,1,0.07142857142857142
I agree killing more Syrians is not going to stop Syrians being killed Has The West learned nothing from history particularly recent events in Iraq and Afganistan Islamists will just hate more and kill more innocent people STICKER,38,2,0.05263157894736842
Silly response How many Syrians were killed in this precise targeted attack ,12,0,0.0
half a dozen I think but I fear you have missed my point,13,0,0.0
Paul Nuttal has no idea of the intelligence that is available to the US I would wait until we find out the true facts Paul is the one with the knee jerk reaction chemical weapons must be eradicated and so must nuclear threats ,43,1,0.023255813953488372
 STICKER,1,0,0.0
Whatby bombing everyoneIranKoreaPakistanIndiaChinaFranceUkand of course Russiaget realthis plays right into the Jihaddis handsbombing Muslims,14,6,0.42857142857142855
The same intelligence that said Saddam Hussein had WMDs 14 years later still no WMDs,15,2,0.13333333333333333
Exactly the true lies the world was told to orchestrate the Iraq War Even the Gulf War was based on lies Saddam did actually invade Kuwait but the testimony of a nurse to the US Congress about emptying incubators was totally made up,43,0,0.0
Yep Robin exactly the nurse was not even in Kuwait as it turned out,14,1,0.07142857142857142
The knee jerk reaction and the lies came from the UN They blatantly lied when they said that THEY KNOW Assad had used chemical weapons before because they do not the report that was produced for the 2013 attack stated that Chemical weapons had been used it was difficult to tell by who but it was more likely to have been by ISIS or the rebels It has already been established that the media used fake and staged news in there coverage of the 2013 Chemical attack it was Obamas red line the only way he was going to get involved and how we got involved,106,1,0.009433962264150943
Jane Hastie I love how the media never mentions the four times ISIS have used chemical weapons in Syria Nope they only report when they want to blame it on Assad,31,1,0.03225806451612903
Lance Heaps I love the fact that the media do not report that the UN and the Allies trained ISIS and the rebels in how to handle and use chemical weapons People at times are so ready to believe what the media or the establishment tell them without any evidence what so ever Same with the refugee crisis when people were adamant that it was not Europes problem What happens we have the MSM shoving VT after VT of people arriving on the shores of Greece in dinghys or being plucked out of the sea or rescued from failing boats with nothing but the clothes on their backs and yet some how when they manage to magic up dry paper coloured pens and in some cases sticks tick erect messages of thanks to Frau Merkel and all of a sudden refugees are welcome ever where for a while and when it looks like the message is failing and people are yet again turning against the establishment and now the refugees they use emotional blackmail by showing pictures of children Just exactly where did those refugees get those placards from because they certainly did not have them on their persons when they were being pulled from the sea or the boats or when they landed on the sures,217,5,0.02304147465437788
Wow everyone hated Trump and was worried hed start a war bet its the same lot who now think hes a star Looks like they were right on the war front though loads of troops from other countries drafted in The people in these countries will never be happy,49,2,0.04081632653061224
I think Paul Nuttall is becoming a liability ,8,1,0.125
Well said paul I could not believe it when I woke up this morningThat he attacked Syria I was out raged at his decision He promised he was not going to police the world,34,2,0.058823529411764705
He attacked the airbase from where the chemical weapons came and were launched not Syria as a whole Right or wrong depends on whether one finds it acceptable to gas babies and children I guess,35,0,0.0
sticking our nose into other countries business will end up with chemical attacks on our own soil if we go to war with assad  is that acceptable Debbie Plummerlet other countries sort it out instead of putting the lives of british troops and british citizens at risk by interfering take a back seat for once ,55,4,0.07272727272727272
