ommentmessage,1,1,1.0
There will always be racism in the UK all the while the foreigners are put before us They have school places  we have to bend to their language they are in our homes whilst our own sleep on the streets they have brought the NHS to its knees they know how to get everything free by waving the old racist card I overheard two foreigners talking calling the UK treasure island Round em up  ship em out by ttime ,79,1,0.012658227848101266
you have just got a friend for life kimberly xx,10,2,0.2
I would help anyone but I wont be took for a fool Mark xx,14,1,0.07142857142857142
Its just not fair The decisions being made should take our own people into more consideration of their needs There will always be a rift between us and them whilst this practice continues particularly so because the indigenous population pay for what they receive Totally unjust and I know that Im becoming very resentful,54,1,0.018518518518518517
 thats why we need UKIP they speak my language ,9,2,0.2222222222222222
Nicely said Kimberly Puddick ,4,1,0.25
Ive been told that the council need to look into why I missed one months rent to my old landlordhe went bankrupt cant find him for refs I asked how on earth these refugeeseconomic immigrants manage to get council housing with no rental history and no credit checksshe told me that was racist I simply asked a question,58,5,0.08620689655172414
Cant say nothing without people playing the racist card,9,0,0.0
They know every trick in the book ,7,0,0.0
Reply that old chestnut wont work on me then watch their response ,12,0,0.0
just looked up the meaning of racism and this is is prejudice discrimination or antagonism directed against someone of a different race based on the belief that ones own race is superior i dont believen i am superior above any other denomination in my community who has a house or a job that could be filled by someone local i dont think anyone local is superior either iblame the people with power by letting in so many that there is segregation and not intergration i blame those in schools system starting in westminster for not teaching the morals needed for life about hard work and money also about being realistic it seems so many have ideas that they are above a certain job maybe if we get that sorted as well as not letting foreigners here with no regard for our own i believe we need to sort our own house before heloing others charity begins at home remember that form your younger days tolerance of others is becoming such a watch word in so many areas of life and it will come back and bite us in the bottoms one day those in london in the seats of power are untouched by what us living in the real workd face im not racist or sexist but it is time to look after our own in the early 8s we fought for a small island thousands of miles away how many will feel the need to defend gibraltar especialy those from abroad,252,18,0.07142857142857142
I also live in Australia The Aussie navy see any refugee boats heading their way they refill the boat turn it around  wave them goodbye so very simple  thats all we need ,32,1,0.03125
Well said,2,0,0.0
So you want to be racist and spout your vile opinions but will cry heartily when challenged Sound about right,20,0,0.0
DAve rawden that old chestnut wont work on us we know the truth so run along leftie ,17,3,0.17647058823529413
Of course there is racism in Britainunfortunately most of it is against the British people though,16,1,0.0625
How did you know Im left handed,7,1,0.14285714285714285
And what about the vile racist attitudes of foreigners who come here and hate us,15,0,0.0
Hope Im not included in your comment Id slit their foreign throats Rawden,13,2,0.15384615384615385
You are a do gooder dave,6,1,0.16666666666666666
Its the likes of him that have given my country away hand over fist ,14,0,0.0
And me,2,0,0.0
Racism exists all over the world,6,0,0.0
John JJ Hewitt especially towards the English ,7,1,0.14285714285714285
You love your country so much you moved to the other side of the world,15,0,0.0
True,1,0,0.0
Dave please explain to me what you determine racism to be,11,0,0.0
Andrea You should have asked from what race are they Arent they from the human race if they are you cant be racist Unless YOU arent from the human race I have yet to see some other race Only different nationalities,41,2,0.04878048780487805
Only different nationalities what the ones that would slit ya throat get real this aint 1950s Britain any more its them or us ,23,3,0.13043478260869565
Rawden its youre,3,2,0.6666666666666666
As far as Im concerned the 1s that cry racism are the racists,13,2,0.15384615384615385
Aint that the truth Valerie ,5,1,0.2
we are a small country how many people does this goberment think we can get in here oh wait ALL THE 1S THAT WILL VOTE FOR THE DICKHEADS,28,3,0.10714285714285714
You absolute mong Its only youre when its you are,10,2,0.2
Shut up twit ,3,0,0.0
Well said Kimberly,3,0,0.0
Lol ,1,1,1.0
Mongs All of you,4,1,0.25
How bloody intelligent ahaha,4,1,0.25
Whereas shut up twit is the height of satire,9,0,0.0
Cause its all morons like you understandtwit ,7,1,0.14285714285714285
Try me Youd be surprised what I understand,8,1,0.125
Shhhhhh enough your boring ,4,1,0.25
youre,1,1,1.0
Dave Rawden you are just another fascist who sits under the banner of anti fascism People are not ignorant or racist for having concerns about mass immigration at there own determent Well pointed out Kimberly never let them shut you up for having a valid point no matter how many times they label you a racist,56,2,0.03571428571428571
Charlie Brown I am indeed from the human race I do not preach harm on anyone I do not try to change peoples religious views I simply wish to live in a fair democratic society where I can uphold my beliefs in peace and have the support and assistance of my government should I need it,56,0,0.0
And Charlie Brown it was a simple enough question to him define what he thinks racism isin my opinion it is someone who is unaccepting of anothers culturereligion and imo that is islamic extremists they will not accept the way we chose to live they are right and we are wrong in their eyes we are evilis that human behaviour No it is not,64,7,0.109375
Iv had to block Dave Rawden sending me freaky messages ,10,1,0.1
You sound like bunch of racists,6,0,0.0
I dont sound I am ok ,6,2,0.3333333333333333
No truer word spoken,4,0,0.0
The racist card dont work with me Im passionate about my country  if thats racist then so be it ,19,3,0.15789473684210525
You bloody mong rawden what a boring waste of space you are,12,2,0.16666666666666666
Horrible intolerant person be it,5,0,0.0
I dont like you either prick,6,1,0.16666666666666666
Ship yourself out unfounded bigotry yuk You wouldnt understand British values if you were having a blue fit ,18,2,0.1111111111111111
Theres a camel leaving for Syria at 11 get on it  ship yourself out then bang blow yourself sky high traitor ,21,1,0.047619047619047616
Thank you Paul x,4,0,0.0
Kimberly Puddick Hes probably a troll trying to wind you up You want to see the size of my blocked list All liberal trolls Well said Kimberley We need to stand up to the government and get are right back where they should be Sick of being dictated to by foreigners who come here and think they have more rights than we do Ship them out Nothing but trouble makers who should never have been allowed in with their vile disgusting attitudes and hatred towards us Brits This government is a disgrace letting people in who hate us I would not dream of going to a foreign country and being disrespectful to their people Look at them protesting on our streets burning our flag taking over our homes and jobs and calling us racist in our own country when we complain if this government doesnt pull its finger out to stop this nonsense they are creating a ticking time bomb,160,3,0.01875
David Milner the super troll is on the loose again,10,1,0.1
Karen Sherwin thank you sweetheart hes a twit  nothing more ,10,1,0.1
Kimberly Puddick Ive seen a lot in my 50 years but never have I seen the face of our country change so much in the last decade to the disadvantage of the indigenous population I have nothing against anyone whose decent respectful and law abiding But this has gone too far and has to stop,55,2,0.03636363636363636
Ditto Karen If it doesnt stop within the next 2 decades the population will be Muslim My fears are for my grandchildren bigger concerns that some halfwit trolly twit who wanks for a living Unlike him  numb nuts like him Iv real concerns,43,3,0.06976744186046512
Iv real concerns spelling and mental health,7,0,0.0
You should be more concerned that your a tosser ahaha,10,1,0.1
racism in the uk ide say the planet,8,2,0.25
Kimberly Puddick He must be a tosser hes clearly gone blind from over wank to not see whats going on in our country and think its fine for immigrants to rule the roost in OUR country,36,4,0.1111111111111111
I think many immigrants know how to navigate a very lacks benefit system  not their fault it is so poorly administered What is so reprehensible is the politicians who do nothing about it maintain the system and just pontificate broadcasters who accuse all of racism if they say anything about it and people in the benefit council and any other government body that are for the most part promoted or in positions far exceeding their capability and whom exercise no discretion act as judge and jury and impose sledgehammer tactics on the otherwise lawabiding and wonder why we call them jobsworths But I cant see any of that changing soon,110,2,0.01818181818181818
Very well said Kimberly,4,0,0.0
i agree with you well done,6,1,0.16666666666666666
They seem to hate whites here,6,0,0.0
You know what I am past caring,7,0,0.0
Scotland is quiet a racist place,6,0,0.0
YES ITS BEEN FORCED ON US BY THE MEDIA CRAP FROM THE BBC AND OTHERS MULTICULTURISM IT WAS CALLE WELL ITS FAILED MISERABLY ISLAM MUSLIMS DO NOT INTEGRATE THEY DOMINATE AND EVENTUALLY TAKE OVER WHICH EVER COUNTRY THEY ARE Im voting UKIP in the next election,46,4,0.08695652173913043
Common sense so refreshing to see a person with common sense nowadays ,12,0,0.0
White Genocide but no one will admit to it httpswwwyoutubecomwatchvwRZhD8S6o5s,10,1,0.1
Muslims DO NOT want to integrate full stop,8,0,0.0
Youre right they want us to be like them or die,11,1,0.09090909090909091
Andrea Henderson Smith Live like them or die Wow just wow,11,0,0.0
My 8 old son got called a racist off his class friendsWhy because he laughed at an Arabic word that played back on iPad the girls were looking upreally if anything sounded funny I would laugh doesnt make him Racist its frigging pathetic now  I had to explain to him what this meanti didnt feel the need to explain this as I make him see everyone the sameteacher well just ignore them really  Sort it outout of hand now ,79,8,0.10126582278481013
Anyone who makes an accusation of racism where non exists should be incarcerated for 6 months and subjected to Love Thy Neighbour Mind Your Language Curry And Chips and Till Death Do Us Part for 18 hours a day,39,0,0.0
Children are getting dragged in to it getting hurt ridiculous,10,0,0.0
I was born in 1960 and when I was 6 or 7 if I was shortchanged I was being Jewed we dont know any different at that age Also as your son is only 8 he is within the law for any remarks as he is below the age of criminal responsibility,52,3,0.057692307692307696
No child should at that age  Hes being a child and laughing like any otherwith no harm or bad towards anyone its a shame,24,2,0.08333333333333333
So what,2,0,0.0
Who are the most racially abused people in Britain The BRITISH Everybody is a racist weve all done it and those who say they havent are lying,27,2,0.07407407407407407
id give this guy a high 5,7,0,0.0
British people from all ethnic back grounds voted to leave EU,11,0,0.0
There is a danger it will become so unless our politicians get a grip of immigration asap,17,0,0.0
Dont think so other way round,6,1,0.16666666666666666
The racialism in this country is from the liberal left against the white working classesthe majority of us detest racism its just another name for bullyingthe anti Muslim feelings are a natural reaction to their small group of fanatics who ruin it for everybody elsethe contempt towards white van man from the lefty luvvies is the real problem,58,4,0.06896551724137931
Racism is growing simply because of imagrants being rammed down our throats  i live in central Bristol  so i need say no more  im not racist before you start but only an absolute fool would say that we get on with each other  WE DONT,45,5,0.1111111111111111
Yeah against white people,4,0,0.0
When it comes down to it yes BUT its not all one way Its whites on blacks blacks on whites whites on asians asians on whites etc Thats not to say most people dont get on with their neighbours but it must be acknowledged that historicaly the world as a whole has been racist and it goes both ways,59,6,0.1016949152542373
Lets be honest chinese jews christians from anywhere even eu citizens are not the problem the main problem with immigration has been islam They want their own laws and that cant happen,32,5,0.15625
Exactly that,2,0,0.0
I agree,2,0,0.0
Theres an ancient saying When in Rome do as the Romans do I used to live in Australia Their saying is YOU dont change Australia Australia changes YOU I believe in both of those sayings,35,2,0.05714285714285714
Agree,1,0,0.0
Agree paul,2,1,0.5
If their laws are incompatible with ours which they are in some ways then its a no go area according to our law and should be made clear to them before they come here demanding their own laws,38,0,0.0
Agree Karen,2,0,0.0
Well said agree 100 percent,5,0,0.0
Youre the exact reason why brexit voters are portrayed as racist ,11,2,0.18181818181818182
Which I am not and what have I said thats racist I want to know how the left mind works because your comment makes on sense at all,28,1,0.03571428571428571
100 right Keith  i am sick of them coming here wanting there own laws you try doing it in there country  you would be dead,25,1,0.04
Still waiting from a reply from Charlie J CJ why comments like this makes brexit portrayed as racist,18,2,0.1111111111111111
Charlie J CJ unfortunately this retoric has been going on a lot longer than Brexitthe British have been bought to their knees by having their mouths gaggeddemocracy died a long time ago,32,4,0.125
Spot on Keith Most Muslims are not terrorists but most terrorists are Muslim,13,0,0.0
Im not saying that its just al the immigration we have had forced on us islam is always the problem one whether its rape culture corruption terrorism wanting own laws ie sharia wont intergrate list goes on and on Personly id ban islam completley We never asked for any of it,51,8,0.1568627450980392
I thought wanting own laws wont integrate would more accurately sum up your attitude to Europe but hey thats just me Rape culture corruption are evils that affect the whole planet  show us to what extent Muslims in the UK accept and promote either,44,1,0.022727272727272728
You got it spot on Keith Jones,7,0,0.0
Robin Tudge one word Rotherham,5,1,0.2
The sooner we all come to our senses and realise that Islam Christianity Judaism and any and all other religions are completely man made tools for the control of other men the better place this world will becomeThere is no Allah or Jehova nor did Mohamed Moses or any others speak to a supernatural being its all just dangerous fairy tales,61,2,0.03278688524590164
Thanks for waiting patiently Keith lets just clear your comment up first and then i will educate you on why your comment was along the lines of racist Firstly I am a conservative which is the other side of left wing and you simply commenting I have a left wing mind doesnt make it true I am however not racist I voted for brexit  to leave the EU because I believe it is the right choice for the uk to control its own borders as the uk is heavily populated already and controlling immigration would stop many people coming to the uk to claim what is not rightfully theirs and a few other reasons such as jobs and housing for the young adults Secondly you just singled out a whole religion as the reason why immigration is bad for the uk are their issues with extremism in the Uk yes are all Muslims bad  Well its estimated that their are 3 million Muslims in the UK if they are all terrorist like many people claim then you would all be dead already its the few who are extreme that claim then want sharia law This will never happen because the uk has its own government and own laws If anything needs to change its that we stop letting people immigrate who bring nothing to the uk no money no skills no degree Let the people who will actually become doctors police engineers builders and other valuable jobs in and remove the benefit bludgers ,253,12,0.04743083003952569
Not racist at all you may be conservative but you are a politicaly correct moslem apeaser You are the part of the problem and you dont even see it Whatever the nunbers can you tell me whe 14 of jails are moslem theres are not 14 of the population not to mention the number that should be in jail yes they are the problem thanks for your class of how to be a moslem apeaser if thats what you call educated your wrong but im a little older and PC is not me where its part of your brainwashing they call education the dunbing down process Even after all the terrorits attacks all the gang rapes across the country you cant see the problem thats not eduction thats ignorance you cant solve problems if you can not admit there is one in the first place,145,16,0.1103448275862069
Agree with some of this,5,0,0.0
I believe you are correct religion is the controlling of the masses paid for by the masses,17,0,0.0
Yet again you make a statement that is totally false  Im not a Muslim appeaser I personally believe that all religions cause more issues then solve anything really But you targeted a whole demographic of people for one specific comment which is racism you saying the issue with the uk is Muslims is the same as someone saying all black people are lazy  not my view but its Essentially the same thing you have blamed a whole religion for the uks immigration and linked them with terrorism Did you know that before Muslims because linked with terrorism the IRA carried out a number of attacks on our country  And they where Christians I never said their arent issues in the Uks Muslim society but Im not ignorant to other peoples beliefs Do you know Muslims serve in our armed forces  Did you know Muslims fought in two world wars  I understand your frustration but dont point the finger at a whole group of people when its the minority who are at fault,172,7,0.040697674418604654
All Im basically saying Keith is your one of the people who voted for britex just like me but you did it because you have a clear dislike of Muslims and immigration where as I voted to leave the eu so that future generations can have jobs and buy houses and for the government to stop giving handouts to nonBritish people,61,4,0.06557377049180328
Again you are wrong I voted for brexit so we are not dictated by them and free to vote in and out who we can Islamic migration is has not ever been am eu issue it is now because of the millions they are letting in but not the reason to leave the eu separate issues with different problems Islam is not compatible with western culture never has been never will be,72,3,0.041666666666666664
Its not the UK but its a case in point httpwwwmsncomengblifestylefamilyrelationshipsmumtoldtoleaveplaygroupfornotbeingmulticulturalarBBzdVdQliAAmiR2Zocidspartanntp,11,1,0.09090909090909091
All these years of give give give to the world and what for,13,0,0.0
What i want to know is why is Britain always in the firing line for being racist Countries cultures and religions across the whole globe are racist but it only seems to be the uk that gets the stick,39,2,0.05128205128205128
Thats because our society is packed with invertebrate progressive liberals who think they have the moral high ground They are blind to what goes on around them they attempt to cripple free speech and criticism The biggest racists are the progressive liberals,42,1,0.023809523809523808
Stick from whom A bunch of twats like the woman who says shes an anarchist I suppose she thinks property is theft You know what This is all a nonbloodyquestion being bandied about by idiots These people are subversive and should be ignored Britain is so racist people are trying to get into it from all over the world If Britain is so racist how come Sadiq Khan is Mayor of London People who want continuous uncontrolled immigration are all racismbullies Theyre lefty globalists who think patriotism is racism Thats why they hate Churchill,94,7,0.07446808510638298
So true,2,0,0.0
Well said Dan,3,0,0.0
Dogooders spoilt our country,4,1,0.25
Because there are jobs in it for these SJW clowns who cant find useful employment because they only have a gender studies or an art degreethey create endless hysteria around it to generate funding to profit from it,38,2,0.05263157894736842
The League Against Globalism Very well said There is racism I personally have experienced this twice recently By the way I am white English,24,0,0.0
All the lefty snowflake luvvies call us racist because according to their warped ideals We should be providing a good homejob and benefits for every single sob story the world can provide Of course if those plankton feeders had their way our Islands would literally sink under the weight of all the opportunistic migrants Precisely why we must all strive to keep the likes of Corbyn and Farron from ever gaining office,72,4,0.05555555555555555
It seems we like to feel subservient to the rest of humanity be they good bad or indifferent We like playing the under dog apparently it makes us feel good When we hear of people standing up for our culture and values we shout them down as being racist xenophobes and the like so now we have taught ourselves to tolerate bad behaviour from all quarters More fools us,69,0,0.0
So true,2,0,0.0
I have suffered racism wile working in London many times now I am white and British but do I label all minorities as racist due to the abuse some have given me no I dont but when 1 white British person makes a slightly racist comment the entire nation gets called racist its the double standards the leftie twats have created by thinking they were doing good but in fact its actually tearing this country apart to the point where minorities are never in the wrong and the rest of us are always to blame,95,3,0.031578947368421054
Because instead of standing up for our rights we make ourselves easy targets by preferring not to make a fuss You get the government media  establishment and newspapers you deserve ,30,0,0.0
Very well pointed out Dan,5,0,0.0
Absulutly agree with you Dan ,5,1,0.2
Well said Neil and Dan Progressive snowflake liberals will never silence me and those who believe in true free speech,20,0,0.0
The Remain politicians like Yvette Cooper and Diane Abbott are still calling decent British people who voted Leave racist and xenophobic Surely this is a hate crime and these two should be arrested and prosecuted,35,0,0.0
Dan Hopkins good question why its because the Libs and labour mostly can use this to attack anybody that talks common sense or is patriotic and i think you will this is a trait amongest socilsits and liberal governments,39,3,0.07692307692307693
During the whole brexit thing leftys were saying introducing a points system for immigration was racist ect But countries all over the world employ similar systems yet they get no flack for it,33,3,0.09090909090909091
wwwnewstalkscouk,1,1,1.0
Its just a tactic they use to stop people from speaking out They have used this for years if you disagree with them they label you a racist to shut your opinion down as people fear being labelled a racist I feel the people of the UK and the rest of the world has woken up to this far left nonsense and have had enough of being treated as second class citizens in the land they were born Better to be disliked for the right reasons than liked for the wrong reasons is what I say,96,0,0.0
Exactly what ive always said James better to be disliked for having a back bone and standing up than to a total melt,23,1,0.043478260869565216
Points system another thing that didnt arrive after the leave vote I new it was horseshit thats why I voted to remain,22,3,0.13636363636363635
We havent got the power to bring it in yet Incase you didnt know we may have invoked article 50 but we dont have control until we are officially out of the EU To think things will change instantly is stupid,41,4,0.0975609756097561
There will be no points based system  Teresa May September 2016,11,0,0.0
Well wel see ay with control back in our own hands maybe it could be voted in in the future,20,2,0.1
Exactly Marc thousands of people get a doing or worse everyday not condoning that obviously but only if its an ethnic that gets a hiding do the media make a hoo ha about it,34,1,0.029411764705882353
The idiots would blame it on Brexit like they blame it for everything else Giving rain tomorrow all because of Brexit ,21,2,0.09523809523809523
The left wing use these tactics to make folk think badly of Ukipthey have nothing else to usebut they are despicable tactics which do not work anyway,27,2,0.07407407407407407
Its the biggest joke in the world and most politically correct free speech country that doesnt allow free speech,19,1,0.05263157894736842
You have free speech if you belong to a certain mob that hates usthen you can say anything you like with no comebacks,23,1,0.043478260869565216
