ommentmessage,1,1,1.0
I think Paul Nuttall is right you need to be a horrible nasty person to keep that lot in control,20,1,0.05
Only retards would think that Assad used chemical weapons against his own people when he is winning the fight against IS,21,0,0.0
He wasnt even fighting IS there you mug you know nothing about it D,14,1,0.07142857142857142
I dont listen to the establishment media you pathetic hyphenated cock Oh hang on WMD,15,2,0.13333333333333333
Christopher HamillStewart Doesnt that support the argument that he didnt do it then Why use it against innocent civilians but keep it under wraps against his armed enemies,28,3,0.10714285714285714
Steve your right only retards believe it God I wish I had the mute button so I did not have to hear them,23,0,0.0
Witness Iraq and Afghanistan Home grown Jihadis whom only see middle eastern Brothers and whom desire to wage war will be kicking off here,24,1,0.041666666666666664
you cant believe the media we should stay out of it we never learn,14,0,0.0
Thats why we are in the state we are in poking our noses in where its not wantedneeded,18,2,0.1111111111111111
I totally agree,3,0,0.0
Best to do nothing at all,6,0,0.0
Agreed Paul Nuttall,3,1,0.3333333333333333
we should keep OUT of itits bad whats happening over there we know  but it could turn deadly for all of us,22,2,0.09090909090909091
We cant oust Assad like we shouldnt have ousted gaddaffi or sadam Hussain even though they are dispicable its really non of our businessthe benefits of social media allows us all to see and witness the atrocities that happen in this world that appall us and we try to impose our sense of morality on all those who offend us but really we should keep out of it ,68,6,0.08823529411764706
Where we screwed up in those other places you mentioned was that we removed the whole infrastructure instead of just the dictator if we did that in Syria then the result would be different then hold elections and Syria decide on its future,43,0,0.0
Wrong  The underlining fact is every western country that has got involved in a Islamic country is they have all failed on understanding there countrys set up on and around there beliefs so rocking up thinking we able to throw western style policys about is not and has not worked,50,2,0.04
Couldnt agree more,3,1,0.3333333333333333
I agree that Libya was a mistake As Quaddffi renounced terrorism and was taken off the terror list There was no reason to attack Libya He shouldnt have been removed at all That was a mistake,36,2,0.05555555555555555
Greg Noles Assad has already been elected through Syrian elections,10,1,0.1
We are our government is as much to blame as anyone is  its SICK is what it is httpswwwfacebookcomWINGSNEWSphotosa82341025774201210737418288233857677444611305791806170519type3theater,19,1,0.05263157894736842
However in the case of Iraq Saddamm should have been removed in 1991 we had won the war back then There was no reason to have left him in power When he was finally removed in 2003it was the right decision to bring down his despotic regime He was put on trial Judged by Iraqi Judges in a Court of law and found guilty of crimes against the Iraqi people and sentenced to death by hanging And The Sentenced Was Carried Out By Iraqis and not the American military unlike the end of World War 2 We have brought democracy to Iraq and its people The women have voted and expressed themselves in their elections While their new government is far from perfect it is a far better new system of government than what they had under Saddamm  The Surge had succeeded under George WBush it was the decrease in forces under Obama that led to disastrous policys While the region is not completely stable it is a viable situation that can lead to success in the long term provided we dont abandon Iraq prematurely Once the terrorists are eventually defeated in Iraq we can decrease our forces It will be up to the Iraqi government if they want a small permanent American military base like we have in Germany Japan and South Korea If they dont desire that then indeed we should leave completely,235,8,0.03404255319148936
Fran Parody The underlying fact is that whether we like it or not it takes a dictator to control countries populated by religious factions which will slaughter each aother unless forcefully dominated by a secular authority Cosy Western democracy is not an option ,43,1,0.023255813953488372
Robert Michael Jensen Gaddafi was got rid of because he was planning the Gold Dinar which would replace the US dollar as the preferred currency for oil transactions in Africa This directly threatened the solvency of the USA so naturally Gaddafi had to go This essentially opened Europe to the plague of Islamic immigration we saw shortly afterwards ISIS found it very profitable to take the dibs from the refugees while screwing Europe at the same time WinWin Gadaffi was essentially the cork in the bottle to hold back this mass exodus but with him gone we have seen the result,101,4,0.039603960396039604
Agree,1,0,0.0
No because then there will be a clear line ISIS and Syrians who are fighting ISIS People are being sucked into notion that Assad did not want democratic elections so started the war Then along came ISIS so everyone fighting ISIS and rebels fighting Assad AND ISIS Get Assad out of way then smash ISIS who are losing anyway,59,0,0.0
Michael glad you brought that up love how the media did not report how Nikki Haley the US Ambassador to the UN said Assad would not be allowed to run in an election as the head of his own party Of course this broke a deal with the Russians and Assad Kind of like how Clinton Bush and Obama broke the deal Bush I and Thatcher made with Gorbachav about not expanding NATO into Eastern Europe in exchange for allowing German reunification Yet some Americans wonder why people dont trust America,91,3,0.03296703296703297
Assad was voted in through a democratic election receiving 90 of the vote in 2014 The rebels in Syria introduced violence through disagreeing with the democratic vote  How would you feel if the Remains did the same in the UK,40,0,0.0
The wests interference has been extremely costly already  They cant or wont even tell us who it is they are supporting Just that they are against Assad ,27,1,0.037037037037037035
Nuttall is sounding more like a Left Wing establishment politician day by day Political correctness and ignorance Does not impress at all,22,1,0.045454545454545456
What makes you say that,5,0,0.0
Thats a broad question but in his recent approach to various matters recently he is sounding like a traditional politician On the Syria question  the West want to get rid of Assad but not the Syrian government and infrastructure Likely that Syria will split into 3 as it should have been at the time of the Sykes Picot agreement when the UK and France screwed up a large part of the Middle East,73,1,0.0136986301369863
I think that Mr Nuttalls views fall in line with Mr Farage and nobody can accuse him of being left wing PC,22,2,0.09090909090909091
Playing the leftist election game to take labour votes in the upcoming local elections,14,0,0.0
The UK should concentrate on protecting itself at home  keep right away from foreign warsbring all our troops  equipment home build up a strong coastal defence patrol fleet Just make ourselves as independent of others  self sufficient as we can,40,1,0.025
I dont suppose the huge Syrian oil reserves have anything to do with it,14,1,0.07142857142857142
I have supported Trump up till now but it looks increasingly like he is being ill advised Once again I think that the establishment have taken control in the hope of regime change which in the past has proven to be a complete failure I think that James OSeasnain and Steve Heather are both correct with the appraisal of the situation It is only my opinion but last week the world looked much safer with the US and Russia seeming to come together whereas this week we are on the brink of WW3,93,2,0.021505376344086023
Trumps just another elites puppet,5,0,0.0
Louise Leite I cant see that being the case Louise everybody seems to hate Trump even the elite its early days yet but the world is watching developments in Europe and the US with much trepidation for varying reasons,39,1,0.02564102564102564
I think Trumps been got at maybe they have something on him,12,0,0.0
Bob he is surrounded by globalists and Russophiles Worse he has violated the US Constitution by committing an act of war against a soverign nation without a declaration of war or authorization of force The war powers act only gives him power to act if there is an imminent threat or in response to a domestic national emergency Neither was present Although he will argue imminent threat but that is a joke considering Syria had no ICBMs to deliver chemical weapons to hit America Also I doubt he can even prove conclusively Assad was behind the chemical attack I personally think the mythical moderate rebels were behind the chemical attack If Trump has a change of heart and decides to deescelate the situation the same advisors that said he could act without Congress will resign and then call for his impeachment The neocons in the GOP like Speaker Paul Ryan who called for Trump to step down as a candidate 3 times during the election process will be more than happy to do so All Democrats will vote to impeach and convict and so will all establishment Republicans So if he stays in it is as a pawn of the establishment and if he does not we get President Pence a lifelong neocon establishment politician Things dont look good my friend,221,8,0.03619909502262444
Stuart Munnery Something has definitely changed over the last few hours Steve with even Clinton praising him,17,1,0.058823529411764705
Lance Heaps I can see what you are getting at Lance we can only wait and see what happens It looks to me like Trump has stepped up a gear with some tough decisions being made The only thing I disagree with you on is Pence I think that he will prove a massive asset to the US in times to come,62,0,0.0
Trump is just another tool of the jews,8,1,0.125
Bob Marlerhave you ever heard of the Hegelian Dialect If you understand the Hegelian principle youll understand what the elite is up to and how they are using Trump to get what they wantthey always do,36,3,0.08333333333333333
I dont think the UK is responsible for anything that happened there apart from arming the rebels What I want to know is what and where all the aid is going Theresa May said that aid from UK is million Are the EU giving or are they just taking our money and saying its from the EU What do they spend it on All I see is portacabins and a few shops medicsl centresEvery one goes on about how we need more for the NHS Well stop providing unknown rebels arms Remember Assad is supported by Muslims who want a secular society They also tolerated and actively protected other faiths and Strains of tolerant Islam No Assad and strict Islam will appear as is happening in TurkeyIranThe important thing is be like China keep out of other countries affairs and be careful what you wish fit,146,5,0.03424657534246575
who are we to said out or stay to assad i dont understand why we dont think about ou baby i think there are enought or not,27,7,0.25925925925925924
These countrys should be given a choice be peacefull and we will offer help money and skilled labour etc to rebuild so they can live happy peacefull lives without fear of starvation war etc or be wiped off the planet once and for all,44,5,0.11363636363636363
Thats the plan though just like Afghanistan Iraq and Libya All part of the NWOs planwake up people,18,3,0.16666666666666666
The problem with Syria is not unusual It is purely a dispute between sectarian factions not helped by a dictator who wants his own way like all dictators The Middle East has always been so Like Afghanistan the problems go back thousands of years and the West cannot solve their problems The solution lies with the Arabs themselves but I note that the Gulf States and Saudi Arabia want nothing of it Best we Brits stay well out of it we have enough of our own problems,87,0,0.0
100 correct  mind our own business  we have our own problems to solve  many governments think  throwing money at them  with armies  and aid  will sort it out  it will not  Let them evolve at their own time  nature  knows best ,41,0,0.0
I wish Trump had minded his own business the US is only 20 trillion in debt the last thing we need is another pointless war,25,0,0.0
When will the British government ever learn to keep its nose out of other countries business Now we want to get rid of Bashar alAssad as the leader of Syria We helped get rid of Hussain from Iraq we helped get rid of Gadaffi from Libya and threw these countries into utter chaos We all see the flood of refugees fleeing these war zones and arriving in Europe and the trouble its caused If America and Britain hasnt learned its lesson from these fiascos it never will Whats happening in Syria is none of our business and Britain should stay out of it If America wants to fight another illegal war then they should fight it on their own and not drag us into another war,126,5,0.03968253968253968
Mel the American people keep on falling for the same old parlor tricks I was hoping this time would be different but nope They turn on the MSM hear Assad killed babies 100 times in 1 hour with absolutely no evidence to support it and even people that voted against Trump are like I am finally starting to like this guy,61,2,0.03278688524590164
Lance we intervene in these middle eastern countries at our peril Many factions in these places have been fighting each other for thousands of years And America and its allies jumping in with both feet only causes more chaos death and displaced people flooding into Europe with all the problems that causes Enough is enough it is none of our business and we must not get involved We will if President Trump has his way end up fighting everyone Regards Mel,81,0,0.0
Total agree the yanks cause all the problems,8,0,0.0
Greater Israel Project is behind it allThe greedy jews control America and BritainWAKEY WAKEY,14,4,0.2857142857142857
Not to mention America is 20 trillion in debt we cant afford another war,14,0,0.0
We the people know all this but the prats will do just what they want as did that liar Blair WE SAID WE DID NOT want our soldiers going to fight but he sent themAnd now the world is not a safe place,43,2,0.046511627906976744
So you would sit on your hands and do nothing would you  Innocent people gassed to death and you would do nothing Trump and America did not try to force Assad to leave They gave a measured strike to let him know You cant get away with that It shows rightly now that the world is slowly going along with what America did many many countries and many organisations all going with America All that is except you,78,0,0.0
Yea we went along with the USA in Iraq with WMDs oh hang on how did that turn out,19,1,0.05263157894736842
Christ what planet is Nuttall on Does he really think that we dont have radical Islam in this country,19,2,0.10526315789473684
Russia saved Assad They will have to go through Russia this time Putin peace in our time,17,1,0.058823529411764705
Its a bad going on there but he is right keep our noses out its a crock of crap,19,0,0.0
Not our fault but the government they are the ones to blame not the people of the country also they dont do it in my name these shower was not elected in as they are now also dont trust them,40,2,0.05
For once he may be right,6,0,0.0
Agree,1,0,0.0
Agree it was not long ago when Britain and France demanded the eu lift its arms embargo so they could give the terrorists more weapons this war in Syria was not started by the Syrian people it was started by the same countries that always start wars Britain America France and a few of their friends i am sick of governments working for an elite and not the people,69,2,0.028985507246376812
If we defeat the Assad supporters now I guarantee well be back there in 10 years saving the very same people from being persecuted by the ones were currently assisting,30,0,0.0
Scott your absolutely right US troops were out of combat operations in Iraq for about two years then they were right back in These gullible goldfish never learn I hope the UK has the sense to stay out I am sad to say I doubt the US will Of course it might trigger WW3 and doom us all Trump could not have acted more stupidly than he did,68,1,0.014705882352941176
the west supplied syria with chemical weapons,7,1,0.14285714285714285
There seems to be a program to get rid of secular leaders all over the middle east I dont know what the deep reason might be but it seems to me that this will only accelerate the radical Islamisation of the whole area The Saudis have a big hand in this Just coincidentally they spend billions every year on supporting mainly Sunni extremist groups terrorist groups radical jihadi madrassas political pressure groups and pay off journalistspoliticians and other special interest groups all over Europe and the West in general They also have a huge influence on US politics due to their buying so much US military equipment and supporting the US dollar on the world financial market Without Saudi backing the US would be bankrupt Just sayin,127,6,0.047244094488188976
The head of the US National Security Council Lt General McMasters is a protege of former General and CIA director Petraeus Petraeus now works in the private sector and does huge amounts of business with Saudi Arabia McMasters has also heeped tons of praise on Saudi Arabia Ironically McMasters is also pushing for an 150000 troop ground invasion of Syria Your right the Saudis are heavily involved in this,69,7,0.10144927536231885
Another guy that has been making the rounds lately on the US media is former US Ambassador to the UN Bolton who basically wants war with Iran Syria and North Korea but loves Saudi Arabia and wants closer ties to them These are trying times,45,0,0.0
Lance Heaps the Saudi Wahhabist sect has always had a hardon to dominate the whole of the Middle East Ever since the breakdown of the Ottoman Empire post WW1 thay have been working on this Because Mecca is within the confines of the Kingdom they believe it is their destiny to bring the true Islam to the whole world It is interesting to read up on their recruitment methods like butchering thousands of Shiite Muslims during raids during the Great War It is documented in British archives Nothing has changed since then except that they now essentially have huge influence due to oil and the petrodollar,106,4,0.03773584905660377
so right we do not need to fight someone elses war we have lost enough young men or maimed or even jailed for what,24,1,0.041666666666666664
Yes leave well alone I say,6,0,0.0
Just hang on You all have very short memories It was NOT THE WEST OR AMERICA that wanted to oust Assad Gadaffi or anyone The people in Egypt rose up against their dictator They also stood up and threw out the government in Tunisia This was called the Arab Spring in Libya Gaddaffi started to kill people And then bomb them So the West intervened then to stop him In Syria the people stood up to oust Assad and he started killing them too But what happened then created the vacuum into which the Jihadis and Daesh stepped And that was that the liberal hand wringers of the labour party and liberal democrats would not let our country bomb assads military capability to prevent him killing civilians So Obama pulled out along with the EU contingent So when Assad started his slaughter in earnest The Jihadi groups took advantage So you lot talking about keeping our noses out are twisting the events a little It was the NON INTERVENTION which created the situation where the nut jobs took advantage Mel Spittle needs to do a bit of research There would have been NONE of these refugees if at that time the UN and the West had intervened as they should have It was done properly in the Balkans But no that did not happen It is precisely because of liberal hand wringers not allowing troops from Europe to go in to stabilise Libya that the Jihadis took hold The west acted to prevent the dictators using their tanks and bombers to kill But stopped short They all looked to Iraq and did not learn one lesson from it That you have to intervene but instead of doing it the way the yanks did it You plan for it you make sure that their police and armed forces are retained Not like they did in Iraq just disband everything The liberals and labour did not want to commit troops in fear of casualties Because they did not have a clue what happened in Iraq and they believed their own appeasing bullcrap And now with the Mel Spittles Spew the same garbage When you get tyrants in the world History tells us that if you do not put a stop to them immediately Then the job of getting rid of them is not only harder But way way more costly in lives And what have we seen Because the west did NOTHING But wring its hands we have seen mass slaughter How many times has Assad now gassed people Not once was he taken to task by that gutless fecker Obama Now Assad has been given the message If Paul Nuttal and Mel Spittles had been around shortly before the last war We would all be speaking german now Because the Chamberlains and his supporters did NOTHING but allow hitler to get on and do what he wanted He could have been stopped but the liberal hand wringers then would not do anything either In fact they were disarming us,508,16,0.031496062992125984
You dont seem to have any memory at all but an ability to create fictionIt was not the people who rose against Assad in Syria It was a limited group of extremist rebels which disagreed with the result of the democratic vote of 90 of the people in 2014 giving Assad a further seven years in office as President There were certainly no popular uprisings against Gaddafi note spelling or Hussein,71,3,0.04225352112676056
Better to speak German than Urdu or Arabicand i doubt the Germans would have Raped as many girls in places like RotherhamWe should have kept our nose out of WW2 and we should keep our noses out of Syria,39,4,0.10256410256410256
For once he is absolutely correct  including his stance on the bombings from 7th April We are entirely complicit in this  when I say we I mean our government,29,1,0.034482758620689655
httpswwwfacebookcomWINGSNEWSphotosa82341025774201210737418288233857677444611305791806170519type3theater,1,1,1.0
We saw the same liberal media calling for Saddam to be ousted after he gassed his own people the marsh Arabs and we all know how the Iraq war turned out,31,0,0.0
Any Arab leaders helping NO,5,0,0.0
This is true we should have learned something from Iraq and Libya we will never solve the troubles over there you just have to read the bible and history books this is what these countries do they kill each other they still live in the dark ages we should keep out of it as we always make things worse,59,0,0.0
I dont get it the USA blows up a hospital but Assad is a danger We use napalm and depleted uranium tipped ammunition causing generations of deformities but theyre the bad guys Come on,34,2,0.058823529411764705
True ,1,0,0.0
Their aim is to destabilize the whole of the middle east  Its for money oil power and what ever else they can find there,24,0,0.0
Bloody hell Nuttall a piece of common sense coming from you,11,1,0.09090909090909091
The West should only get involved in the Middle East if Oil supply is threatened It is not our job to topple dictators  since history has shown that only dictators can keep the Peasants under control The middle East is like the UK 600 years ago it takes time and a reformation to change mediaeval attitudes into modern democracy Once Assad is deposed just who do you think will fill the vacuum  a forward thinking progressive peace loving prime minister Heres a clue Libya Afghanistan  Iraq Egypt  all models of modern democracies where human rights are defended,97,1,0.010309278350515464
Not in my name,4,0,0.0
Do politicians read these posts because I get the feeling they are in denial and just ignore us and it is us who will suffer the consequences,27,0,0.0
httpswwwyoutubecomwatchvFQIrSR6tKJg,1,1,1.0
Isis was created so that Israel could have its Greater Israel project Trouble is most people are too scared to say it because they are afraid of being called antiSemite,30,1,0.03333333333333333
Well said GarySome of us know the truth about the jews,11,2,0.18181818181818182
Look what happened in Iraq better to keep some sort order,11,0,0.0
The only reason Donald Trump attacked Syria is probably because the Chinese president was in America at the time So it was either a show of force to him or they have come to some sort of deal Because the Chinese president is moving 150 thousand troops on the North Korean borderI am guessing America will attack North Korea Israel will go after Syria then it will be the turn of Iran,72,1,0.013888888888888888
Sorry kev but this goes back more than a thousand years way before hitler and the west interference argumentand the fact is its spreading,24,3,0.125
Wake up folksits all about the greater Israel projectThe greedy jews want all the land for themselves,17,3,0.17647058823529413
i agree we should have learned our lesson to keep out of the middle east affairs saddam hussein gaddaffi osama bin laden look what has happened since we killed all of them isis are running amok at least these leaders kept some sort of order even if we didnt agree with there way of doing it,56,7,0.125
Correct Paulbut will they listenNO,5,2,0.4
