ommentmessage,1,1,1.0
Die Grünen als Nazis zu bezeichnen finde ich nicht gut Das tun die linksgrünen Wolkenkuckusheim Architekten schon mit uns Auf dieses Niveau muss man sich nicht begeben oder  41 inzwischen und raus ,32,2,0.0625
Herzlichen Glückwunsch zum Rausflug aus dem Landtag im Saarland  Wer permanent GEGEN die Bürger arbeitet sie verarscht sie linkt und sie betrügt muss sich nicht wundern wenn er dafür irgendwann die Quittung bekommt Ich hoffe in Schleswig Holstein gibt es auch bald was zu feiern Der Tag endet so schön darauf gönne ich mir gleich einen Sekt ,57,1,0.017543859649122806
Ein guter Tag ,3,0,0.0
Man kann heute am Ergebnis der SaarlandWahl sehen das eine steigende Wahlbeteiligung immer schlecht für populistische Parteien sind und diese aus dem Parlament gewählt werden,25,2,0.08
Schon wieder ein Landtag ohne das Grünzeug das nicht einsehen will das es auf dem Kompost und nirgends anders endet,20,0,0.0
Kifi nein danke,3,1,0.3333333333333333
Simone Peter hat gerade in einem Interview bewiesen dass Grüne absolut nicht lernfähig sind  Also auf zur nächsten gescheiterten Wahl für die Grünen ,23,1,0.043478260869565216
Juchuu,1,1,1.0
Glückwunsch zum Abstieg ihr Luftpumpen  ,5,0,0.0
Ein riesen DANKE an die Saarländer Ihr habt ein Zeichen gesetzt und die Grünen vom Platz gestellt super,18,2,0.1111111111111111
wir waren im Wahllokal  geht einmal in verschiedene Großstädte ihr fühlt EUCH dort wie im Urlaub  Ausland ,17,0,0.0
Ich danke den über 95 die im Saarland gewählt aber nicht Die Grünen gewählt haben Die Grünen sind wegen ihren Haltungen zur Geflüchtetenpolitik und zum Islam die Partei die bei uns die frauenverachtendsten Wirkungen entfaltet Deshalb gebührt den Grünen dass sie auch auf Bundesebene an der 5 Hürde scheitern,49,2,0.04081632653061224
Weg sind die Grünen im Saarland Ein Tag zum Jubeln D,11,0,0.0
Herzlichen Glückwunsch an das Saarland,5,0,0.0
Ich bin absolut begeistert über das Wahlergebnis im Saarland Euch braucht keine Sau ,13,0,0.0
Und tschüss ,2,0,0.0
Schöööööööööööön und nun die Grünen überall rausDas wird ein Fest für Deutschland,12,2,0.16666666666666666
hahahaheute ist ein schöner tag die grünen raus die sonne lacht was will man mehr,15,2,0.13333333333333333
Schön das ihr wieder mehr Zeit habt Blümchen im Saarland zu pflücken ,12,0,0.0
IHR SEID RAUS Merkt Ihr jetzt endlich was,8,0,0.0
Ihr und Cem Özdemir müsstet den Volksentscheid in der Türkei mehr thematisieren dann kommt ihr auf 35 ,17,2,0.11764705882352941
Weine nicht kleine Eva und noch ein Landtag von dem ihr euch verabschieden könnt Ein schöner Tag die Welt steht still ein schöner Tag ,24,0,0.0
Auf NimmerWiedersehen  es grüßen die Jäger und die Sportschützen,9,1,0.1111111111111111
Tja sehr schade Ich finde Umwelt und Tierschutz sehr wichtig doch eure unsympathischen Front Runner wie Roth oder Künast eure Abneigung Deutschland gegenüber und kaum durchdachte Asylpolitik haben euch den erneuten Einzug ruiniert,33,4,0.12121212121212122
Die Grünen sind wie ich für Naturschutz Bei uns lebende Frauen sind die schönsten Bestandteile unserer Natur Deren Wohl sind Die Grünen insbesondere wegen der Haltungen zur Geflüchtetenpolitik massiv abträglich Deshalb finde ich es klasse dass die Grünen an der 5  Hürde gescheitert sind,44,1,0.022727272727272728
Stimmt,1,0,0.0
Claudia Roth uiuiui nach jeder TalkShow 100000 Stimmen wenigerBitte weiterhin im Fernsehen auftreten und blubbern lassen das hilft Deutschland,19,5,0.2631578947368421
Nee die kann ich einfach nicht mehr sehen und das obwohl ich auch ganz schön Öko bin aber ich liebe unser Deutschland und da kann mann halt nicht die ganze Welt zum verbleiben einladen Ich habs satt aber anders rum Und Tschüss ihr Steuergeldverschwender,44,5,0.11363636363636363
Ich kann nicht mehr alleine joggen gehen,7,1,0.14285714285714285
Doris ich in manchen Gegenden auch nicht mehr,8,0,0.0
Herzlichen Glückwunsch zum großen Wahlerfolg im Saarland  Die Einwohner unseres Landes haben es satt sich ständig von ihrer Partei und ihrer wirren Ideologie bevormunden zu lassen Nach Mecklenburg Vorpommern und dem Saarland drücke ich Ihnen für den Hattrick des Rausfliegens aus den Parlamenten bei der Bundestagswahl alle Daumen,48,2,0.041666666666666664
Das ist die Quittung für eine Pseudopolitik auf allen Ebenen,10,1,0.1
Ein Sieg für die Demokratie die Grünen fliegen mit unter 5 aus dem Saarländischen Parlament ich hoffe es folgen noch viele Abflüge,22,1,0.045454545454545456
Hahaha Jetzt können sich die Grünen einschließen und weiter kiffen,10,2,0.2
Herrlich keine Antideutschen Grünen im saarländischen Parlament,7,1,0.14285714285714285
Hahahahaha,1,1,1.0
GRÜNE sind heute raus geflogen und hoffentlich auch im Herbst bei der Bundestagswahl ,13,0,0.0
Und genau wegen solchen Meldungen seid ihr raus Aber weiter so im Herbst gibt es auch nur 3  weil wir euch nicht mehr wählen Die Sicherheit Eurer Landsleute und das sind die Deutschen Steuerzahler  weil dieses Land Deutschland heißt und nicht Regenbogenland  hat Vorrang vor Befindlichkeiten irgendwelcher Terroristen und Fanatiker die in irgendwelchen fernen Ländern Strafen ohne Bewährung erwarten httpwwwfocusdepolitikdeutschlandmaschinestandschonaufrollfeldabschiebungvonterrorverdaechtigeminletzterminutegestopptid6830788html,60,1,0.016666666666666666
WINKE WINKE,2,0,0.0
Hahahahahahaha Gut so Der erste Schritt ist getan Weg mit der Verbotspartei,12,1,0.08333333333333333
AfD ist drin GRÜNE raus Schulz Zug entgleist FDP unterirdischAlso alles gut im Saarland,14,2,0.14285714285714285
Zum 2 Male hat das Volk eine antideutsche Kriegsund Pädophilenpartei aus dem Landtag geworfen Petra Kelly würde sich im Grabe umdrehen könnte sie sehen was aus ihrer Partei geworden ist,30,3,0.1
Gut gemacht liebe Saarländer Raus mit dem grünen Zeug Wir machen das dieses Jahr auch so Grüße aus Bayern,19,1,0.05263157894736842
Oooooohhhhh wieder einen Landtag verloren Woran lag es Der totalen Inkompetenz oder eher an den unmoralischen Vorstellungen dieser Partei Pädophilie Gender etc  Wer weiß Zumindest ist es die einzig gute Nachricht des Abends Weiter so,35,5,0.14285714285714285
Die Grünen verschwinden jeden Tag ein bisschen mehr und das finde ich einfach großartig,14,0,0.0
Auf jeden Fall ,3,0,0.0
Ohh wie ist das schön  ,5,1,0.2
Deutschlandhasser haben in keinem Bundesland etwas zu suchen Bewerbt Euch doch als Partei für die Wahlen in der Türkei Ich denke das würde passen,24,1,0.041666666666666664
Kannst behalten sowas wollen wir definitiv nicht ,7,1,0.14285714285714285
Glückwunsch ihr deutschlandhassenden Versager,4,1,0.25
Schick Modell für NRW,4,0,0.0
Da Gratuliere ich doch glatt mal lach ach Und Danke Frau Roth für ihre hervorragende Parteiarbeit Machen Sie weiter so Einzig ärgern wird mich dass Sie Ihre Bezüge auch noch in Ruhestand weiter bekommen und nicht für Ihren Blödsinn zur Rechenschaft gezogen werden Aber was solls Das Scheitern dieser Partei sollte es uns wert sein,55,2,0.03636363636363636
Hoffentlich kommt es bei der BTW im September zu denselben Ergebnis p,12,1,0.08333333333333333
Eine der besten Nachrichten des Tages  ihr seid schon mal weg,11,0,0.0
Überall und zu allem die Klappe aufreissen und es nicht mal in den Landtag des Saarlandes schaffen Applaus Applaus,19,1,0.05263157894736842
Glückwunsch zu diesem doch immer noch viel zu hohem Ergebnis ,10,0,0.0
Ein erfreuliches Ergebnis Beide FDP  die Original FDP und die GRÜNE Kopie draußen Kein Wunder wenn ein Flugmeilenbetrüger schöner Charakterzug aber selber immer moralisieren namens Özdemir und eine ExKlerikale KGE als Spitze garniert mit dem Star und MerkelFan Kretschmann das Führungspersonal bilden Wofür sollte man diese GRÜNEN die leider nix aber auch gar nix mehr mit dem Original zu tun haben noch wählen,63,8,0.12698412698412698
Grüne raus AFD rein Macht weiter mit eurer Flüchtlingspolitik  Sichere Herkunftsländer usw und ihr seid Geschichte Wacht endlich auf,19,2,0.10526315789473684
Ihr nur eine scheiss Partei mit scheiss Umfragewerten,8,2,0.25
Da wählten die Saarländer wohl das linksradikale Original,8,1,0.125
Ich bin traurigWer schuetzt jetzt die Sonnenblumen Wer verbietet Fleischwer verbietet Auto fahren Die Welt ist schlechtDa strengt man sich an und verschiedene Geschlechter erkennen nicht den Sinn dieser Verbote,30,4,0.13333333333333333
Suuuuuuuper der grüne Wahnsinn schwindet,5,1,0.2
Gut so ,2,0,0.0
Ab in die Biotonne ,4,0,0.0
Ich mache es kurz Endlich mal gute Nachrichten,8,0,0.0
Ein guter Tag für das Saarland So ein Ergebnis im Bund und mit Deutschland gehts wieder etwas vorwärts,18,1,0.05555555555555555
Und jeden Tag verschwinden immer mehr die Grünen aus Deutschland  Und ich finde das großartig  STICKER,16,0,0.0
Keine aktuellen Beiträge hier Warum wohl,6,0,0.0
Jetzt können einige von Euch erstmal arbeiten gehen Dann seht Ihr mal wie hart es ist etwas zu erwirtschaften und Wertschöpfung zu betreiben was so Träumer wie Ihr immer nur überall in der Welt verteilen wollt  ,36,0,0.0
Glückwunsch an die saarländischen Grünen Ein toller Erfolg jetzt muss Euer türkischer Schwabe bei der Bundestagswahl die 49 Prozent holen dann könnt Ihr alle harzen Danke,26,2,0.07692307692307693
Die Grünen verschwinden bei jeder Wahl ein Stück mehr und ich finde es großartig ,14,0,0.0
Alle die nicht die Grünen gewählt haben sind jetzt bestimmt alles Nazis  Es waren ja auch Alle die bei der letzten EM eine Deutschlandfahne geweht hatten bekanntermaßen Nationalisten  O  Ton grüne Jugend RP  Ist ja eine typische grüne Logik unter deren Anhängern,42,1,0.023809523809523808
Ich habe bei der letzten Landtagswahl in MV nicht Grün gewählt Gott bewahre Bin ich jetzt auch ein Nazi  D,20,1,0.05
Wer in Deutschland den Autofahrer angreift hat schon verloren Sowas brauchen wir hier nicht Gut so Die große Quittung kommt zur BTW,22,2,0.09090909090909091
Glückwunsch Grüne  ein erster guter Schritt in die richtige RichtungIn Parlamenten braucht euch kein Mensch,15,1,0.06666666666666667
und Tschüss,2,0,0.0
Bye bye,2,2,1.0
Glückwunsch zum Abstieg verbunden mit der Hoffnung auf ein noch schlechteres Ergebnis zur Bundestagswahl ,14,0,0.0
Umweltschutz ja Deutschfeindlichkeit nein  liebe Grüne Sagt Euch ein Gründungsmitglied,10,0,0.0
Vollkommene Zustimmung So wichtig wie Umweltschutz auch ist ohne eine gut florierende Wirtschaft starke und innovative Unternehmen gibt es keine Arbeitsplätze und keine Zukunft für unsere Kinder Hier haben die Grünen überhaupt nichts zu bieten Die grenzwertigen bis dümmlichen Aussagen und Ideen der grünen Jugend und der erwachsenen Führungskräfte tragen ein Übriges zum Untergang der Grünen bei Es ist traurig aber leider wahr ausser vollkommen idiotischen Ideen ist in den letzten Jahren rein gar nichts mit Substanz mehr von den Grünen gekommen,82,2,0.024390243902439025
Wer Mitteleuropa Maghrebisieren Islamisieren und Negroisieren möchte sollte sich wahrlich überlegen welches Kulturverständnis hier vorherrscht Als Gründungsgrüner bin ich entsetzt welche mentale Schlepperideologie sich bei den Grünen verbreitet hat Umweltschutz sollte konservativ bewahren aber nicht kulturell kontaminieren Die erste Quittung gab es im Saarland,44,4,0.09090909090909091
Ähm die zweite Die erste gabs in MV,8,3,0.375
Bravo Cem Super Cem Das hat man davon wenn man nur Erdogan Türkei Erdogan Türkei Erdogan sagt und Politik für die PKK macht Nur noch 4,26,6,0.23076923076923078
41   da geht noch was  nach unten,7,0,0.0
und tschüss in saarland kehrt wieder kultur ein ,8,2,0.25
Das habt ihr nun von eurer Blockade bei den MagrebStaaten,10,1,0.1
pechversuchts doch mal in der türkei,6,2,0.3333333333333333
Super Klatsche Nr 2 So kann es weitergehen,8,1,0.125
weiter so Y STICKER,4,0,0.0
Mit Tschem wird es nichts  Die Türken werden NIE wieder euch wählen KarmaBitch,13,2,0.15384615384615385
Und Tschüß selbst 41 sind noch zu viel aber naja Hauptsache ihr seit draussen ,14,3,0.21428571428571427
super gemacht Ihr Grünen  hoffentlich schafft Ihr das auch bei der Bundestagswahl  ein guter Tag für das Saarland ,18,0,0.0
Da gibt es nur einsDoppelpass für alle,7,1,0.14285714285714285
und weg sind siewas für ein Glückwenn auch ein kleinesich hätte mir einen andren Wahlausgang gewünscht,16,3,0.1875
Ein schöner und guter Tag,5,0,0.0
Jetzt sind die Saarländer bestimmt alles Nazis oder ihr Grünen,10,1,0.1
Das Wahlergebnis ist traurig Besonders weil die Wahlbeteiligung ja doch ziemlich hoch war Das ist das einzige Erfeuliche dabei Aber jetzt nicht auf die ganze Häme hören sondern mit voller Kraft weiter machen Und auf die grünen Kernkompetenzen fokussieren Umweltschutz einschließlich Tierschutz und soziales Außenpolitik und insbesondere die Situation in der Türkei soll nicht aus der Sicht verschwinden aber vielleicht doch ein wenig hinter den eigentlichen grünen Themen zurücktreten Also jetzt mit voller Kraft weiter Nach der Wahl ist vor der Wahl,82,2,0.024390243902439025
Wenn dieKernkompetenzen der Grünen so gut sind warum haben sie im Saarland die 5 verfehlt,15,1,0.06666666666666667
Das Problem der grünen sind nicht die Kern Themen sondern deren Umsetzungman braucht zuerst vertretbare alternativen und brauchbare Optionen bevor altes abgeschafft bzw verboten wirddie grünen sind aber immer schnell im abschaffen ohne einen Plan zu haben wie es sonst gehen soll Stuttgart ist da das perfekte Beispiel,48,3,0.0625
lasst diesen Genderwahn und die unsinnige Flüchtlingspolitik und dann klappt es wieder um über die 5 zu kommen,18,1,0.05555555555555555
Wer keine Politik macht für die die hier schon länger leben der kann nicht erwarten gewählt zu werden Die Menschen wollen keine neue Abart des gescheiterten Kommunismus mehr besonders die im Osten Deutschlands,33,0,0.0
Grüne Politik ist gottseidank nicht auf Quartalsergebnisse ausgerichtet sondern langfristig Das zeigt sich am Kohleausstieg und Ausstieg aus dem Verbrennungsmotor und der Agrarwende mit Ziel 2030 Jetzt kommt es drauf an zu den eigenen Überzeugungen zu stehen auch wenn es mal die eine oder andere Wahl kostet Auf lange Sicht wird sich die Vernunft durchsetzen,55,2,0.03636363636363636
Etwas anders ist es mit der Hilfe für die Herkunftsländer der Flüchtlinge Dort muss SOFORT etwas geschehen dass diese Menschen in ihren Heimatländern überleben können Mauern an unseren Grenzen können das Problem nicht lösen Wir müssen aufhören die auszubeuten und aufhören deren Kriege anzuheizen,44,1,0.022727272727272728
Völlig Weltfremd an der Realität vorbeiihr bekommt das was ihr verdientsiehe Saarland,12,2,0.16666666666666666
Manfred Cuntz Die Themen und Ansätze der Grünen find ich gar nicht mal so schlecht Jetzt bkommt aber das Aber Welche Steuern haben die Grünen in den vergangenen Jahren gefordert um Deutschland und die Welt grüner und gerechter zu machen Eine Liste Bettensteuer Fettsteuer Finanztransaktionssteuer Fleischssteuer Flugticketsteuer Integrationssteuer Kultursteuer Notsteuer Berlin Pilssteuer Plastiktütensteuer Reichensteuer Seltersteuer Sozialsteuer für Selbständige Strafsteuer für Konfessionslose Stromkonzerngewinnsteuer Vermögenssteuer Zuckersteuer Abgabe auf Baurohstoffe CO2Abgabe Einwegverpackungsabgabe Flugverkehrsabgabe Förderabgabe für Kohle Gas und Öl GoogleStreetviewAbgabe Handykaufabgabe Internetabgabe Shoppingcenterabgabe Stickoxidabgabe Tourismusabgabe Wasserabgabe In der Tat hat uns das grüne Brimborium bisher nur gekostet und nichts gebracht Nennen Sie eine grüne Maßnahme ein grünes Gesetz eine grüne Forderung die den Bürgern auch nur einen einzigen Cent mehr im Geldbeutel gelassen hat Immer nur abkassieren das ist die Devise Ich schreibe es bereits mehrmals es ist eine Frechheit wie die GRÜNEN hier eine Naturkatastrophe wie Fukushima nutzen um Politik mit der Angst in ihrem Sinne zu betreiben Tausende von Toten durch den Tsunami steht kein Todesfall aufgrund der Havarie gegenüber Alles andere ist orakeln auf hohem Niveau wobei die Wahrheit natürlich auschließlich auf Seiten der Gegner verortet ist und alle anderen Meinungen im mildesten Fall Unfug oder unterstell wird es wären zahlen der Atomlobby Was zum Teufel sind den die Geenpeacezahlen  Aber mit Angst lässt sich ja prima Geschäfte machen und wer die Augen öffnet sieht wie die Grünen Geschäfte laufen Da wird die Zustimmung zu Windparks mit Spenden an befreundete Vereinigungen erkauft da ist die Energiewende wichtiger als Naturschutz da wird der ganze Unfug der grünen Energiewende deutlich wenn man sich mal Beitrag zu in Ruhe durchliest Die Grünen und Erben des Liberalismus Brüller Keine andere Partei ist derart ideologisch verbohrt dass sie das Wort Fußgängerzone für frauenfeindlich und militaristisch hält sich als Menschenrechtler aufspielt aber dem iranischen Außenminister mit High Five begrüßt und für ihre Umweltpolitik über jeden Preishammer kaltlächelnd hinweggeht Müssen ja nur die dummen Bürger zahlen Wenn es um die Moral geht sind die Grünen immer ganz vorne mit dabei sie fordern Gerechtigkeit Transparenz Bürgerbeteiligung und Ehrlichkeit Wer es wagt sich gegen grüne Forderungen zu stellen erlebt einen Sturm der Entrüstung Bei sich selbst sehen die Grünen das mit der Moral nicht ganz so eng Der ehemalige grüne Außenminister ist ein Polizistenschläger Ein grüner OB zitiert in der Öffentlichkeit Mao Daniel Cohn Bendit findet kleine Kinder ganz toll und wenn es eilig ist nehmen grüne Mandatsträger statt dem Fahrrad auch gerne mal den Helikopter,407,37,0.09090909090909091
Ein gutes Ergebnis für Deutschland wieder einmal haben die Grünen die Quittung für ihre dumme und falsche Politik bekommen Obwohl Millionen Deutsche jedes Jahr in Tunesien und Marokko urlauben verhindert ihr die Abschiebung von kriminellen Scheinasylanten in diese Staaten wobei doch in allen moslemischen Ländern die Menschenrechte mit Füßen getreten werden Das ist halt im Islam so,57,1,0.017543859649122806
Die Grünen verschwinden täglich ein bischen mehr und das finde ich grossartig So kommt Kinder auf den schrecken erstmal ne Soja Latte und fettige Haare waschen,26,4,0.15384615384615385
Ach so noch etwas Ist sicher heftig schmerzhaft dass die AFD im Landtag sitzt und ihr die ja immer ALLES richtig machen ALLES für das kleine Volk tun IMMER die besten Ideen und Lösungen vorstellen niemals Andersdenkende verleumden andere Meinungen akzeptieren NICHT Wie kann der böse Saarländer Wähler nur nicht solch eine tolle Partei wählen Wie kann der böse Saarländer Wähler nur böse Nazis wählen An euch selbst liegt es sicher nicht oder Ach ne bei euch sind ja immer die Anderen schuld  Ich gebe euch einen kleinen Tipp Schaut mal in den Spiegel und danach einige Aussagen eurer  Frontfrauen an,101,5,0.04950495049504951
Macht mal schön eure Schreibtische leer damit die Leute von der AFD mit ihrer Arbeit beginnen können,17,1,0.058823529411764705
Wie geil ist das denn Özdemir meinte das der Grund das euer Versager Verein nicht drin wäre der ist das die Wahlbeteiligung höher als sonst ist Wie nennt man so was alternative Fakten,33,1,0.030303030303030304
Die Stimme gibt es doch Die AFD ,7,1,0.14285714285714285
Super ErgebnisWeiter so  dann habt Ihr endlich Zeit  Eure Schulabschlüsse und abgebrochenen Studienabachlüsse nachzuholen  könnt Euch um Eure Hanfplantagen kümmern mit Kindern f Und in Ruhe stricken,27,2,0.07407407407407407
Früher respektiert und gewählt aber wie sagt man so schön jeder Mensch hat 2 gesichter  deine Doppelmoral und Hetze sorgen dafür das deine Partei untergeht und dich kein Mensch mehr ernst nimm du Hafensänger ,34,1,0.029411764705882353
Na hat wohl nicht geklappt schön ,6,1,0.16666666666666666
 so glücklich war ich schon lange nicht mehr grüne adde,10,1,0.1
Bye bye Ich werde Euch vermissen NICHT,7,2,0.2857142857142857
Satz mit X war wohl nix,6,1,0.16666666666666666
 ,0,0,
Haben wir gemacht  aber nicht grün gewählt ,7,0,0.0
Es gibt noch genügend Bäume ,5,0,0.0
Die ganze Führungsriege ab nach Nordafrika da könnt ihr euch alle mal so richtig in die Arme schließen Wer sein eigenes Land so verrät und Steuergelder an Fremde sinnlos verballern will der soll dahin gehen wo der Pfeffer wächst Germany first,41,3,0.07317073170731707
tja mit göring E werden sie auch aus denn anderen regierungen verschwinden das ist ja ein albtraum,17,4,0.23529411764705882
Deutschland wird sich verändern und wir freuen uns darauf  41  ist erst der Anfang Tschüssikowski,15,1,0.06666666666666667
Die GRÜNEN verschwinden jeden Tag immer mehr und das finde ich einfach großartig Ja JTrittin alles bekommt man zurück,19,1,0.05263157894736842
Ja grünPech gehabt wie,4,1,0.25
Die Partei die Prostitution auf Rezept fordert Vielleicht wär das ja was für die Saarländer ExAbgeordneten Besser als arbeitslos oder nicht,21,3,0.14285714285714285
Einer der schönsten Sonntage seit langem wie herrlich wenn das schon die Ergebnisse für die Bundestagswahlen wären ,17,1,0.058823529411764705
Es stimmt auffallend was da auf dem grünen Pamphlet steht die Wahlen im Saarland haben das gezeigt Die Stimme die für Umwelt Bildung und Bürgerrechte kämpft ist jetzt im Landtag und es ist wirklich nicht egal ob die Grünen im Landtag sind der Wähler hat dementsperchend entschieden,47,1,0.02127659574468085
dann lasst die Wähler doch mal die Ergebnisse eures Kampfes sehen für mich stehen die Grünen für höhere Steuern und sinnlose abgaben und nicht für Umweltschutz,26,0,0.0
Saarland Keine Kohle Keine Ahnung,5,0,0.0
Respekt und alle Achtung den Saarländern  46  die Quittung für ne unfähige Partei  Weint mit Schulz dem Goldstück ,18,2,0.1111111111111111
So ein Tag so wunderschön wie heute so ein Tag der dürfte nie vergehen,14,0,0.0
Wird so weitergehen,3,0,0.0
Auch die Grünen haben ihren Anteil an solchen Aktionen httpwwwrponlinedenrwstaedteduesseldorfschadowarkadeninduesseldorfvierverletztebeipruegeleiaid16713879,10,1,0.1
Und Erdogan hat Schuld das Merkel noch Kanzlerin ist,9,1,0.1111111111111111
Ich war schnell noch im Wahllokal und habe AfD gewählt ist das OK ,13,2,0.15384615384615385
Ha ha ha Lachkrampf,4,3,0.75
Eine höhere Wahlbeteiligung hat grün nicht geholfen und der SPD auch nicht,12,0,0.0
Danke Saarland ihr seid Vorbild für Deutschland Die Grünen Deutschhasser brauchen wir nicht,13,1,0.07692307692307693
Herrlich So muss es jetzt überall in Deutschland laufen Weg mit den Grünen,13,0,0.0
Kein Wort in Richtung Artensterben Kein Tierschutz Kein Naturschutz Warum steht davon nichts geschrieben,14,0,0.0
Wollte der Ötzdemeier nicht noch eine Kundgebung auf Taksim machen  Und total heisse Geheimtipps für die dortigen Wahlen geben oder so n Zeug ,23,3,0.13043478260869565
Tja wenn man sich nicht für die Politik in Deutschland einsetzt und nur gegen die Türkei hetzt dann passiert das was jetzt passiert,23,1,0.043478260869565216
Und tschüss Hoffentlich auch auf Bundesebene,6,0,0.0
Voll in die Hose wie schön,6,0,0.0
Ohne grünen wirds nicht grau sondern die sonne hat heute den ganzen tag gestrahlt ,14,2,0.14285714285714285
Olleeolleeeee,1,1,1.0
Özdemir verkauft bald wieder Döner ,5,1,0.2
Ist das klasse die Grünen sind raus ,7,0,0.0
Schöner Tag heute,3,0,0.0
Rot rot grün oder dumm dümmer am dümmsten,8,0,0.0
Die Saarländer haben Farbe gezeigt 96 der Saarländer haben Grün die rote Karte gezeigt ,14,2,0.14285714285714285
Ihr grünen dann schafft kernkraftwerke ababgase auf der strasse,9,3,0.3333333333333333
Sehr schön euer Ende ist eingeleitet GRANDIOSER SIEG DER CDU,10,0,0.0
Herzlichen Glückwunsch Endlich seit ihr weg Das gleiche wird bei der Bundestagswahl passieren,13,0,0.0
Ja genau weil die grünen eben für Bildung Bürgerrechte und klimaschutz stehen nicht für Indoktrination Autokratie und Umweltzerstörungebendoch,18,3,0.16666666666666666
ne danke hoffe man wird euch auch mal in nrw los noch scheisse am verzapfen ach so tolle schilder gegen rechts aufstellen die schön teuer waren als ob meine gemeinde nicht schon als die mit den meisten schulden gilt und ihr werft geld zum fenster raus daher solltet ihr auch raus aus allem hab letztens noch gesagt als der cem meinte wir sollten uns nicht nur um die täter des terrors interessieren sondern auch für die opfer das es gut wäreund was kommt danach ein lächerlicher versuch jugendliche für euch zu begeistern indem ihr ihnen was vom cannabis erzählt ,99,12,0.12121212121212122
Und ihr seid der Garant für Bürgerrechte  Haben wir denn schon den 1April ,13,1,0.07692307692307693
Der Götdemir fährt die Partei an die Wand und wir Türken lachen uns gemütlich einen ab Danke Cem du Otto,20,2,0.1
Hoffentlich lernt ihr draus Schwarz gelb und grün passen nicht Mich freut es trotzdem nicht,15,1,0.06666666666666667
Was für ein Ergebnis sehr erfreulich die Wähler erkennen wohl was die GRÜNEN bedeuten würden ,15,0,0.0
Bitte den gleichen Wahlkampf im Herbst führen Am besten die dame ohne Bildung an die front Glaube Frau Roth ist ihr Name Dann klappt es vielleicht auch dort mit so einem fantastischen Wahlergebniswie im Saarland,35,4,0.11428571428571428
Gratulation super Ergebnis Die grünen schaffen sich selber ab Gut so,11,0,0.0
Mittlerweile geht mir das Geschwaffel ein auf den Geist einige Leute beschweren sich über die Partei einige über die Partei was soll man den noch wählen man kann hier überhaupt nicht mehr vernünftig reden allgemein in diesen Partei Seiten es gibt nur noch Hass geschreibe einige Leute denken den Ernst der Lage nicht das nervt mich total ich wünschte mir man würde normal mit den Menschen umgehen aber so bin ja SPD wähler und Grüne Wähler aber so macht es kein Spaß hier zu schreiben,85,3,0.03529411764705882
