ommentmessage,1,1,1.0
Und weil sie alle kennen können Sie dafür ihre Hand ins Feuer legen Sicher haben sie mit crystal Beck gesprochen der hat es ihnen versichert Wie sie hier versuchen zu relativieren ist beachtlich Hoffentlich lesen das viele ihrer fb Freunde,40,3,0.075
Das macht keinen wirklichen Sinn was du da schreibst,9,0,0.0
natürlich muss jeder volljähriger Bürger heiraten dürfen,7,0,0.0
Und was ist mit den volljährigen Bürgerinnen ,7,0,0.0
auch die Bürgerinnen,3,0,0.0
Ehe zwischen Mann und Frau enthält das Potenzial zur Generationenfolge die substanziell für eine Gesellschaft ist Deshalb kann gleichgeschlechtlichen Partnerschaften nicht der Rang einer Ehe zugebilligt werden Mit der Inflationierung des Ehebegriffs der letztendlich sogar noch für Dreierbeziehungen gelten soll gelangt man eventuell sogar zu Ehen zwischen Vater und Tochter usw Die Inklusion dieser Modelle wollen allerdings auch nicht einmal die Unterstützer der gleichgeschlechtlichen Partnerschaften Warum eigentlich,67,3,0.04477611940298507
Sie vermischen mal wieder alles wie es so gerne in dieser Diskussion gemacht wird Zeigen Sie mir bitte das Gesetz in dem steht dass aus einer Ehe Kinder hervorgehen müssen Dann schauen Sie sich mal in der Gesellschaft um und zählen die Scheidungskinder die Alleinerziehenden die unehlichen Kinder die kinderlosen Ehen die Patchworkfamilien etc Und dann wiederholen Sie doch nochmal bitte Ihre Argumentation Schon auch dass Sie das Inzestthema einbringen  die Verkopplung des Themen Ehe für nicht gleichgeschlechtliche Paare und Inzest wird sich mir wohl nie erschließen aber wenn man keine wirklichen Argumente hat ist es ja immer gut dass einfach mal aufs Parkett zu bringen,106,6,0.05660377358490566
Deswegen heirate ich auchD,4,1,0.25
Ihr könnt linke nicht von rechten unterscheiden ihr könnt gute nicht von den bösen unterscheiden ihr werdet auch nicht freiwillige Kinderehen und Unfreiwillige Kinderehen unterscheiden können ab wann ist es gesetzlich erlaubt und wann ist es pädophil Wenn es einen Gott gebe wäre er bestimmt verwundert über Schwule und Lesben und dann noch als Ehe Hat schon seinen Grund warum wir uns abschaffen Aber hey ich denke das werden eure lieben neuen Mitbürger in ein paar Jahren schon selber mit euch klären und glaubt mir die diskutieren nicht so lange mit euch Sollte erstmal die Ahmadiyya Sekte erfolgreich hier Fuß fassen sieht es noch schlechter aus Die verbreiten nämlich das Verzehr von Schweinefleisch Homosexuell macht Ihr werdet alle noch soviel Spaß haben ,122,3,0.02459016393442623
Gibt es in Deutschland keine wirklichen Probleme ZB Radikale Islamisten httpwwwtonlinedenachrichtendeutschlandinnenpolitikid80782966verfassungsschutzzaehltmehrals10000radikaleislamistenhtml,11,2,0.18181818181818182
Dazu habe ich noch etwas gefundenhttpwwwstuttgarterzeitungdeinhaltkolumnevongoetzalydasverschwindendergruenenpartei19741a8e08904d3e900befcc3ed111fchtml,6,1,0.16666666666666666
Würde ich gerne teilen da ich es nicht gutheißen kann jemand anderen wegen seiner Sexualität zu diskriminieren Aber nicht wenn die Partei dahinter auf die Sexualität von anderen ohne eigene Stimme ein Scheiss gibt,34,1,0.029411764705882353
Es ist der feministische Plan die Ehe zu entwerten Die Ehe gilt unter Feministen als patriarchales Unerdrückungsinstrument Die Verpartnerung Homosexueller reicht nicht weil das patriarchale Unterdrückungsinstrument entwertet werden soll Es geht rein um die feministische Zerstörung der Ehe und damit um die Zerstörung der Familie Warum werden wohl Alleinerziehende so hochgejubelt Damit Ehen und Väter in den Familien überflüssig werden Es ist alles feministischer Wahn So die ersten die meine Worte nicht verstehen dürfen nun schießen,76,7,0.09210526315789473
Oh der letzte Satz ist ja äußerst brilliant Jeder der jetzt also gegen sie argumentiert hat Sie automatisch nicht verstanden Ich habe Sie sehr gut verstanden Ich bin übrigens allein erziehend außerdem Feministin und ich habe nicht das geringste Interesse an der Entwertung der Ehe Ich sehe sie auch nicht als patriarchales Unterdrückungsinstrument an  das war sie mal aber die Zeiten sind ja nun zum Glück vorbei Wenn gleichgeschlechtliche Paare heiraten findet zudem keine Abwertung der Ehe statt  meiner Meinung nach wird sie dadurch sogar aufgewertet Und wo bitte werden Alleinerziehende hochgejubelt Die meisten Menschen die allein erziehend sind sind das nicht geplant und erst recht nicht aufgrund einer feministischen Verschwörung die es auch gar nicht gibt Abgesehen von einigen Radikalfeministinnen sind Feministinnen es gibt auch männliche Feministen auch keine Männerhasser wohl aber GleichstellungsLiebhaberinnen,134,8,0.05970149253731343
QED,1,1,1.0
Männliche Feministen werden von weiblichen Feministen höchstens als Allies geduldet Alleinerziehende Mütter werden hochgejubelt Das Frauenministerium tut dies z B in Werbekampagnen die Presse feiert sie als Helden des Alltags etc Ich bin auch alleinerziehend habe allerdings das falsche Geschlecht für diese Jubelarien Ich darf mir immer nur die Klugscheißerei von alleinerziehenden Müttern anhören Männer sind ja sogar zu doof ihr Kind ordentlich zu ernähren  Oder die Zeiten in denen ich auf dem Spielplatz böse angegiftet wurde wenn mein Sohn nicht in meiner Nähe war Das ist bestimmt so ein Pädophiler Wir entfernen uns vom eigentlichen Thema Mal schlicht und verständlich Etwas das jeder haben kann will niemand mehr Die Ehe für alle ist doch nur ein Schritt von vielen Leihmütterschaft etc macht die gewöhnliche Heterobeziehung und Ehe bald überflüssig Als Literatur empfehle ich übrigens Shulamith Firestone Die hat sich schon in den 70ern zu vielen Themen eindeutig geäußert Dat Laurie Penny kocht gerade vieles auf,156,18,0.11538461538461539
Warum wurde das nicht längst eingeführt als es eine rotgrüne Bundesregierung gab,12,1,0.08333333333333333
Wir Menschen haben auf dieser Welt nur einen Auftrag Reproduktion Alles Andere wie mein Haus mein Auto meine Kreditkarte ist nur schmückendes Beiwerk Reproduktion findet nur zwischen Mann und Frau statt alle anderen Formen der sexuellen Ausrichtung ist wider die Natur Warum also sollten homosexuelle Menschen heiraten dürfen,48,0,0.0
Was hat Ehe denn heutzutage noch mit Reproduktion zu tun Und wenn es diesen großen Auftrag wirklich so gäbe dann wäre es doch ein Gewinn wenn jeder Mensch durch künstliche Befruchtung in die Lage versetzt würde Nachwuchs großzuziehen Zudem gibt es andere sexuelle Ausrichtungen als die heterosexuelle sie kann also nicht wieder die Natur sein da sie ja in der Natur existiert Wenn man Ihre Gedanken stringent zu Ende führen würde müsste sich jeder derdie heiraten möchte zuvor einem Fruchtbarkeitstest unterziehen Bei Nichtbestehen erfolgt das Verbot der Eheschließung,88,4,0.045454545454545456
Aber hallo war selbst mit einer Frau 13 Jahre verheiratet leider bin 3 Jahre schon Witwe ist nicht schön,19,0,0.0
Eine Minderheitaber man sollte es natürlich erlaubenOHNE DAS GANZE FALSCHE GEZETER,11,2,0.18181818181818182
Ehe für alle auch mit Kindern und mehreren Frauen Bitte sagt dies noch dazu,14,0,0.0
Das sind Luxus und Befindlichkeitsprobleme Die Welt hat wichtigere Probleme zu lösen ,12,1,0.08333333333333333
Die Ehe ist gedacht als Schutzhort für Kinder Eure pädophilen kranken Vorschläge sollten euch gemeinsam in den Knast bringen Ihr versündigt euch an den Schwächsten der Gesellschaft,27,1,0.037037037037037035
Ich denke  das gibt es schon lange ,7,0,0.0
Ich finde wir kaemen schneller weiter wenn diese uralte überholte Ehe zwischen Mann und Frau abgeschafft wuerde Das wäre ein guter erster Schritt,23,2,0.08695652173913043
Sorry dann setze ich lieber noch auf Afd Bei dem Thema habe ich doch eine zu konservative Ader,18,2,0.1111111111111111
das ist doch kein wichtiges Thema was die Grünen hier machen bei so vielen Kriegen Auseinandersetzungen Kämpfe Mobbing Monster ISIS Verbrecher Gauner Mörder tut endlich etwas sucht ein vernünftiges Konzept und macht nicht immer alles nach Keine Ehe ist wichtig denn das ist alles nur Geldgier das man dann weniger Steuern bezahlen Aber den Single vergisst man die dürfen alles ausbahnen bekommen kein höheres Gehalt kein Kindergeld keine Familientarife Rabatte müssen mehr Steuern bezahlen usw,75,3,0.04
Die Welt ist ein Irrenhaus,5,0,0.0
Irgendwie verschwindet teilweise der Ton Kann man da was machen,10,0,0.0
erstmal nen Eisbein essenmjam,4,2,0.5
Morten Godow und zwar ein richtig fettes Dass die Veganer quietschen,11,3,0.2727272727272727
dann war an der stelle wo der ton verschwindet wohl nichts interessantes zu hören ,14,1,0.07142857142857142
Das ist weil er stottert,5,0,0.0
 ,0,0,
Youri Janzen folgst du auch dem Cemtrail ,7,3,0.42857142857142855
Hahahaha eher weniger aber die Grünen sind ja sowieso Geschichte,10,1,0.1
hahaha wir kenne unsere Sozialdemokraten die machen nur Quatsch er soll doch aufhören Türken Angelegenheiten auf deutschen Boden zu diskutieren Grüne und Menschenrechte  da wird ein richtig übel Wenn eine Parte gegen das Völkerrecht ist fällt mir als allererstes die Grünen ein frage an Hr Özdemir haben wir ein Un Mandat in Syrien Antwort natürlich nicht,56,5,0.08928571428571429
das wirkt etwas wirr,4,0,0.0
Frau Merkel meinte letzte Woche DieselFahrzeuge sind umweltfreundlich Regt sich darüber sonst niemand auf hier,15,1,0.06666666666666667
Liebe Grüne heute bei Maischberger wurde wieder eines deutlich ihr seid meiner Meinung tatsächlich nicht wählbar Bei euch wäre Regieungsverantwortung in den falschen Händen Sorry MfG,26,4,0.15384615384615385
Das sind aber wenige Kommentare Scheint nicht so interessant zu sein,11,0,0.0
Wie waren die letzten Wahlen ,5,0,0.0
Haa das nenne ich doch mal Erfolg  Abseits jeder Parteipolitik habe ich mich für Grün eingesetz  httpswwwchangeorgpbietensiefairenkaffeeinderdeutschenbahnandbfairtrade,17,3,0.17647058823529413
guckt mal ihr grünen wollt ihr das httpswwwweltdepolitikauslandarticle163268722Regierungrechnet2017mitbiszu400000FluechtlingenausAfrikahtml was sollen wir mit den ganzen männern hier ich als frau suche mir meinen partner immer noch selber aus ja sorry aber einen anderen eindruck kann man ja nciht mehr gewinnen als dass wir mutmaßlich diese männer brauchen um uns fortzupflanzen tut was dagegen als alle willkommen zu heißen die in not sind und wo sind die kinder und frauen aus afrika,70,12,0.17142857142857143
Sapa ich habe auch etwas gepostet mal sehen ob sie das löschen ich kopiere es mal hier rein Ich bin weder Rechts noch Links Wieso hat es früher funktioniert als es in dieser Form Europa noch nicht gab Die Grenzen dicht waren Keine Migranten im Land Es kamen nicht soviele Verbrecher über die Grenze es verschwanden nicht so viele junge Kinder die für abartige Menschen ihren Körper bereitstellen müssen An Kinder vergreifen sich sogar Richter Staatsanwälte und Politiker wie ein Kripobeamte AD ausgesagt hat im Fernesehen Es gab durch Flüchtlinge und Migranten keine Massenhafte Vergewaltigungen und Schlägereien wir brauchten auch nicht massehaft Polizei die übrigens kaun noch damit fertig wird In unserem Land kein Deutscher 4 Frauen haben darf sowie hier Syrer mit vier Frauen und 23 Kindern erhält monatlich ca 30030  Unsereiner hat 43 Jahre Teizeit gearbeitet und bekommt dafür 700 Rente Was sollen wir von unseren Politikern halten Keine Ehre habt ihr mehr ein Erdogan darf uns alles nennen und ihr kriecht ihm in den Allerwertesten,168,10,0.05952380952380952
Jetzt noch im September 49 für die Grünen und alles ist gut ,12,0,0.0
Wer jetzt zu einem neuen ÖkoStromanbieter wechselt der kann bis zu 50 pro Jahr an Energiekosten einsparen Online wwwdeutschlandstromorg,19,2,0.10526315789473684
Echt Wenn ich mit meinem Tarif bei meinem Heimatversorger vergleiche komme ich auf 1482 Ersparnis pro Jahr  im ersten Jahr danach ist es teuerer Und der Ökostrom ich noch teuerer,30,2,0.06666666666666667
Ach ihr tollen Grünen es war ja mal wieder ganz grosses Kino gestern Abend eure Beck bei Maischberger zuzuhören Soviel Arroganz und Besserwisserei hab ich schon lange nicht mehr gehört Ich war eigentlich immer der Meinung das die Peter die Roth oder die Künast die sind die euch in die Scheisse reiten aber nach dem gestrigen auftritt der Beck hat es doch den anschein das sobald ein Mikrofon in der nähe ist beim Personal der Grünen ein aussetzen des Gehirns erfolgt mit solch einem Personal ist kein Blumentopf zu gewinnen Es kam sogar die Storch der AFD wesentlich Sympatischer rüber als eure Beck mit ihrem Oberlehrer gehabe das sagt schon einiges aus,112,14,0.125
Ich schaue es mir heute Abend an mit dem richtigen Auftreten hatte Frau Beck schon in der Phoenixrunde so ihre Probleme,21,2,0.09523809523809523
Mit der Beck kommt ihr auf 8 Prozent,8,1,0.125
Habe es gesehen Frau Beck weiss nichts aber auch gar nichts von Afrika ihr Auftritt ging gerade noch so,19,2,0.10526315789473684
Ich wähle trotz Merkel CDU Ich hoffe die Partei bekommt sie noch auf den richtigen Weg Rot Rot Grün muß verhindert werden Leider ist jede Stimme an die AfD eine verlorene Stimme bzw eine für RRG da sie die CDU schwächt Wer meint die SPD ist sozial sollte an die Agenda 2010 denken und daran daß sie die ganze Zeit mit an der Regierung beteiligt war Warum hat sie da nicht interveniert Mit Links und Grün sind wir bald überschwemmt mit Flüchtlingen bzw Wirtschaftsasylanten Konserativ ja rechts und links nein ,90,7,0.07777777777777778
Der transatlantische Irrweg  httpswwwcontramagazincom201703dertransatlantischeirrwegcomment258190  Mit aller Verzweiflung halten sich viele europäische Politiker am transatlantischen Band fest Doch Nordamerika und Europa spielen global gesehen eine immer geringer werdende Rolle  Von Marco Maier  Gerade Europa im Allgemeinen und Deutschland im Speziellen müssten damit beginnen die Transatlantiker sukzessive abzuservieren und stattdessen die Transkontinentalen zu stärken Was nützen uns diese marode zum Untergang verurteilten USA wenn wir stattdessen mit Ländern wie Russland China Indien Indonesien Thailand usw zusammenarbeiten können welche in der Tat Zukunftsmärkte sindWEITERLESEN  Kommentar  Es liegt ganz besonders an dieser Kanzlerin die seit Jahren mit voller Begeisterung in den Hintern der USA kriecht auch wenn dort noch so viel Dreck herauskommt  Nicht umsonst hat man auch bemerkt dass Soros bei Merkel ein und aus gehter also zu den engen Freunden und Beratern der Kanzlerin zählt  Und jeder Informierte weiß dass Soros und Rothschild zu den größten Finanziers von Kriegen und Waffen sind und dass diese Banditen hinter allen Kriegen von Vietnam bis Syrien sowie der Ukraine und der Konfrontation gegen Russland stecken  Die ganze Politik der USA der EU und Deutschlands werden von diesen Obergangstern gelenktsprich fast alle Politiker in diesem Raum sind gekaufte Vasallen dieser Banditen  Fazit Das ganze westliche System ist ein einziger korrupter Haufen der mit Stumpf und Stiel ausgerottet werden müsste  Eckart kommentiert  In Berlin beginnen die ersten Erkenntnisse schon Gestalt anzunehmen One Road one Belt ist dort auch schon auf dem Radar sichtbar geworden  Gabriel kündigt eine strategische Neuausrichtung der deutschen Asienpolitik an Das globale wirtschaftliche Gravitationszentrum verlagere sich immer stärker nach Asien erklärt Gabriel Berlin müsse dem Rechnung tragen Der erste Schritt wird mit dem Aufbau einer eigenen Asienabteilung gemacht  Es scheint dass der Dicke gelegentlich auch ahnt wo der Sand am Strand liegt und außerdem hat er ja gerade mit Putin persönlich gesprochen Ein Schelm der Böses dabei denkt,304,17,0.05592105263157895
Hallo Grüne mal eine Frage Was wollt ihr dagegen machen Regierung rechnet 2017 mit bis zu 400000 Flüchtlingen aus Afrika wielange soll das noch so weitergehen Wieder nur junge Afrikaner die hier ihr Unwesen treiben,35,1,0.02857142857142857
Da haben die Grünen wieder eine neue Zielgruppe ,8,0,0.0
Dagegen Das nur sowenige kommen,5,1,0.2
Dann schafft man mal neue GesetzeMord Vergewaltigungen sind dann ERLEBNISSE,10,1,0.1
Merkel erklärt unter welcher Bedingung sie zurücktreten würde  httpwwwhuffingtonpostde20170329merkelerklartunterwelcherbedingungsiezurucktretenwurden15679890htmlutmhprefpolitik  Merkel muss zu ihrer Politik stehen können Die Frage hat Angela Merkel jetzt bei einer Buchpräsentation mit der ehemaligen Justizministerin Sabine LeutheusserSchnarrenberger beantwortet Die Kanzlerin erklärte der Welt zufolge was sie zu diesem dramatischen Schritt bewegen könnte Merkel sagte Wenn ich zu der Überzeugung gelange dass es zu einer persönlichen dauerhaften Deformation kommt Der Kanzlerin zufolge müsse sich ein Politiker ständig die Frage stellen wie weit man bei einem Kompromiss gehen könne Einen kompromissfesten Kern wollte sie laut der Welt bei der Veranstaltung nicht definieren Soll wohl heißen Sobald Merkel das Gefühl hat mit ihren eigenen Überzeugungen nicht mehr durchzudringen wird sie sich zurückziehen Die Kanzlerin fügte allerdings hinzu Belassen wir es bei dem Befund dass ich bisher nicht zurückgetreten binALLES LESEN Lady kommentiert  Beispiel SpionageSkandal  Ich erwarte dass die Bundeskanzlerin klare Worte findet sagte Oppermann Müntefering steht offensichtlich im Visier des türkischen Geheimdienstes Erdogan geht weit über das hinaus was wir akzeptieren können  Ich halte fest  USA NSA Abhörskandal gegen die KANZLERIN  Gut wird weggelächelt  Türkei SpionagelisteOpfer Müntefering Schlecht  klare Worte etc  Das ist wie mit den BombenUSA Bomben gutandere Bomben schlecht  Merken die eigentlich da Oben noch wie bescheuert die sind das ist ja vollkommen irre Wolfgang kommentiert  Leere Phrasen als weiterer Akt der Volksverdummung  Eine Narzißtin mit Sonderauftrag zur Vernichtung des eigenen Volkes tritt niemals zurück  Selbst bei einer Abwahl sind da noch Selbstzweifel vorhanden Sylvia kommentiert  Hey Merkel zig 100000 Deutsche sind durch die Politik deiner Regierung persönlich dauerhaft deformiert,253,18,0.07114624505928854
Hier noch der OFFEN BRIEF an die Kanzlerin von Journalist Axel Retz MIGRATION ALS WAFFEhttpwwwtermitennetnode286,15,2,0.13333333333333333
Ich hoffe nur das ihr es in Berlin zur Wahl auch nicht schafft ,13,0,0.0
httpswwwfacebookcommyjsmetudomavideos1915332898695855,1,1,1.0
Keine Wählerstimmen für Schrottparteien,4,0,0.0
Guter Ansatz Guck mal hier kannst du auch Mitglied bei den Grünen werden falls du dich noch mehr engagieren willst httpswwwgruenedeueberunsmitgliedwerdenhtml,21,1,0.047619047619047616
Jammerlappen,1,0,0.0
Mathias Wolf Wir könnten alle den Grünen beitreten dann gibt es dort ein paar die denken können ,17,1,0.058823529411764705
Ich teile doch nicht Ihr Bild mit dem Sie mich auch weiterhin ausgrenzen Da fordere ich doch lieber ein weiteres Mal Lasst mich auch dabei sein  FB barrierefrei Bitte Bilder verschriftlichen  denn auch mich und andere Menschen mit Seheinschränkung interessiert der Inhalt Ihrer Bilder facebookbarrierefrei Mehr Informationen finden Sie unter httpswwwfacebookcomInklusionsbotschafterMErtl,51,6,0.11764705882352941
Dank Dir Andreas Super wärs die Seite würde das gleich mit posten,12,2,0.16666666666666666
Liegt das Problem diesbezüglich auch bei Facebook,7,1,0.14285714285714285
Gibt es da jetzt nicht einen Rechtstreit das die einen meinen man habe gar keine andere Wahl und die anderen meinten doch wegen der Sicherheit,25,1,0.04
Ah ein interessantes ThemaAlso ihr regt euch auf das unsere unverbrauchten Brennstäbe in einem unsicheren AKW benutzt werden wärend unsere relativ sicheren AKWs nicht mehr benutzt werden dürfen Warum regt ihr euch auf Die Brennstäbe lösen sich mit der Abschaltung unserer AKWs nicht in Luft auf Sie sind weiter daglühen vor sich hin und kosten uns nen Haufen Geld da man sie ja weiter kühlen muss In Betrieb hätten die Dinger uns noch lange sauberen Strom geliefert als die Kohle die jetzt mehr verbrannt werden muss um die Leistung eines abgeschalteten AKWs auszugleichen Und an die Atomkraft Nein DankeStickersammlerWenn ihr gerade keine Privatleitung zu einem Windrad habt oder eine Chemiebelastete Solarzelle aufm Dach kleben habt dann muss ich eure Illusion berauben das ihr AtomfreienStrom in eurer Steckdose habtAuch wenn es euer Versorger immer behauptet Euer Strom der gerade euren Computer oder Handy speist hat bestimmt mehr mal ein AKW von innen gesehen Und dann überlegt euch auch mal mit was ihr eure Elektroautos ladetbestimmt mit ordentlicher Kohle aus natürlichem AnbauAbbau,170,16,0.09411764705882353
in jedem Fall werden die verbrauchten Brennstäbe lassen sich nie mehr entsorgen werden unsicher gelagert und können ins Grundwasser gelangen Dann vielleicht besser Leitungen zu Windkraftwerken und chemiebelastete Sollarzellen ausbauen als in Uran zu investieren,35,2,0.05714285714285714
Sage ja nicht das man in weiteres Uran investieren sollWobei Windkraft auch nicht gerade Sauber für Flora und Fauna ist,20,1,0.05
Sven C Shinryaku Das ist wahr Heimische Vogelarten leiden stark darunter und in der Nordsee Walarten Aufgrund der resultierenden Monokulturen und vorkommenden Gasentweichungen gilt das leider auch für die ertragreichste nachwachsende Energieart Biogasanlagen,33,3,0.09090909090909091
Was ich einfach nur sagen willwarum diese Brennstäbe die noch da sind bis in alle Ewigkeit ungenutzt liegen lassen und nur für ihre Anwesenheit zahlen anstatt man diese noch nutzt und diese Zeit auch noch nutzt um weiter die Forschung nach wirklich sauberer Energie Momentan müsste man alleine um das AKW Krümmel mit Windkraftanlagen zu ersetzen ca 270 Windräder bauenund das wäre ein massiver eingriff in die Natur Vielleicht sollte man auch erforschen ob man sich die Strahlung der verbrauchten Brennstäbe irgendwie nutzbar machen kann PS Wenn wir in Sachen Strom sauberer werden wollen dann sollten wir den Verbrauch senken und dann kann man die dreckigen Stromversorger abschalten,108,4,0.037037037037037035
Sven C Shinryaku Das Wort Atommüll ist ohnehin eher ein falscher Begriff denn von dem Uran in den Brennstäben können nur ca 4 verwendet werden die 96  Uran die übrig bleiben bestehen aus Uran 238 und dieses ist für die herkömmlichen Reaktortypen nicht nutzbar Aber dafür gibts die schnellen Reaktoren wie Russland schon lange einen verwendet der wunderbar den Atommüll verwerten kann httpnukleariade20161209stromausatommuellschnellerreaktorbn800imkommerziellenleistungsbetrieb,63,4,0.06349206349206349
Jo hab mir heute mal die Beschreibungen der Reaktoren der 5 Generation durchgelesen Klingen gut aber sobald die Gegner nur das Wort Kernspaltung hören gehen sie auf die Barikaden und holen die ausgelatschten Tschernobyl und Fukushima Schuhe raus Naja Forschung geht ja weiterKernfusionAch warte Kernfusion brauch ja zum Anfang auch eine Kernspaltunggut dann PlasmaMal sehen wann die ersten Plasmareaktoren anlaufenBis dahin haben wir bestimmt noch genug Kohle um die Welt zu verpesten,72,10,0.1388888888888889
Sven C Shinryaku Sind Sie noch derselbe der den obigen Post verfasst hat oder wurden Sie inzwischen ausgetauscht weil Sie zuviel gepöbelt haben ,23,3,0.13043478260869565
Ne wer pöbelt wird Erfahrungsgemäß gesperrt Aber ja ich bin noch der selbe wie da oben Sind denn meine Meinungen der Posts so verschieden Oo,25,4,0.16
Daniel Tarik Günther Und wir verschlafen die Entwicklung  dank Grünen so wie Transrapid gegen den die Grünen immer gehetzt haben,20,1,0.05
Die haben ebend kein Plan Kurzsichtig wie ein Maulwurf Atomkraft Nein Danke Dieselautoverbot in Städten Umwelt muss sauberer werden OkAtomausstieg haben se geschafftNun wollen se das wir alle EAutos fahrenNur woher den Strom beziehe KohleAtomstrom von den Nachbarn kaufen und die Natur mit Windkraftanlagen vollpflastern Grünenlogik,46,10,0.21739130434782608
Bei Mikrorissen in Atomkraftwerken können selbst mit Schutzmaßnahmen radioaktive Strahlung entweichen Man sollte das Kernkraftwerk in Belgien endlich abschalten bevor die Risse größer werden Sonst könnte der Wind diese Strahlung noch nach Deutschland wehen,34,0,0.0
Die Frage ist nicht ob es passiert die Frage ist nur wann es passiert ,14,0,0.0
Das ist ein Kühlturm,4,0,0.0
Ja unsere sicheren AKW s schalten wir ab wir ihr grünes Volk ja immer gefordert habt Sollte es dann nicht reichen kaufen wir Strom aus unsicheren AKW s unserer Nachbarn dazu Was für eine Logik,35,0,0.0
Bisher exportiert die Bundesrepublik Strom jedes Jahr mehr,8,0,0.0
Liegt aber nicht nur am Ökostrom,6,0,0.0
Ja klar können wir noch exportieren Noch laufen unsere AKW s,11,0,0.0
Wir sind wenn man Deutschland betrachtet eh mit ausländischen Reaktoren umkreist Wenn da einer hochgeht macht es keinen Unterschied ob es ein Deutscher Belgischer oder Tschechischer warbeste Beispiel bei mir in NRW ist Terhange Soll ich dann laut den Grünen noch klatschen das es kein deutscher Reaktor ist der mich elendig verrecken lässt Der Atomausstieg hätte nur was gebracht wenn von Anfang an die ganze EU ausgestiegen wäre So ist es einfach nur überflüssig,74,3,0.04054054054054054
Wie immer ist der Atomausstieg bei uns ein Anfang Die anderen müssen folgen und es muss unsere Aufgabe sein sie zu überzeugen Es kann jedenfalls nicht die Lösung sein eigene AKW zu betreiben nur weil die Länder rundum welche betreiben Leider hat jede Art der Stromerzeugung ihre eigenen spezifischen Probleme Und es geht jetzt darum diese so weit möglich zu mindern und die am wenigsten umweltschädliche zu fördern Und am beste ist sowieso Energie einzusparen Da gibt es noch unendlich viele Möglichkeiten Zuerst mal Energieverschwendung mindern Da sind gar keine Komforteibußen zu befürchten,93,2,0.021505376344086023
