ommentmessage,1,1,1.0
Gregor Kreuzer wir zahlen Ökosteuer damit es keinen Klimawandel gibt also schleich dich die Steuer ist nämlich öko Das kann hier gar nicht passieren,24,2,0.08333333333333333
Bernhard Weber Ach stimmt Damit hats sich dann Ökosteuer Passt,10,1,0.1
Gregor Kreuzer Eine Frage hätten ich noch an Sie Sie reden von einer Umweltplakette die für Diesel Autos eingeführt werden soll Meine Frage wäre ob Sie und ihre Partei wirklich an den Erfolg dieser Maßnahme glauben  Ich meine mich zu erinnern dass seit der Einführung der grünen Plakette in so gut wie keiner Stadt eine Verbesserung stattgefunden hat Warum sollte sich das mit der Einführung einer neuen Plakette ändern,69,0,0.0
Dominik Khalifa die sollen mal den Dreck vom Himmel holendann geht es uns viel besser,15,2,0.13333333333333333
Und die Grünen dass es nicht der erste ist,9,0,0.0
Dominik Khalifa Das ist ein bisschen wie beim CO2Zertikatehandel Das Instrument ist gut die Maßstäbe allerdings nicht ausreichend,18,2,0.1111111111111111
Was sagt das Klima eigentlich dazu dass du gern um die Welt fliegst oder dich mit einem Gleitschirm von einem Motorboot in die Luft ziehen lässt Sind Flugzeuge und Motorboote nicht die größten Klimasünder Wie wäre es damit aufzuhören und das Klima aktiv mit Taten zu schützen anstatt nur mit Worten,51,0,0.0
Ich sag ja ein guter Anfang dank euch gibts lungengaengigen feinststaub erst,12,3,0.25
schindluder Stimmt Zu dem Zeitpunkt war ich aber auch noch nicht Grünenmitglied Ich persönlich bin aus Klimaschutzgründen Vegetarier geworden Fahre mit dem Fahrrad zur Uni Ich vermeide Produkte die nicht nachhaltig hergestellt wurden boykottiere Nestle und Tochterunternehmen Ich möchte mir hier auf keinen Fall vorwerfen lassen dass ich mir keine Mühe gäbe Wollen wir weg vom Persönlichen und wieder auf eine Sachebene,62,3,0.04838709677419355
Gregor Kreuzer Die Grünen stehen doch gar nicht mehr für Umweltpolitik sondern für illegale Migration Energiewende um jeden Preis dafür werden auch tausende tote Vögel und Fledermäuse an den Windrädern in Kauf genommen Pfui,34,2,0.058823529411764705
Sven Klinke Hey wie cool dass das grüne Wahlprogramm Firmen in die Verantwortung ziehen möchte Wir sind inhaltlich genau da wo du uns vorwirfst nicht zu sein,27,1,0.037037037037037035
Gregor Kreuzer Gibt es etwas aussagekräftigeres objektiveres sachlicheres als die Taten eines Menschen Mit dem Fahrrad zur Uni zu fahren ist nur dann sinnvoll wenn du in den Semesterferien nicht eine Meile fliegst Falls du aber doch gern um die Welt fliegst dann ist es nichts als ein bisschen Bewegung für ein gutes Gefühl Erst wenn jeder Grüne auf Flüge um die Welt verzichtet ist die angebliche Sorge um die Umwelt glaubhaft,72,2,0.027777777777777776
An alle die behaupten wir seien keine Ökopartei mehr wer kernfusion als forschungsobjekt stoppen will ist keine ökopartei Die grünen bieten uneffiziente lösungen an für ein problem welches jedes jahr akuter wird,32,7,0.21875
schindluder Ich kenne viele Grüne die zwar gelegentlich fliegen dann aber auch den entsprechenden Betrag an atmosfair spenden Wir sind weit weniger hypokritisch als du uns vorwirfst Geh mal zu ner LMV der Grünen Jugend und erlebe die volle Ladung Authentizität ,41,5,0.12195121951219512
und was kommt letztendlich raus aus der SteckdoseMix Nix kein veganer Laktose freier moralisch 101  sauber Strom aus erneuerbaren Energien Ich mag als aktiver Radfahrer gut nutzbare Wege Tempolimit in der Stadt Häuser energieeffizient gedämmt Recycling ectkeine industrielle Landwirtschaft Tierrechte uswaber innenpolitisch haben Teile innerhalb der Grünen in den letzten Jahre diese Partei unsympathisch für die so wichtigen Kernthemen gemacht,60,9,0.15
Timo Kleine So ein Quatsch Atomenergie ist keine Alternative zu Fossilen Es stellt ein Risiko für sich dar Fukushima und Tschernobyl sind traurige Beispiele dafür Was willst du eigentlich mit dem Atommüll machen,33,2,0.06060606060606061
grego kreuzer Kernfusion  Kernspaltung in der Kernfusion wird versucht WasserstoffAtome gegeneinander zu beschleunigen damit daraus helium entsteht Bei der Kernspaltung hingegen schießt man Neutronen gegen uranatome,26,5,0.19230769230769232
Gregor Kreuzer klar spenden die Grünen dann für atmosfair das ist der moderne Ablasshandel So kann man mit gutem Gewissen die Umwelt zerstören Man nennt es Wasser predigen und Wein saufen und zwar weil man sich den Wein leisten kann So wie man sich auch den Ökostrom und das Elektroauto für das eigene Gewissen leisten kann Frag mal Hartz 4 Empfänger was sie von den steigenden Stromkosten aufgrund der Ökopauschale halten Glaubwürdig ist man erst wenn man zu Gunsten der eigenen Sache auf Luxus verzichtest Nur bist du und deine Partei dazu bereit,93,2,0.021505376344086023
Wenn es den gibt  dann gibt es den mit oder ohne den Grünen,13,0,0.0
Gregor Kreuzer genau da hebnw ir das problem sie haben keine ahnung von kernfusionstechnik aber entscheiden was damit getan werden soll als politiker Bei der kernfusion etsteht ein Heliumisotop welches innerhalb von stunden kaum noch radioaktiv ist und das noch in so kleinen mengen dass man es problemlos in die atmosphäre lassen kann Das einzige was so mäßig verstrahlt wird ist der reaktor der nur extrem selten ausgetauscht werden muss garnicht vergleichbar mit der kernspaltungstechnik dazu noch sicher weil es jederzeit abschaltbar ist Sehen sie die grünen haben einfch auch keine ahnung vond em was sie verbieten wollen oder es ist ihnen egal,103,19,0.18446601941747573
Auf dem Mond ist jede Menge Platz für Atommüll und die Grünen können von mir aus gerne auf halber Strecke eine Sitzblockade installieren,23,0,0.0
schindluder Ich habs doch eben ausgeführt Ich verzichte auf viel Ich fand fleisch geschmacklich immer lecker kann es aber weder ökologisch noch ethisch vertreten Einen Flug nach Neuseeland konnte ich mir nach dem Abi auch nur leisten weil ich lange darauf gespart hab Und warum zur Hölle sollte man nicht an Atmosfair spenden Nur weil der Papst das nicht cool findet Schau lieber mal auf den Effekt Die meisten in der Partei können sich nur wenig vorwerfen lassen Ja Besserverdienende wählen grün so what Wusstest du eigentlich dass die Bürgerinnenenergiewende sozial VIEL besser ist als jede konventionelle Energieform Günstiger und Ökologischer Würden wir nicht die großen Vier subventionieren die in ihre eigene Tasche wirtschaften sondern Energiegenossenschaften besser fördern die Rendite für alle Partizipatoren bringen könnten sogar Hartz 4Empfänger an ihnen teilhaben Das ist kurzfristig umsetzbar und kann sogar einen Teil zur Umverteilung leisten Natürlich sollte man auch in langfristige vielversprechende Projekte investieren Sorry hatte mich bei Kernfusion verlesen Aber bis das bereit ist wird es noch eine Weile dauern Solang sollte man die Energiewende nicht dem Zufall überlassen,178,13,0.07303370786516854
an dieser stelle finde ich es auch so putzig wie Politikwissenschaftler entscheiden wollen was im bereich energietechnik tolle lösungen wären die frau merkel hat wenigstens physik studiert und hat auch im bereich technologie entscheidungen getroffen die ich akzeptabel finde bis gut Bei usn im land sitzt da auch so eine gründe keine ahnung von nichts aber wendelstein 7X muss auf jedenf all auf eis gelegt werden weild as ja das SPDCDU prestige projekt ist hauptsache dagegen hauptsache gegen die forschung Gegen gentechnik wirbt man ja am besten mit angst gegen kernfusion funktioniert angst nicht so gut da wirbt mand amit dass es teuer sei lächerlich,105,28,0.26666666666666666
Nen völkerwandel gibt es Ganz massiv,6,2,0.3333333333333333
Ulrich Schwirtz Der mond ist kein gutes endlager die rakete die das hoch bringt braucht nur explodieren dann ahben wir den mist in der atmosphäre Transmutation istd as stichwort mit transmutation radioaktiver isotope macht man dena tommüll innerhalb von Minuten unschädlich,41,15,0.36585365853658536
Gregor Kreuzer Aber bis das bereit ist ähm ich will mal sagen dass das ganze nur gedeckelt ist durch das geld die amerikaner haben da noch militärische forschung dranhängen udn so viel geld zur evrfügung die könnten das in den nächsten 20 jahrens chaffen Kernfusionskraftwerke fügen sich auch wesentlich besser in die bestehende ifrastruktur ein da muss man nicht millionen neue strukturen schaffen mit energiespeichern und so damit das netz mit den schwankungen der alternativen energien klar kommt und nicht die komplette stromversorgung gefährdet,84,18,0.21428571428571427
Timo Kleine Der Mond ist ein super Endlager alleine wegen der grünen Sitzblockaden,13,1,0.07692307692307693
Timo Kleine Die meisten MdBs sind übrigens Juristen Lernt man wenn mal PoWi studiert Ich bin übrigens nicht im Bundestag und strebe das bis jetzt noch nicht an deshalb ist der Vorwurf absurd Wissentschaftlerinnen und andere Expertinnen arbeiten den MdBs zu und tragen zur Entscheidungsfindung bei Du stellst politische Vorgänge hier extrem vereinfacht dar Und ich will dich darauf hinweisen dass wir auch viele Wissenschaftlerinnen auf unserer Seite haben Grüne Energien sind keine Minderheitenposition,74,5,0.06756756756756757
Gregor Kreuzer Ich komme aus RLP dort gibtgab esceine wunderschöne Landschaft den Hunsrück bis die ersten Winräder dort gebaut worden sind Wissen sie wie es mittlerweile dort aussieht Windräder über Windräder von der schönen Landschaft ist nichts absolut nichts mehr übrig Unter jedem der Windräder finden sie tote Vögel ist es das was sie unter Grüner Politik verstehn Ich dachte immer ihr setzt euch für die Natur ein aber ihr zerstört sie und das ist Fakt,76,5,0.06578947368421052
Lukx Hardy Ich finde ja Kohle und Atomkraftwerke viel ansprechender Und die sind ja bekanntlich auch total unproblematisch ökologisch Ich würde vorschlagen dass du dich noch ein bisschen mehr mit Windkraft auseinandersetzt als Da findet man tote Fledermäuse drunter Die Debatte ist auch bei uns aktiv  beispielsweise ist es nicht sinnvoll Windkraftwerke im Wald zu bauen Die Auswirkungen auf Ökosysteme lassen sich stark eindämmen,64,2,0.03125
Ja und es gab ja in der Weltgeschichte auch nie Klimawandel zu glauben das wir Menschen das verhindern bzw Aufhalten können ist genauso wenig bewiesen wie die Tatsache das wir dafür verantwortlich sind also eine Politik auf Thesen gestütztRespektgott sei dank denken nicht mal mehr 5  so,47,2,0.0425531914893617
Kevin Poell 99 der Wissenschaftlerinnen sind auf unserer Seite Aber ist ja nicht erwiesen,14,2,0.14285714285714285
Gregor Kreuzer Dir wird sicherlich klar sein dass du das ganze Jahr über jeden Tag Rind essen kannst und damit weniger umweltschädlich agierst als mit einem einzigen Langstreckenflug der Rückflug ist da noch nicht einmal drin Und nun überleg mal was wohl die ganzen Besserverdiener in ihrem Urlaub machen Was gehört wohl zum Lieblingszeitvertreib Genau es ist das Um die Welt fliegen Du meinst die meisten können sich wenig vorwerfen lassen Schau mal nach Statistiken bei denen man aufdröselt welche Parteien am meisten fliegen Die Antwort könnte dich verunsichern Der Grüne an sich ist einfach nicht glaubwürdig da er ausschließlich Dinge fordert die ihn selbst nicht tangieren und wofür andere aufkommen dürfen Und genau das ist das Problem deiner Partei Die Idee die Umwelt zu schützen ist ehrenwert Schön wäre es wenn die Grünen hierbei mit gutem Beispiel vorangehen und andere durch Vorbildfunktion überzeugen würden und nicht durch Verbote dazu zwingen möchten Versuch das mal in deine Partei reinzubringen Verzichtete doch einfach einmal alle in diesem Jahr auf eure Urlaubsflüge Das wäre mal ein glaubwürdiges Zeichen zum Umwelt und Klimaschutz Was schätzt du wie hoch wird die Zustimmung in deiner Partei dazu sein,193,5,0.025906735751295335
Gregor Kreuzer Frau Roth hat uns mal erklärt das die Energiewende 1ctkwh kosten wird Mittlerweile werden jährlich 350000 mal Stromanschlüsse gesperrt da sich die Menschen den Strom nicht mehr leisten können Statt Schulden zu tilgen füttern wir 1000000 neue Mitbürger mit durch welche noch nie einen Taler in den großen Topf eingezahlt haben Habt ihr auch Lösungen oder fordert ihr nur,61,3,0.04918032786885246
schindluder Liest du eigentlich was ich schreibe Ich fliege nicht Ich kenne die Daten von denen du mir vorwirfst sie nicht zu kennen Und die Grünen die ein Flugzeug betreten kennen es meistens auch Und setzen es dann in der Form um dass sie ihren CO2Footprint nivellieren Und du tust so als gäbe es nur unter Grünenpolitikerinnen inkonsequente Menschen Wie siehts mit der CDU aus die keine christliche Politik macht auch Mitglieder anderer Religionen hat und sicher nicht alle jeden Sonntag in die Kirche gehen Wie mit der SPD die große Teil unsozialer Politik mitzuverantworten hat Greif uns inhaltlich an Nicht persönlich Nur so kommen wir zu einem Ergebnis,109,5,0.045871559633027525
Das ist Schwachsinn und kann nur von Technik Versagern kommen Das ist zu 90 nicht möglich Und das ein Konzern bei einem Auto das 25000 gekostet hat und an dem er ca 56 Rendite gemacht hat noch mal 35004500 nachträglich rein stecken soll ist wirtschaftlich Blödsinn,46,1,0.021739130434782608
Die meisten Kommentierenden haben aber nicht vergessen dass ihr absolut nicht gebraucht werdet,13,0,0.0
Gregor Kreuzer das Boot welches Sie beim Parasailing in Thailand hinterher gezogen hat Wie umweltverträglich war dies eigentlich,18,2,0.1111111111111111
Korrigiere Neuseeland Nicht Thailand,4,0,0.0
Mark Art ach komm sowas ist doch pipifax trittin fährt eiskalt in einem VW Diesel Bus durch die gegend mit irgendwas bei 10lkm So macht man das richtig Kretschmann fährt natürlich im dicken audi durch die gegend das hat dann natürlich stil wenn man den golf als benziner kaufen will um zur arbeit zu kommen dann soll man doch darauf bitte verzichten wenn es auch einen bus gibt oder man kann seinen wagen nur noch zulassen wenn er elektrisch fährt DAS ist dreist nicht irgendein urlaub eines abiturienten,88,15,0.17045454545454544
Timo Kleine Ich stimm dir da zu ich find das auch uncool Ich kann die beiden aber nicht dazu zwingen das richtige Verhalten einzunehmen ich kann nur an sie appellieren Genau wie ich an andere Menschen appeliere sich vegetarisch zu ernähren Ich kann und will sie aber nicht dazu zwingen Macht das unsere Inhalte einen Deut schlechter,57,5,0.08771929824561403
Gregor Kreuzer natürlich sind in allen Parteien inkonsequente Menschen nur war es schon immer so dass man an den Klerus höhere moralische Maßstäbe anlegte Und der Klerus unserer Zeit ist nunmal BÜNDNIS 90DIE GRÜNEN Wer immer mit dem Zeigefinger argumentiert darf sich halt nicht darüber beschweren wenn andere eben jenen Zeigefinger in die Wunde legen Natürlich lese ich was du schreibst und es ist ja schön dass sich Grüne ihre Umweltsünden mit modernen Ablassbriefen vergeben lassen Nur ändert es nichts daran dass sie die Umwelt aufgrund des eigenen Luxusbedürfnisses zerstören Der Unterschied zwischen einem Grünen und einem Normalsterblichen ist schlicht dass sich diese den Ablassbrief häufig nicht leisten können Deswegen bleibt am Ende doch die Frage warum ein Grüner um die Welt fliegt wenn er doch weiß dass Flüge die Umwelt zerstören Wo ist dies ein persönlicher Angriff Du erklärst dass Grüne vorsätzlich ein Flugzeug besteigen wissen dass sie damit die Umwelt zerstören aber sich dies halt leisten können Und ich weiße nur darauf hin dass man damit das Wasser predigen Wein trinken Schema bedient Das ist kein Angriff sondern eine Tatsache Ebenso wie es ja kein Angriff ist dass Flugreisen zu den größten Umweltsünden gehören Dies ist schlicht eine Tatsache Wenn du damit nicht klar kommst und weiterhin erklären möchtest dass man es sich als Grüner aber leisten kann weil man ja CO2Ablassbriefe kauft dann ist das ok Denn dann ist es exakt das wie man sich allgemein einen Grünen vorstellt Taten definieren Menschen nicht Worte im Parteiprogramm,249,4,0.01606425702811245
Herr Kreuzer Windräder und Solaranlagen erzeugen nutzlosen wetterabhängigen StromMüll der nur auf dem Papier so günstig erscheint weil man alle Kosten die für eine zuverlässige Stromversorgung anderen aufs Auge drückt Ich weiß ja nicht in welcher Welt Sie leben aber die Energiewende wird definitiv scheitern Davor haben wir die Natur zerstört den Menschen das Geld aus der Tasche gezogen und einen gestiegenen Co2Ausstoß zu verzeichnen Da ist nix mit sozial und ökologisch Und jede neue Anlage erzeugt noch mehr nutzloser Überschuss der nicht gespeichert werden kann weil wir auf absehbare Zeit keine bezahlbare Speicher haben werden Wenn Sie sich ums Klima sorgen dann brauchen wir Kernkraft der neusten Generation ohne gefährlicher Müll und nicht explosionsgefährdet Ansonsten garantiere ich Ihnen dass Sie vor dem Scherbenhaufen ihrer Ideologie stehen werden Nochwas zu den Autos Die Lebenserwartung steigt rasant und ist in Städten wie Stuttgart besonders hoch Früher durften Autos 500 Mikrogramm ausstoßen heute nur noch 80 Und dann bricht gleich die Panik aus wenn es mal 100 sind Durch diese irren Grenzwerte wurde ein Problem erschaffen das es gar nicht gibt und die Grünen bedienen sich mal wieder an dumpfen Parolen Aber dafür gibts halt die Quittung,195,9,0.046153846153846156
schindluder Ablassbriefe waren vor der Reformation sinnlose Stücke Papier die zur göttlichen Vergebung angeblicher Sünden genutzt wurden und hinterrücks dem Luxus des Klerus galt Eine Spende an Atmosfair hat hingegen einen realen Nutzen Ich akzeptiere diesen absurden Vergleich nicht Politik sollte sich nicht an Personen sondern an Inhalten konzentrieren Du verdrehst da was,53,2,0.03773584905660377
Anna Lausitz die Grünen veranstalten regelmäßig Seminare zum Thema Energiepolitik Stellen Sie sich doch der Diskussion mit unseren Expertinnen Die freuen sich schon auf Sie ,25,1,0.04
Den Atommüll könnte man prima recyclen httpnukleariade20161209stromausatommuellschnellerreaktorbn800imkommerziellenleistungsbetrieb,7,2,0.2857142857142857
Gregor Kreuzer Wie sollen eigentlich die kleinen Arbeiter den Strom und die Heizkosten noch bezahlen Die Reichen stört das nichtaber davon wählen wohl die meisten nicht die Grünen wählen Die die euch wählen würden vergrault ihr euch durch kaum noch bezahlbare EnergiepreiseAtomausstieg ist ja ganz gut Nur wir kleinen Bürger sind kaum noch in der Lage das alles zu bezahlen Übrigens hier auf dem Land ist eine Fahrt mit öffentl Verkehrsmitteln purer Luxus Und seht bitte mal zudass Tierquälerei mal härter bestraft wird Und mir ist es egal ob sein Land sicher istein Vergewaltiger der hier Asyl sucht hat sein Gastrecht aber sowas von verwirkt Er hatte ja die Wahl ob er das macht oder nicht Da seid ihr auch meilenweit entfernt von der Meinung vieler Menschen Jeder ist willkommen aber wer hier straffällig wird muss raus,137,8,0.058394160583941604
Tja aber Sie sind kein Experte Herr Kreuzer Sie sind eher ein Ideologe,13,1,0.07692307692307693
Jau und Deutschland kann den aufhalten wie dumm muss man sein,11,1,0.09090909090909091
Gregor Kreuzer Ob du den Vergleich akzeptierst oder nicht ist schlichtweg egal Tatsache ist dass Grüne zu Gunsten der Umwelt auf keinen Luxus verzichten sondern schön mit gutem Gewissen um die Welt fliegen weil sie an Atmosfair spenden Klar sollte man sich bei Politik an Inhalte und nicht an Personen halten nur was ist eine Partei wert welche sich vorgeblich um die Umwelt sorgt wo aber jedes Mitglied die Umwelt wissentlich und vorsätzlich aus Luxusgründen zerstört Politik ist in erster Linie Glaubwürdigkeit und du zeigst ja die ganze Zeit glaubwürdig Grüne sind,92,1,0.010869565217391304
schindluder Auch du bist herzlich eingeladen mal zu einem Treffen eines Grünen Ortsverbandes zu gehen und richtig mit den Menschen zu sprechen Überzeugen dich selbst Den Grünen vorzuwerfen sie hätten kein Umweltbewusstsein ist absurd Du hängst dich total am Flugzeug fest,41,1,0.024390243902439025
Gregor Kreuzer  Sie sollten sich wirklich mal um Probleme kümmern statt zu gendern siehe Ihren Kommentar weiter obendiese  brauchen wir wien Loch im Kopp sonst kommt von Euch nix schaut Euch doch mal in D um Massentierhaltung Megaschlachthöfe Küken werden geschreddert Monsanto Gentechnik to be continued aber Ihr müsst ja gendern das ist ja sooooooooooo wichtig,56,13,0.23214285714285715
Katja Fuchs Bringen Sie die Themen nicht durcheinander Ich gender für mich selbst weil mich die Studien zum Zusammenhang zwischen Sprache und Weltbild überzeugt haben Zwischen Engagement gegen Tierquälerei und Gendern besteht kein Zielkonflikt Wenn ich das kurz demonstrieren darf Tierquälerinnen sind scheiße Kükenschreddernde sind Verbrecherinnen Feminismus und Tierschutz sind zwei verschiedene Themen,53,5,0.09433962264150944
Ich kenne diese ganzen Experten Entweder haben die selbst mit den Investoren zu tun und stecken tief im Subventionssumpf oder es sind Leute die immer wieder die gleichen Fehler machen Und selbst wenn ich sie in mühsamer Kleinstarbeit überzeugt habe können sie nicht davon ab weil sie dann völlig konträre Politik machen müssten Das würde die Grünen innerlich zerreißen Aber je länger man an dieser Lüge festhält desto größer wird der Schaden für Mensch und Umwelt,76,1,0.013157894736842105
Gregor Kreuzer  den großen Unterschied zwischen Fleischverzehr und vegetarischer Ernährung hätte ich dann doch gerne gewusst Milchwirtschaft und alles was hinten dran hängt die Kälbchen werden sofort nach der Geburt der Mutter entrissen und die Mutter marschiert auch ins Schlachthaus wenn sie die Quote nicht mehr bringtwo also ist der Unterschied Dummes Geschwätz das alles und alle fallen wieder drauf rein,61,2,0.03278688524590164
 und das seit ca 4 Milliarden Jahren  ,7,1,0.14285714285714285
Gregor Kreuzer Ja unf wir fahren dann mit dem Strom aus der Steckdose ,13,1,0.07692307692307693
Genaumit der kranken Oma auf dem Gepäckträger zum ArztIhr seit so Wasser predigen und Wein saufenund tschüss ,17,3,0.17647058823529413
Gregor Kreuzer Eigentlich hoffe ich immer auf Fortschritt und nicht auf eine Wende man sollte sich doch weiter entwickeln und nicht zurück gehen Das sollte man auch nicht ausser Acht lassen httpswwwweltdewirtschaftarticle162600538DieEnergiewendedrohtzumoekonomischenDesasterzuwerdenhtml,32,2,0.0625
Martin Krause Dümmer geht nimmer,5,0,0.0
Gregor Kreuzer viel Platz haben wir nicht mehr Ich wäre für Gas Sonnenenergie und viele kleine Pumpspeicherkraftwerke Könnte man auch im Altmühltal realisieren Oben auf dem Berg sind zahlreiche Steinbrüche daraus könnte man Speicherbecken machen,35,1,0.02857142857142857
Nein euch geht es darum alles deutsche zu zerstören,9,0,0.0
Gregor Kreuzer Die Inhalte können nur so gut sein wie die Politiker die sie verkörpern Bei der Regierenden fällt derzeit auf dass sie ganz was anderes machen als sie uns predigen,31,0,0.0
Vorstand der Bündnis90Die Grünen München geht nicht um Recht oder Unrecht in der Einwanderungsdebatte uns geht es zuerst um die Zurückdrängung des deutschen Bevölkerungsanteils in diesem Land,27,2,0.07407407407407407
Gregor Kreuzer warum macht man nicht einfach eine Reform wenn man von Bürgern redet dann sind doch nicht nur männliche Bürger gemeint warum muss man unbedingt die weibliche Mehrzahl dazu schreiben Man schreibt doch auch nicht Kinder und Kinderinnen ,39,1,0.02564102564102564
Gregor Kreuzer Noch ein Problem der Wende httpswwwweltdewirtschaftarticle161831272DieDunkelflautebringtDeutschlandsStromversorgungansLimithtml,8,1,0.125
Joschka Fischer Bündnis90Die Grünen Rezension zu seinem Buch Deutschland Die Welt 07022005 muss von außen eingehegt und von innen durch Zustrom heterogenisiert quasi verdünnt werden,25,4,0.16
Es gibt keinen Klimawandel Zumindest nicht von Menschen verursacht  Es ist und bleibt nur eine These Es gibt keine Beweise dafür und keine Bestätigung,24,0,0.0
Martin Krause ignorant,3,0,0.0
Ob sie sich selbst ab und an auch Mal auf die Nerven gehen mit Ihrem Scheiß Nichts ist weltfremder als ein Grüner,22,0,0.0
Gregor Kreuzer Ach die Grünen sind gegen das Schächten Woher haben Sie das denn Tierschutz ich lach mich tot,19,0,0.0
und genau an dieser ewig alten Leier geht ihr zugrunde Es gibt weitere und derzeit wichtigere Themennur Schade wenn man es nicht mitbekommt ,23,1,0.043478260869565216
Wäret ihr doch bloß nur ne ökopartei würden euch bestimmt mehr Leute wählen Wenn ich schon daran denke wie ihr damals auf den Polizisten rumgehackt habt dann könnte ich im Strahl kotzen ,32,4,0.125
dann sollte chäm ötzdemir und co für Klimawandel und andere wichtige politik für die brd machen und keine Zeit verschwenden für eine Politik das sie überhaupt nichts angeht,28,5,0.17857142857142858
